Category URL,Title,Details URL,Category,Image URl,Description
http://www.toronto4kids.com/Article-Archive/index.php?cp=3&si=20&tagID=283,Cavalia's Odysseo Returns to Toronto,http://www.toronto4kids.com/January-2015/Odysseo-by-Cavalia-Returns-to-Toronto/,Kids Entertainment News,http://www.toronto4kids.com/images/cache/cache_5/cache_5/cache_3/cavalia-lead-1d1c5355.jpeg,January 2015,"Three years after its smash 18-week debut run in Toronto, Odysseo by Cavalia returns. The world’s largest touring production will be presented under the White Big Top starting April 8."
http://www.toronto4kids.com/Article-Archive/index.php?cp=3&si=20&tagID=283,Snow Angel at YPT,http://www.toronto4kids.com/January-2015/Quest-Theatres-Snow-Angel-at-YPT/,Kids Entertainment News,http://www.toronto4kids.com/images/cache/cache_b/cache_6/cache_2/snow-angel-ypt-410e626b.jpeg,January 2015,Celebrate the magic of Winter and the ripple effect of kindness in one little girl’s neighbourhood with Quest Theatre’s production of Snow Angel.
http://www.toronto4kids.com/Article-Archive/index.php?cp=3&si=20&tagID=283,Chuggington Live!,http://www.toronto4kids.com/January-2015/CHUGGINGTON-LIVE-The-Great-Rescue-Adventure/,Kids Entertainment News,http://www.toronto4kids.com/images/cache/cache_0/cache_b/cache_8/chuggington-live-20cd28b0.jpeg,January 2015,CHUGGINGTON LIVE! is a musical featuring many new songs alongside hit songs from the TV series. The show features beautifully designed Chuggington train carriages live on stage!
http://www.toronto4kids.com/Article-Archive/index.php?cp=3&si=20&tagID=283,Maple Leaf Monster Jam Tour 2015,http://www.toronto4kids.com/January-2015/Maple-Leaf-Monster-Jam-Tour-2015/,Kids Entertainment News,http://www.toronto4kids.com/images/cache/cache_3/cache_d/cache_9/monster-jam-2015-8e8699d3.jpeg,January 2015,"Monster Jam® is the perfect sports and entertainment mixing racing, showmanship, and the ultimate fan experience into one incredible, action packed live show."
http://www.toronto4kids.com/Article-Archive/index.php?cp=4&si=30&tagID=283,Cineplex Family Favourites January,http://www.toronto4kids.com/January-2015/Cineplex-Family-Favourites-January/,Kids Entertainment News,http://www.toronto4kids.com/images/cache/cache_9/cache_2/cache_8/cineplex-january-9ea1c829.jpeg,January 2015,Join Cineplex on Saturday mornings at 11:00 am for Family Favourites. Watch a family favourite film each week for only $2.99. Here's the line up for January 2015.
http://www.toronto4kids.com/Article-Archive/index.php?cp=4&si=30&tagID=283,Gumby Turns 60,http://www.toronto4kids.com/December-2014/Gumby-The-Worlds-Original-Clayboy-Turns-60/,Kids Entertainment News,http://www.toronto4kids.com/images/cache/cache_f/cache_7/cache_1/gumby-ee33517f.jpeg,December 2014,The timeless adventures of Gumby return to television this January as TELETOON Retro brings the world’s original clayboy back with newly re-mastered episodes from the ’50s and ’60s.
http://www.toronto4kids.com/Article-Archive/index.php?cp=4&si=30&tagID=283,Disney's Cinderella (2015),http://www.toronto4kids.com/December-2014/Disneys-Cinderella-2015/,Kids Entertainment News,http://www.toronto4kids.com/images/cache/cache_e/cache_0/cache_9/cinderella-2015-lead-51f6a90e.jpeg,December 2014,"We're getting very excited about Kenneth Branagh's Cinderella movie, especially now that there are brand new character posters. Walt Disney Studios has unveiled another glimpse into the world of Cinderella."
http://www.toronto4kids.com/Article-Archive/index.php?cp=4&si=30&tagID=283,Song of the Sea at TIFF,http://www.toronto4kids.com/December-2014/Song-of-the-Sea-at-TIFF/,Kids Entertainment News,http://www.toronto4kids.com/images/cache/cache_9/cache_c/cache_d/song-of-the-sea-intro-668c4dc9.jpeg,December 2014,"A captivating animated film steeped in the wondrous worlds of Irish myth. Inspired by the legend of the ""selkies"" - magical beings who live as seals in water and humans on land."
http://www.toronto4kids.com/Article-Archive/index.php?cp=4&si=30&tagID=283,Cineplex Family Favourites December,http://www.toronto4kids.com/December-2014/Cineplex-Family-Favourites-December/,Kids Entertainment News,http://www.toronto4kids.com/images/cache/cache_4/cache_6/cache_e/cineplex-december-daa6ae64.jpeg,December 2014,Join Cineplex on Saturday mornings at 11:00 am for Family Favourites. Watch a family favourite film each week for only $2.50. It's a fun and affordable way to enjoy the weekend with your family!
http://www.toronto4kids.com/Article-Archive/index.php?cp=4&si=30&tagID=283,Disney Live! Mickey’s Music Festival,http://www.toronto4kids.com/December-2014/Disney-Live-Mickeys-Music-Festival/,Kids Entertainment News,http://www.toronto4kids.com/images/cache/cache_e/cache_f/cache_8/disney-live-6a2188fe.jpeg,December 2014,"Mickey Mouse and his band of friends, Minnie Mouse, Donald Duck, and Goofy will be performing in a music mash-up of mega proportions when Disney Live! debuts in Toronto."
http://www.toronto4kids.com/Article-Archive/index.php?cp=4&si=30&tagID=283,James & the Giant Peach Extended,http://www.toronto4kids.com/November-2014/Beloved-Childrens-Classic-James-and-the-Giant-Peach-Extended-at-YPT/,Kids Entertainment News,http://www.toronto4kids.com/images/cache/cache_2/cache_b/cache_4/james-giant-peach-extended-76c6c4b2.jpeg,November 2014,Young People’s Theatre is thrilled to announce that the musical James and the Giant Peach has just been held over for a second time due to overwhelming audience demand.
http://www.toronto4kids.com/Article-Archive/index.php?cp=4&si=30&tagID=283,Disney On Ice: Treasure Trove,http://www.toronto4kids.com/November-2014/Disney-On-Ice-presents-Treasure-Trove/,Kids Entertainment News,http://www.toronto4kids.com/images/cache/cache_8/cache_f/cache_7/treasure-troves-intro-c23407f8.jpeg,November 2014,"With eight movies and more than 50 Disney characters featured, Feld Entertainment’s Disney On Ice presents Treasure Trove has a story for every generation."
http://www.toronto4kids.com/Article-Archive/index.php?cp=4&si=30&tagID=283,Cineplex Family Favourites November,http://www.toronto4kids.com/November-2014/Cineplex-Family-Favourites-November/,Kids Entertainment News,http://www.toronto4kids.com/images/cache/cache_8/cache_8/cache_5/rango-family-favourites-cineplex-november-eaafb588.jpeg,November 2014,Join Cineplex on Saturday mornings at 11:00am for Family Favourites. Watch a family favourite film each week for only $2.50. It's a fun and affordable way to enjoy the weekend with your family!
http://www.toronto4kids.com/Article-Archive/index.php?cp=4&si=30&tagID=283,Ross Petty Presents Cinderella,http://www.toronto4kids.com/October-2014/Ross-Petty-Presents-Cinderella-The-Gags-To-Riches-Family-Musical/,Kids Entertainment News,http://www.toronto4kids.com/images/cache/cache_0/cache_4/cache_3/cinderella-petty-lead-3-af602340.jpeg,October 2014,"Get ready to have a ball with CINDERELLA, The Gags To Riches Family Musical, a shoe-in for this holiday season! Cinderella is Ross Petty's 19th theatrical holiday extravaganza!"
http://www.toronto4kids.com/Article-Archive/index.php?cp=5&si=40&tagID=283,New Series Max & Shred,http://www.toronto4kids.com/October-2014/YTV-Introduces-New-Buddy-Comedy-Series-Max-Shred/,Kids Entertainment News,http://www.toronto4kids.com/images/cache/cache_7/cache_1/cache_4/max-shred-e9bf8417.jpeg,October 2014,"YTV is bringing its viewers straight to the snow-covered slopes in a new hilarious buddy comedy Max & Shred, about an unlikely friendship between superstar snowboarder and genius inventor."
http://www.toronto4kids.com/Article-Archive/index.php?cp=5&si=40&tagID=283,Cineplex Family Favourites October,http://www.toronto4kids.com/October-2014/Cineplex-Family-Favourites-October/,Kids Entertainment News,http://www.toronto4kids.com/images/cache/cache_f/cache_6/cache_6/despicable-me-2-family-favourite-a411866f.jpeg,October 2014,Join Cineplex on Saturday mornings at 11:00am for Family Favourites. Watch a family favourite film each week for only $2.50. It's a fun and affordable way to enjoy the weekend with your family!
http://www.toronto4kids.com/Article-Archive/index.php?cp=5&si=40&tagID=283,"The Ready, Steady, Wiggle! Tour",http://www.toronto4kids.com/September-2014/The-Ready-Steady-Wiggle-Tour/,Kids Entertainment News,http://www.toronto4kids.com/images/cache/cache_4/cache_9/cache_5/wiggles-tour-cadfb594.jpeg,September 2014,"The Wiggles, are bringing their ""catchy brand of preschool pop"" back to North American audiences with the ""Ready, Steady, Wiggle"" tour. This Fall, the quartet will delight families across the country."
http://www.toronto4kids.com/Article-Archive/index.php?cp=5&si=40&tagID=283,Fall Movie Guide 2014,http://www.toronto4kids.com/September-2014/Fall-Movie-Guide-2014/,Kids Entertainment News,http://www.toronto4kids.com/images/cache/cache_e/cache_6/cache_b/fall--movie-guide-1157ab6e.jpeg,September 2014,"While Summer is usually the blockbuster season for films, we've got our sights on the Fall season. Here's a preview of the best releases that you can watch with the kids as Fall foliage and cooler evenings come to town."
http://www.toronto4kids.com/Article-Archive/index.php?cp=5&si=40&tagID=283,New Dora and Friends Series,http://www.toronto4kids.com/September-2014/New-Dora-and-Friends-Series/,Kids Entertainment News,http://www.toronto4kids.com/images/cache/cache_e/cache_7/cache_2/dora-and-friends-75d7127e.jpeg,September 2014,"Global phenomenon Dora sets off on her next big adventure in Dora and Friends: Into the City!, a brand-new animated preschool series starring the Latina heroine in new adventures, with new friends."
http://www.toronto4kids.com/Article-Archive/index.php?cp=5&si=40&tagID=283,New Thomas the Train Movie,http://www.toronto4kids.com/September-2014/New-Thomas-the-Train-Feature-Length-Movie-Tale-Of-The-Brave/,Kids Entertainment News,http://www.toronto4kids.com/images/cache/cache_d/cache_1/cache_0/thomas-tale-of-the-brave-4084e01d.jpeg,September 2014,"All Aboard for the New Thomas & Friends™ feature length movie ‘Tale Of The Brave’ available on digital HD on September 9 and on Blu-ray™ combo pack with DVD, Digital HD, and Ultraviolet™ on September 16."
http://www.toronto4kids.com/Article-Archive/index.php?cp=5&si=40&tagID=283,New Teletoon Series: Trucktown,http://www.toronto4kids.com/September-2014/Treehouse-Debuts-New-Preschool-Series-Trucktown/,Kids Entertainment News,http://www.toronto4kids.com/images/cache/cache_5/cache_8/cache_e/trucktown-d80e1e85.jpeg,September 2014,"Corus Entertainment’s preschool channel Treehouse is revving up to premiere Trucktown, a rough and tumble series that follows a group of rambunctious young trucks in their ultimate playground."
http://www.toronto4kids.com/Article-Archive/index.php?cp=5&si=40&tagID=283,Gotta See It: Teletoon Fall Slate,http://www.toronto4kids.com/September-2014/Gotta-Gotta-See-It-TELETOON-Launches-2014-Fall-Slate/,Kids Entertainment News,http://www.toronto4kids.com/images/cache/cache_c/cache_f/cache_6/teletoon-fall-2014-7e4596fc.jpeg,September 2014,"This Fall, TELETOON viewers are in for a treat as the network announces its Fall lineup with the anticipated return of the Emmy award-winning original animated series, Adventure Time and the debut of new series."
http://www.toronto4kids.com/Article-Archive/index.php?cp=5&si=40&tagID=283,Cineplex Family Favourites September 2014,http://www.toronto4kids.com/September-2014/Cineplex-Family-Favourites-September/,Kids Entertainment News,http://www.toronto4kids.com/images/cache/cache_e/cache_c/cache_7/hugo-cineplex-movie-favourites-98d317ce.jpeg,September 2014,Join Cineplex on Saturday mornings at 11:00am for Family Favourites. Watch a family favourite film each week for only $2.50. It's a fun and affordable way to enjoy the weekend with your family!
http://www.toronto4kids.com/Article-Archive/index.php?cp=5&si=40&tagID=283,2014 CNE Highlights,http://www.toronto4kids.com/August-2014/The-EX-Marks-the-Spot-for-Summer-Fun/,Kids Entertainment News,http://www.toronto4kids.com/images/cache/cache_b/cache_c/cache_6/cne-2014-2-d6ba16cb.jpeg,August 2014,"New and exciting attractions join many returning favourites in the 2014 CNE line-up. New! A Country Saloon, Mechanical Bull, Towering Fandom Robot, star-studded concert series, and much more!"
http://www.toronto4kids.com/Article-Archive/index.php?cp=6&si=50&tagID=283,The Wiggles at Big Day Out Festival,http://www.toronto4kids.com/August-2014/Treehouse-Big-Day-Out-Festival-featuring-the-Wiggles-and-Max-Ruby/,Kids Entertainment News,http://www.toronto4kids.com/images/cache/cache_0/cache_5/cache_5/wiggles-2014-20bb2550.jpeg,August 2014,"Treehouse ""Big Day Out"" Festival in Toronto on September 13 and 14 to be Marquee Canadian Stop for The Wiggles' ""Ready, Steady, Wiggle"" North American Tour. The Festival also features Max & Ruby."
http://www.toronto4kids.com/Article-Archive/index.php?cp=6&si=50&tagID=283,Cineplex Family Favourites August 2014,http://www.toronto4kids.com/August-2014/Cineplex-Family-Favourites-August/,Kids Entertainment News,http://www.toronto4kids.com/images/cache/cache_8/cache_0/cache_f/cineplex-aug-2014-4d03df08.jpeg,August 2014,Join Cineplex on Saturdays and Wednesdays for Family Favourites. Watch a family favourite film each week for only $2.50. It's a fun and affordable way to enjoy the weekend with your family!
http://www.toronto4kids.com/Article-Archive/index.php?cp=6&si=50&tagID=283,Corus Kids July & August Highlights,http://www.toronto4kids.com/July-2014/Corus-Kids-July-August-2014-Highlights/,Kids Entertainment News,http://www.toronto4kids.com/images/cache/cache_1/cache_c/cache_d/bubble-guppies-d22c2dc1.jpeg,July 2014,Corus Entertainment’s YTV splashes into July with a cool lineup of series premieres and new episodes featuring laughs and suspense. See Nickelodeon's July/August highlights and new episodes.
http://www.toronto4kids.com/Article-Archive/index.php?cp=6&si=50&tagID=283,Cineplex Family Favourites July 2014,http://www.toronto4kids.com/July-2014/Cineplex-Family-Favourites-July-2014/,Kids Entertainment News,http://www.toronto4kids.com/images/cache/cache_4/cache_6/cache_9/cineplex-july-1749b964.jpeg,July 2014,Join Cineplex on Saturday mornings at 11:00am for Family Favourites. Watch a family favourite film each week for only $2.50. It's a fun and affordable way to enjoy the weekend with your family!
http://www.toronto4kids.com/Article-Archive/index.php?cp=6&si=50&tagID=283,Toopy and Binoo: Fun and Games,http://www.toronto4kids.com/June-2014/Toopy-and-Binoo-Fun-and-Games/,Kids Entertainment News,http://www.toronto4kids.com/images/cache/cache_3/cache_e/cache_d/toopy-binoo-fun-games-197ccde3.jpeg,June 2014,"The zaniness continues as best friends, Toopy and Binoo, return to the live stage in a brand new theatrical production. Filled with whimsical exuberance, it's Koba Entertainment’s newest musical extravaganza!"
http://www.toronto4kids.com/Article-Archive/index.php?cp=6&si=50&tagID=283,Dinopaws Premieres on Treehouse,http://www.toronto4kids.com/June-2014/New-Preschool-Series-Dinopaws-Premieres-on-Treehouse/,Kids Entertainment News,http://www.toronto4kids.com/images/cache/cache_8/cache_7/cache_a/dino-paws-c3335a78.jpeg,June 2014,"Corus Entertainment’s preschool channel Treehouse  premieres Dinopaws, an endearing series that stars three curious little dinosaurs on their daily journeys of epic discovery, on weekends beginning June 7."
http://www.toronto4kids.com/Article-Archive/index.php?cp=6&si=50&tagID=283,Cineplex Family Favourites for June,http://www.toronto4kids.com/June-2014/Cineplex-Family-Favourites-June-2014/,Kids Entertainment News,http://www.toronto4kids.com/images/cache/cache_a/cache_b/cache_2/june-movies-cinplex-favourites-e3d682ba.jpeg,June 2014,Join Cineplex on Saturday mornings at 11:00am for Family Favourites. Watch a family favourite film each week for only $2.50. It's a fun and affordable way to enjoy the weekend with your family!
http://www.toronto4kids.com/Article-Archive/index.php?cp=6&si=50&tagID=283,Island of Lemurs: Madagascar,http://www.toronto4kids.com/June-2014/Island-of-Lemurs-Madagascar/,Kids Entertainment News,http://www.toronto4kids.com/images/cache/cache_6/cache_3/cache_7/island-of-lemurs-intro-a719a736.jpeg,June 2014,Take a spectacular journey to the remote and wondrous world of Madagascar and witness the incredible true story of one of nature's greatest explorers: the lemurs.
http://www.toronto4kids.com/Article-Archive/index.php?cp=6&si=50&tagID=283,Peeps Movie,http://www.toronto4kids.com/May-2014/Peeps-Movie/,Kids Entertainment News,http://www.toronto4kids.com/images/cache/cache_b/cache_a/cache_a/peep-movie-2-815c0aab.jpeg,May 2014,"Fresh on the heels of the Lego movie, yet another colourful staple of your childhood looks to be headed for Hollywood! A deal has  been inked for the development of a film about Peeps."
http://www.toronto4kids.com/Article-Archive/index.php?cp=6&si=50&tagID=283,Paper Song at YPT,http://www.toronto4kids.com/May-2014/Paper-Song-at-YPT/,Kids Entertainment News,http://www.toronto4kids.com/images/cache/cache_5/cache_0/cache_4/paper-song-7ebc9405.jpeg,May 2014,"A magical Japanese folktale, large-scale origami, and a little mouse with big ideas come together in Paper Song. This powerful play for children and families will be presented in the Studio from April 29 to May 11."
http://www.toronto4kids.com/Article-Archive/index.php?cp=7&si=60&tagID=283,Cineplex Family Favourites May 2014,http://www.toronto4kids.com/May-2014/Cineplex-Family-Favourites-May-2014/,Kids Entertainment News,http://www.toronto4kids.com/images/cache/cache_4/cache_2/cache_8/cineplex-family-favourites-may-2014-99dbf824.jpeg,May 2014,Join Cineplex on Saturday mornings at 11:00am for Family Favourites. Watch a family favourite film each week for only $2.50. It's a fun and affordable way to enjoy the weekend with your family!
http://www.toronto4kids.com/Article-Archive/index.php?cp=7&si=60&tagID=283,Sultans of the Street at YTP,http://www.toronto4kids.com/April-2014/Sultans-of-the-Street-at-YTP/,Kids Entertainment News,http://www.toronto4kids.com/images/cache/cache_4/cache_2/cache_a/sultans-of-the-street-51933a24.jpeg,April 2014,"Four children work together to escape life on the streets of Kolkata, India in YPT’s World Premiere of Sultans of the Street. This poignant and uplifting tale is presented on the Mainstage from April 28 to May 15."
http://www.toronto4kids.com/Article-Archive/index.php?cp=7&si=60&tagID=283,Lego Fan Festivals 2014,http://www.toronto4kids.com/April-2014/Lego-Fan-Festivals/,Kids Entertainment News,http://www.toronto4kids.com/images/cache/cache_d/cache_3/cache_b/lego-kids-fests-298d9b3d.jpeg,April 2014,"If you can't make it to LEGO KidsFest this year which takes places in Calgary from May 16 to 18, 2014, check out some of the smaller fan festivals taking place at these cities, with one event in Toronto!"
http://www.toronto4kids.com/Article-Archive/index.php?cp=7&si=60&tagID=283,The Gabby Douglas Story,http://www.toronto4kids.com/April-2014/The-Gabby-Douglas-Story/,Kids Entertainment News,http://www.toronto4kids.com/images/cache/cache_3/cache_4/cache_7/gabby-douglas-story-887dc743.jpeg,April 2014,"On April 15, Sony Pictures Home Entertainment Canada will present the inspirational story of two-time Olympic gold medalist Gabby Douglas when Lifetime’s The Gabby Douglas Story debuts on DVD."
http://www.toronto4kids.com/Article-Archive/index.php?cp=7&si=60&tagID=283,Cineplex Family Favourites April 2014,http://www.toronto4kids.com/April-2014/Cineplex-Family-Favourites-for-April-2014/,Kids Entertainment News,http://www.toronto4kids.com/images/cache/cache_6/cache_b/cache_f/hop-movie-still-b23ccfb6.jpeg,April 2014,Join Cineplex on Saturday mornings at 11:00am for Family Favourites. Watch a family favourite film each week for only $2.50. It's a fun and affordable way to enjoy the weekend with your family!
http://www.toronto4kids.com/Article-Archive/index.php?cp=7&si=60&tagID=283,Dora's Pirate Adventure in Toronto,http://www.toronto4kids.com/March-2014/Doras-Pirate-Adventure-Comes-to-Toronto/,Kids Entertainment News,http://www.toronto4kids.com/images/cache/cache_d/cache_e/cache_9/dora-live-pirate-adventure-308f09ed.jpeg,March 2014,"Dora the Explorer Live! Dora's Pirate Adventure is an ALL NEW live touring show based on the #1 rated Nickelodeon television program for preschoolers, Dora the Explorer. Catch the show in Toronto!"
http://www.toronto4kids.com/Article-Archive/index.php?cp=7&si=60&tagID=283,Cineplex Family Favourites March 2014,http://www.toronto4kids.com/March-2014/March-Cineplex-Family-Favourites-2014/,Kids Entertainment News,http://www.toronto4kids.com/images/cache/cache_9/cache_c/cache_8/cineplex-march-2014-eeeb88c9.jpeg,March 2014,Join Cineplex on Saturdays at 11:00am for Family Favourites. Watch a family film for only $2.50. It's a fun and affordable way to enjoy the weekend with your family! Here's the line up for March 2014...
http://www.toronto4kids.com/Article-Archive/index.php?cp=7&si=60&tagID=283,The Swan Princess,http://www.toronto4kids.com/February-2014/The-Swan-Princess-A-Royal-Family-Tale/,Kids Entertainment News,http://www.toronto4kids.com/images/cache/cache_d/cache_5/cache_5/swan-princess-3aaa355d.jpeg,February 2014,"The beloved characters from the Swan Princess franchise return for a fifth engagement when THE SWAN PRINCESS: A ROYAL FAMILY TALE debuts on Blu-ray Combo Pack, DVD, and Digital on February 25."
http://www.toronto4kids.com/Article-Archive/index.php?cp=7&si=60&tagID=283,Dinosaur Train Live,http://www.toronto4kids.com/February-2014/Jim-Hensons-Dinosaur-Train-Live-Buddys-Big-Adventure/,Kids Entertainment News,http://www.toronto4kids.com/images/cache/cache_c/cache_f/cache_b/dinosaur-train-intro-1da2dbfc.jpeg,February 2014,"Join Buddy, Tiny, Don and all of their friends and family in this fun-filled, interactive and immersive live trip back in time to an age when dinosaurs roamed the earth... and rode in trains!"
http://www.toronto4kids.com/Article-Archive/index.php?cp=7&si=60&tagID=283,KGO Takes Over on Family Day,http://www.toronto4kids.com/February-2014/KGO-Takes-Over-the-AGO-on-Family-Day/,Kids Entertainment News,http://www.toronto4kids.com/images/cache/cache_9/cache_2/cache_6/kids-ago-78ed0629.jpeg,February 2014,Games and fun rule at the Art Gallery of Ontario (AGO) this Family Day with the annual Kids Gallery of Ontario (KGO) takeover! The popular KGO returns for a special day of family art-making and life-sized games.
http://www.toronto4kids.com/Article-Archive/index.php?cp=8&si=70&tagID=283,February Cineplex Family Favourites 2014,http://www.toronto4kids.com/February-2014/February-2014-Cineplex-Family-Favourites/,Kids Entertainment News,http://www.toronto4kids.com/images/cache/cache_9/cache_8/cache_0/cineplex-feb-2014-7d1d5089.jpeg,February 2014,Join Cineplex on Saturdays at 11:00am for Family Favourites. Watch a family film for only $2.50. It's a fun and affordable way to enjoy the weekend with your family! Here's the line up for February 2014...
http://www.toronto4kids.com/Article-Archive/index.php?cp=8&si=70&tagID=283,TIFF Family Fridays - Winter 2014,http://www.toronto4kids.com/January-2014/TIFF-Family-Fridays-Winter-2014/,Kids Entertainment News,http://www.toronto4kids.com/images/cache/cache_4/cache_0/cache_f/tiff-movies-pa-days-fa970f04.jpeg,January 2014,"TIFF's special family programming for scheduled TDSB & TCDSB PA Days continues this season, with National Geographic Films' 3D spectaculars and animated adventures."
http://www.toronto4kids.com/Article-Archive/index.php?cp=8&si=70&tagID=283,Monster Jam Races Into Toronto,http://www.toronto4kids.com/January-2014/Monster-Jam-Races-Into-Rogers-Centre/,Kids Entertainment News,http://www.toronto4kids.com/images/cache/cache_7/cache_8/cache_d/monster-jam-2014-08e7ad87.jpeg,January 2014,Feld Motor Sports announces that the Monster Jam Tour kicks into high gear January 18-19 at Rogers Centre. Monster Jam is the most exciting form of family motorsports entertainment on the planet.
http://www.toronto4kids.com/Article-Archive/index.php?cp=8&si=70&tagID=283,nOOb at YPT,http://www.toronto4kids.com/January-2014/nOOB-at-YTP/,Kids Entertainment News,http://www.toronto4kids.com/images/cache/cache_0/cache_9/cache_6/noob-intro-c2318690.jpeg,January 2014,Young People’s Theatre is proud to present Christopher Duthie’s acclaimed one man show nOOB. The poignant story about a boy who runs away from home when his parents confiscate his game console.
http://www.toronto4kids.com/Article-Archive/index.php?cp=8&si=70&tagID=283,Family Movies to See in 2014!,http://www.toronto4kids.com/January-2014/Family-Movies-to-see-in-2014/,Kids Entertainment News,http://www.toronto4kids.com/images/cache/cache_3/cache_d/cache_6/rio-2-intro-a9f966d3.jpeg,January 2014,"In 2014, many kid-friendly films will make their way to theatres across the country. From animation to comedies, musicals and plenty of sequels, there's a long list of must-see family movies for 2014."
http://www.toronto4kids.com/Article-Archive/index.php?cp=8&si=70&tagID=283,Mickey's Rockin' Road Show,http://www.toronto4kids.com/January-2014/Mickeys-Rockin-Road-Show/,Kids Entertainment News,http://www.toronto4kids.com/images/cache/cache_4/cache_1/cache_6/mickeys-rockin-road-show-737b6614.jpeg,January 2014,Disney Live! is launching a new Canadian tour this season with stops in 11 cities. Hit the road with Mickey Mouse and other Disney friends for a hilarious talent search in Disney Live! Mickey’s Rockin’ Road Show.
