Category URL,Title,Details URL,Category,Image URl,Description
http://www.toronto4kids.com/Article-Archive/index.php?cp=1&si=0&tagID=422,Blueberry Picking in the GTA,http://www.toronto4kids.com/July-2015/Blueberry-Picking-in-the-GTA/,Agritainment,http://www.toronto4kids.com/images/cache/cache_0/cache_6/cache_7/summer-blueberry-picking-f4cd7760.jpeg,July 2015,"The Pick-Your-Own blueberry season begins in July and continues through late August or early September. Blueberries might just be the easiest fruit to pick, prepare and serve."
http://www.toronto4kids.com/Article-Archive/index.php?cp=1&si=0&tagID=422,Raspberry Picking in the GTA,http://www.toronto4kids.com/July-2015/Raspberry-Picking-in-the-GTA/,Agritainment,http://www.toronto4kids.com/images/cache/cache_7/cache_d/cache_2/raspberry-picking-2015-2644e2d7.jpeg,July 2015,Picking your own raspberries is a great way to spend a summer day with your family. Late July is peak season for raspberries. Here's where you can head out to pick your own in the Greater Toronto Area.
http://www.toronto4kids.com/Article-Archive/index.php?cp=1&si=0&tagID=422,Pick-Your-Own Strawberry Farms,http://www.toronto4kids.com/June-2015/Pick-Your-Own-Strawberry-Farms/,Agritainment,http://www.toronto4kids.com/images/cache/cache_6/cache_5/cache_c/strawberry-picking-2015-59962c56.jpeg,June 2015,"The pick-your-own strawberry season in Toronto starts this June and many pick-your-own farms are opening. Get your ""first pick!"" Find out where you can pick your own in Toronto and surrounding areas."
http://www.toronto4kids.com/Article-Archive/index.php?cp=1&si=0&tagID=422,5 Fun Petting Zoos and Farms,http://www.toronto4kids.com/April-2015/Animal-Encounters-5-Fun-Petting-Zoos-and-Farms/,Agritainment,http://www.toronto4kids.com/images/cache/cache_3/cache_a/cache_4/animal-encounters-278844a3.jpeg,April 2015,It's Spring so grab your kiddos (and a camera) and head out to visit the baby animals! Get ready to encounter some animal fun of the cute kind! 5 great sites where kids can connect with animals.
http://www.toronto4kids.com/Article-Archive/index.php?cp=1&si=0&tagID=422,Toronto & GTA Farmers' Markets,http://www.toronto4kids.com/April-2015/Toronto-GTA-Farmers-Markets-Fresh-Local-Food-for-Your-Family/,Agritainment,http://www.toronto4kids.com/images/cache/cache_7/cache_7/cache_6/farmers-markets-1882f677.jpeg,April 2015,"Make the most of the Spring harvest by hitting up some of the city's very best green markets, many of which open for the season beginning in May. Bring the kids along and peruse the plentiful fruits and veggies."
http://www.toronto4kids.com/Article-Archive/index.php?cp=1&si=0&tagID=422,Maple Sugaring Season is Here!,http://www.toronto4kids.com/February-2015/Maple-Sugaring-Season-is-here/,Agritainment,http://www.toronto4kids.com/images/cache/cache_c/cache_7/cache_c/maple-sugaring-2015-a0caec7c.jpeg,February 2015,"Maple sugaring season is here! Tap trees, collect sap, and see syrup made over a wood-fired evaporator. Stick around for a maple syrup sample! Stop by these locations for tree tapping and syrup tasting."
http://www.toronto4kids.com/Article-Archive/index.php?cp=1&si=0&tagID=422,Cut Your Own Christmas Tree Farms,http://www.toronto4kids.com/December-2014/Cut-Your-Own-Christmas-Tree-Farms/,Agritainment,http://www.toronto4kids.com/images/cache/cache_3/cache_8/cache_2/cut-your-own-tree-84d02283.jpeg,December 2014,"Grab your gloves, your ropes, and your coat and go find the perfect Christmas tree! An expedition to a Christmas tree farm is fun for the whole family with special Winter activities."
http://www.toronto4kids.com/Article-Archive/index.php?cp=1&si=0&tagID=422,Royal Agricultural Winter Fair,http://www.toronto4kids.com/November-2014/The-92nd-Royal-Agricultural-Winter-Fair/,Agritainment,http://www.toronto4kids.com/images/cache/cache_2/cache_4/cache_9/royal-winter-fair-2014-9022a942.jpeg,November 2014,The Royal Agricultural Winter Fair is returning to Toronto for its 92nd annual run in November with an expanded line-up of activities and entertainment that focus on farm fresh fun.
http://www.toronto4kids.com/Article-Archive/index.php?cp=1&si=0&tagID=422,Pumpkinland at Whittamore's Farm,http://www.toronto4kids.com/October-2014/Pumpkinland-and-Harvest-Festival-at-Whittamores-Farm/,Agritainment,http://www.toronto4kids.com/images/cache/cache_8/cache_2/cache_6/whitamore-fall-fest-intro-35187628.jpeg,October 2014,"If you're looking for a fun family activity this Fall, stop in at Whittamore's Farm for Pumpkinland and Harvest Festival Weekends. The farm is transformed into a Halloween wonderland!"
http://www.toronto4kids.com/Article-Archive/index.php?cp=1&si=0&tagID=422,Fall Harvest Festivals 2014,http://www.toronto4kids.com/October-2014/Fall-Harvest-Festivals-2014/,Agritainment,http://www.toronto4kids.com/images/cache/cache_d/cache_1/cache_d/harvest-festivals-9deecd1d.jpeg,October 2014,"Farmers are preparing for the Fall harvest! Day-trippers can make their way to celebratory harvest festivals where the attractions include wandering through corn mazes, picking pumpkins, and more."
http://www.toronto4kids.com/Article-Archive/index.php?cp=2&si=10&tagID=422,Pick Your Own Pumpkins,http://www.toronto4kids.com/September-2014/Pick-Your-Own-Pumpkins/,Agritainment,http://www.toronto4kids.com/images/cache/cache_8/cache_9/cache_a/pumpkin-picking-d4bc8a98.jpeg,September 2014,"What's All Hallows' Eve without the perfect pumpkin? You could grab one from your local farmers' market or at the grocery store. But for a more authentic experience, head to the country to pick-your-own."
http://www.toronto4kids.com/Article-Archive/index.php?cp=2&si=10&tagID=422,Fall Fun at Brooks Farms,http://www.toronto4kids.com/September-2014/Fall-Fun-at-Brooks-Farms/,Agritainment,http://www.toronto4kids.com/images/cache/cache_c/cache_b/cache_b/brooks-apples-intro-a868cbbc.jpeg,September 2014,Kick off the Fall season with a visit to Brooks Farms! Brooks Farms has been growing fun for over 100 years. This heritage farm and agri-tourism destination offers tons of family-friendly activities.
http://www.toronto4kids.com/Article-Archive/index.php?cp=2&si=10&tagID=422,Amazing Mazes,http://www.toronto4kids.com/September-2014/Amazing-Mazes/,Agritainment,http://www.toronto4kids.com/images/cache/cache_a/cache_8/cache_9/maze2-4ac4998a.jpeg,September 2014,"Kids love Autumn visits to GTA farms so they can wander through mazes made of maize stalks or hay. Some mazes wind around for as much as a couple of kilometers, in all kinds of shapes and themes."
http://www.toronto4kids.com/Article-Archive/index.php?cp=2&si=10&tagID=422,Apple Adventures,http://www.toronto4kids.com/September-2014/Apple-Adventures/,Agritainment,http://www.toronto4kids.com/images/cache/cache_5/cache_2/cache_c/apple-picking-4fb17c25.jpeg,September 2014,"What's the sweet upside of Summer coming to a close? The fact that apple picking season is about to begin. Starting in September, orchards throughout the GTA offer families the chance to pick their own apples."
http://www.toronto4kids.com/Article-Archive/index.php?cp=2&si=10&tagID=422,Fall Fun at the Farm,http://www.toronto4kids.com/September-2014/Fall-Fun-at-the-Farm/,Agritainment,http://www.toronto4kids.com/images/cache/cache_2/cache_b/cache_8/fall-fun-at-farm-163178b2.jpeg,September 2014,"When harvest season nears, Toronto and GTA farms swing open their gates for agritourism and Fall fun in the fields. Load up the family for some kid-friendly learnin’, pickin’, and eatin’!"
http://www.toronto4kids.com/Article-Archive/index.php?cp=2&si=10&tagID=422,Peach Picking in Ontario,http://www.toronto4kids.com/August-2014/Peach-Picking-in-Ontario/,Agritainment,http://www.toronto4kids.com/images/cache/cache_8/cache_a/cache_4/peach-picking-ce2be4a8.jpeg,August 2014,"August is the perfect time to head to the farm and fill up a bucket with luscious peaches. In fact, August is National Peach Month. Here are some family-friendly PYO peach farms to visit in Southern Ontario."
http://www.toronto4kids.com/Article-Archive/index.php?cp=2&si=10&tagID=422,Blueberry Picking Farms,http://www.toronto4kids.com/July-2014/Blueberry-Picking-Farms-in-the-GTA/,Agritainment,http://www.toronto4kids.com/images/cache/cache_9/cache_5/cache_e/blueberry-picking2-4294ee59.jpeg,July 2014,It's blueberry picking time! Celebrate National Blueberry Month by heading out to one of the many places in the Greater Toronto Area where you can pick your own.
http://www.toronto4kids.com/Article-Archive/index.php?cp=2&si=10&tagID=422,Strawberry Fields in Toronto & GTA,http://www.toronto4kids.com/June-2014/Strawberry-Fields-in-Toronto-GTA/,Agritainment,http://www.toronto4kids.com/images/cache/cache_0/cache_b/cache_c/strawberry-picking-2-929e6cb0.jpeg,June 2014,"The Toronto area is ripe with places that will allow you to pick your own strawberries. Deciding where to go can be a challenge, so we've hand-picked a few locations in the Greater Toronto Area."
http://www.toronto4kids.com/Article-Archive/index.php?cp=2&si=10&tagID=422,Must-See Corn Mazes,http://www.toronto4kids.com/October-2013/Must-See-Corn-Mazes/,Agritainment,http://www.toronto4kids.com/images/cache/cache_6/cache_c/cache_b/corn-mazes-in-ontario-canada-51a3dbc6.jpeg,October 2013,Discovering a maze in a cornfield is a unique outing for families. Ontario offers some amazing corn mazes where getting lost is all about finding fun! Here are some impressive corn mazes for the 2013 season!
http://www.toronto4kids.com/Article-Archive/index.php?cp=2&si=10&tagID=422,Pick Your Own Raspberries,http://www.toronto4kids.com/July-2013/Pick-Your-Own-Raspberries/,Agritainment,http://www.toronto4kids.com/images/cache/cache_7/cache_2/cache_2/raspberry-picking-768dd227.jpeg,July 2013,Late July is when the Fall crop of raspberries are ready. Take the kids and go to a pick-your-own farm. It makes for a great activity and gets them out for a fun day.
http://www.toronto4kids.com/Article-Archive/index.php?cp=3&si=20&tagID=422,Cherry Picking in Toronto & the GTA,http://www.toronto4kids.com/June-2013/Cherry-Picking-in-Toronto-GTA/,Agritainment,http://www.toronto4kids.com/images/cache/cache_c/cache_e/cache_1/cherry-picking-2-b7e8b1ec.jpeg,June 2013,"Cherry picking can be a great way to spend an afternoon as a family, as well as getting fresh fruit. Here's where to pick your own in Ontario, along with tips on how to pick this tasty fruit!"
http://www.toronto4kids.com/Article-Archive/index.php?cp=3&si=20&tagID=422,Family Fun at Christmas Tree Farms,http://www.toronto4kids.com/December-2012/Family-Fun-at-Christmas-Tree-Farms/,Agritainment,http://www.toronto4kids.com/images/cache/cache_b/cache_3/cache_d/Christmas-Tree-Farm-218f7d3b.jpeg,December 2012,"Head outdoors to a cut-your-own tree farm! Each holiday season, tree farms in the GTA pile hay into wagons and drive Christmas-tree cutters out into the pine-scented fields to choose the perfect tree."
http://www.toronto4kids.com/Article-Archive/index.php?cp=3&si=20&tagID=422,Goin' to the Pumpkin Patch,http://www.toronto4kids.com/October-2012/Goin-to-the-Pumpkin-Patch/,Agritainment,http://www.toronto4kids.com/images/cache/cache_b/cache_0/cache_a/pumpkin-patch-1-8deb6a0b.jpeg,October 2012,"Charlie Brown wasn't the only child in search of the ""Great Pumpkin."" Each year, thousands of kids and their families flock to pumpkin patches hoping to find that one remarkable pumpkin.  "
http://www.toronto4kids.com/Article-Archive/index.php?cp=3&si=20&tagID=422,Apple Picking Family Fun,http://www.toronto4kids.com/October-2012/Apple-Picking-in-the-Greater-Toronto-Area/,Agritainment,http://www.toronto4kids.com/images/cache/cache_4/cache_2/cache_9/apple-picking-2-4484b924.jpeg,October 2012,Apple picking is a wonderful family day trip option for those looking to enjoy a fun Fall outing in the country. It's the perfect adventure for kids as local orchards are welcoming once-a-year harvesters.
http://www.toronto4kids.com/Article-Archive/index.php?cp=3&si=20&tagID=422,The Maze Craze,http://www.toronto4kids.com/October-2012/The-Maze-Craze/,Agritainment,http://www.toronto4kids.com/images/cache/cache_9/cache_f/cache_b/corn-maze-aaaacbf9.jpeg,October 2012,"You can shuck it, pop it, grill it, steam it, butter it and now you can even play in it! Corn has never been so versatile and the latest ""in"" thing has nothing to do with eating it but more about getting lost in it."
http://www.toronto4kids.com/Article-Archive/index.php?cp=3&si=20&tagID=422,Fall Farm Days,http://www.toronto4kids.com/October-2012/Fall-Farm-Days/,Agritainment,http://www.toronto4kids.com/images/cache/cache_2/cache_d/cache_b/fall-farms-a7e8dbd2.jpeg,October 2012,"Hayrides, corn mazes, pony rides, harvest barns, pumpkin or apple picking, farmers' market, and some 'haunted' attractions. Many farms will host fun-filled children's Fall festivals."
http://www.toronto4kids.com/Article-Archive/index.php?cp=3&si=20&tagID=422,Apple Picking in Toronto and GTA,http://www.toronto4kids.com/August-2012/Apple-Picking-in-Toronto-and-GTA/,Agritainment,http://www.toronto4kids.com/images/cache/cache_c/cache_d/cache_f/apple-picking-in-gta-ad86cfdc.jpeg,August 2012,Fall is here! Ready for some serious family Autumn fun? Celebrate with the time-honored tradition of visiting an apple farm. Many of the greater Toronto farms have u-pick orchards to boot.
http://www.toronto4kids.com/Article-Archive/index.php?cp=1&si=0&tagID=421,Go Wild at African Lion Safari,http://www.toronto4kids.com/June-2015/Go-Wild-at-African-Lion-Safari/,Animals & Zoos,http://www.toronto4kids.com/images/cache/cache_0/cache_8/cache_8/als-lead-81211880.jpeg,June 2015,"African Lion Safari welcomes you to Canada's Original Safari Adventure. Get closer than you ever imagined... to over 1,000 other exotic birds and animals from around the world!"
http://www.toronto4kids.com/Article-Archive/index.php?cp=1&si=0&tagID=421,Centreville Amusement Park Opens,http://www.toronto4kids.com/April-2015/Centreville-Amusement-Park-Opens-for-2015-Season/,Animals & Zoos,http://www.toronto4kids.com/images/cache/cache_0/cache_d/cache_f/centreville-august-94854fd0.jpeg,April 2015,Toronto’s favourite family amusement park is opening for yet another great season of fun! There is no shortage of fun taking place at Centreville this coming season. The park opens May 2.
http://www.toronto4kids.com/Article-Archive/index.php?cp=1&si=0&tagID=421,5 Fun Petting Zoos and Farms,http://www.toronto4kids.com/April-2015/Animal-Encounters-5-Fun-Petting-Zoos-and-Farms/,Animals & Zoos,http://www.toronto4kids.com/images/cache/cache_3/cache_a/cache_4/animal-encounters-278844a3.jpeg,April 2015,It's Spring so grab your kiddos (and a camera) and head out to visit the baby animals! Get ready to encounter some animal fun of the cute kind! 5 great sites where kids can connect with animals.
http://www.toronto4kids.com/Article-Archive/index.php?cp=1&si=0&tagID=421,Visit Canadian Pet Expo,http://www.toronto4kids.com/March-2015/Top-Reasons-to-Visit-Canadian-Pet-Expo/,Animals & Zoos,http://www.toronto4kids.com/images/cache/cache_e/cache_3/cache_7/pet-expo-lead-bec8573e.jpeg,March 2015,"The Canadian Pet Expo is a true pet lover’s and pet family experience, coming to the The International Centre from April 3-5, 2015. Here are the top reasons why you should go!"
http://www.toronto4kids.com/Article-Archive/index.php?cp=1&si=0&tagID=421,Cambridge Butterfly Conservatory,http://www.toronto4kids.com/January-2015/Roam-Among-the-Butterflies-at-the-Cambridge-Butterfly-Conservatory/,Animals & Zoos,http://www.toronto4kids.com/images/cache/cache_8/cache_0/cache_1/campbridge-butterfly-lead-4a12c108.jpeg,January 2015,"Witness thousands of free-flying butterflies at the Cambridge Butterfly Conservatory. Experience an impressive collection of flowering plants, colourful birds, cascading waterfalls, and lush tropical gardens."
http://www.toronto4kids.com/Article-Archive/index.php?cp=1&si=0&tagID=421,Our Visit to Far Enough Farm,http://www.toronto4kids.com/August-2014/Our-Visit-to-Far-Enough-Farm-at-Centreville/,Animals & Zoos,http://www.toronto4kids.com/images/cache/cache_d/cache_2/cache_7/far-enough-farm-centreville-ab99172d.jpeg,August 2014,A visit to Centre Island is not complete without stopping in on Far Enough Farm. This quaint working farm is one of the most unique animal farms located just minutes from Toronto's downtown core.
http://www.toronto4kids.com/Article-Archive/index.php?cp=1&si=0&tagID=421,A Wild Season at African Lion Safari,http://www.toronto4kids.com/August-2014/A-Wild-Season-at-African-Lion-Safari/,Animals & Zoos,http://www.toronto4kids.com/images/cache/cache_4/cache_3/cache_3/African-Lion-Safari-Attraction-2014-d97c5334.jpeg,August 2014,"Are you ready for another ""WILD"" season? African Lion Safari® is open daily until October 13, 2014. Go ""On Safari!™"" and get closer than you ever imagined to over 1000 exotic birds and animals!"
http://www.toronto4kids.com/Article-Archive/index.php?cp=1&si=0&tagID=421,High Park Zoo,http://www.toronto4kids.com/June-2014/High-Park-Zoo/,Animals & Zoos,http://www.toronto4kids.com/images/cache/cache_8/cache_b/cache_9/high-park-zoo-1-0ac389b8.jpeg,June 2014,"Toronto's largest public park is home to a unique and wonderful animal attraction that is open year round. The High Park Zoo allows kids to experience, appreciate, and learn about animals."
http://www.toronto4kids.com/Article-Archive/index.php?cp=1&si=0&tagID=421,Bird Kingdom in Niagara Falls,http://www.toronto4kids.com/May-2014/Bird-Kingdom-in-Niagara-Falls/,Animals & Zoos,http://www.toronto4kids.com/images/cache/cache_4/cache_7/cache_8/bird-kingdom-intro-82e00874.jpeg,May 2014,"Bird Kingdom is the world's largest free-flying indoor aviary that connects people with nature through the world of birds. At Bird Kingdom you'll see exotic birds, animals, and reptiles, all in a unique oasis."
http://www.toronto4kids.com/Article-Archive/index.php?cp=1&si=0&tagID=421,Summer 2014 at Safari Niagara,http://www.toronto4kids.com/May-2014/Safari-Niagara-Welcomes-You-To-Summer-2014/,Animals & Zoos,http://www.toronto4kids.com/images/cache/cache_2/cache_d/cache_6/safari-niagara-14-intro-56b406d2.jpeg,May 2014,"School's out for the Summer! Well, not yet but it is just around the corner! Discover what the Niagara region has to offer and in particular - Safari Niagara, only 10 minutes from Niagara Falls."
http://www.toronto4kids.com/Article-Archive/index.php?cp=2&si=10&tagID=421,A Winter Day at Riverdale Farm,http://www.toronto4kids.com/January-2014/A-Winter-Day-at-Riverdale-Farm/,Animals & Zoos,http://www.toronto4kids.com/images/cache/cache_9/cache_1/cache_6/riverdale-farm-winter-1-cfd05619.jpeg,January 2014,"It can be a challenge to finding family fun in the middle of Winter but think Riverdale Farm! Amidst this year’s cold harsh Winter, a recent balmy day led us to a visit to this quaint little farm in the heart of city."
http://www.toronto4kids.com/Article-Archive/index.php?cp=2&si=10&tagID=421,Ripley’s Aquarium of Canada,http://www.toronto4kids.com/December-2013/Ripleys-Aquarium-of-Canada/,Animals & Zoos,http://www.toronto4kids.com/images/cache/cache_0/cache_4/cache_3/Ripleys-Aquarium-Toronto-Lead-366c1340.jpeg,December 2013,"Discover the wonders of the water world at Toronto's newest and most thrilling attraction, Ripley's Aquarium of Canada. This interactive attraction plunges guests in a one-of-a-kind underwater adventure!"
http://www.toronto4kids.com/Article-Archive/index.php?cp=2&si=10&tagID=421,Far Enough Farm at Centreville,http://www.toronto4kids.com/August-2013/Far-Enough-Farm-at-Centreville/,Animals & Zoos,http://www.toronto4kids.com/images/cache/cache_3/cache_f/cache_d/Far-Enough-Farm-intro2-22e50df3.jpeg,August 2013,"Far Enough Farm located at Centreville Amusement Park is the perfect year-round destination for families visiting the island. This quaint hobby farm, now a Centre Island staple, has been in operation since 1959."
http://www.toronto4kids.com/Article-Archive/index.php?cp=2&si=10&tagID=421,Safari Niagara,http://www.toronto4kids.com/July-2013/Safari-Niagara/,Animals & Zoos,http://www.toronto4kids.com/images/cache/cache_5/cache_6/cache_0/safari-niagara-intro-4b113065.jpeg,July 2013,"Safari Niagara, a 150-acre, privately-owned and operated nature park, invites you to spend the day with more than 750 animals of native and exotic mammals, reptiles, and birds. Adventures await the entire family."
http://www.toronto4kids.com/Article-Archive/index.php?cp=2&si=10&tagID=421,Our Wild African Lion Safari Experience,http://www.toronto4kids.com/July-2013/Our-Wild-African-Lion-Safari-Experience/,Animals & Zoos,http://www.toronto4kids.com/images/cache/cache_2/cache_b/cache_c/african-lion-safari-intro-2de79cb2.jpeg,July 2013,"At African Lion Safari, animals are exhibited in an entirely different way - the visitor is caged in their car or tour bus, and the animals are free to roam."
http://www.toronto4kids.com/Article-Archive/index.php?cp=2&si=10&tagID=421,Kids Zoo at Toronto Zoo,http://www.toronto4kids.com/July-2013/Kids-Zoo-at-Toronto-Zoo/,Animals & Zoos,http://www.toronto4kids.com/images/cache/cache_e/cache_a/cache_e/toronto-zoo-kids-zoo-1-93564eae.jpeg,July 2013,"The Toronto Zoo is a must see and do family attraction! But for younger kids who like their nature hands-on, the Zoo offers a great concept: a Kids Zoo uniquely designed for kids 9 and under."
http://www.toronto4kids.com/Article-Archive/index.php?cp=2&si=10&tagID=421,The Giant Pandas at Toronto Zoo,http://www.toronto4kids.com/July-2013/The-Giant-Pandas-at-Toronto-Zoo/,Animals & Zoos,http://www.toronto4kids.com/images/cache/cache_1/cache_6/cache_4/Giant-Pandas-Toronto-Zoo-fb794461.jpeg,July 2013,What a thrilling experience to see the giant pandas at the Toronto Zoo! The 'Giant Panda Experience' is the new home of Er Shun and Da Mao and the exhibit is now open.
http://www.toronto4kids.com/Article-Archive/index.php?cp=2&si=10&tagID=421,The Bowmanville Zoo,http://www.toronto4kids.com/June-2013/The-Bowmanville-Zoo/,Animals & Zoos,http://www.toronto4kids.com/images/cache/cache_2/cache_d/cache_8/bowmanville-zoo-intro-de86d8d2.jpeg,June 2013,"Take a walk on the wild side at Bowmanville Zoo. It's Canada's oldest private zoo, established in 1919. There's so much to explore at the Bowmanville Zoo, but here's what makes this zoo really cool!"
http://www.toronto4kids.com/Article-Archive/index.php?cp=2&si=10&tagID=421,Go Wild at African Lion Safari,http://www.toronto4kids.com/May-2013/Go-Wild-at-African-Lion-Safari/,Animals & Zoos,http://www.toronto4kids.com/images/cache/cache_2/cache_1/cache_1/African-Lion-Safari-Thumb-40bac112.jpeg,May 2013,"Are you ready for another ""WILD"" season? African Lion Safari is open daily May 4 to October 14, 2013. Go ""On Safari!"" and get closer than you ever imagined to over 1000 exotic birds and animals!"
http://www.toronto4kids.com/Article-Archive/index.php?cp=2&si=10&tagID=421,Riverview Zoo and Park,http://www.toronto4kids.com/April-2013/Riverview-Zoo-and-Park/,Animals & Zoos,http://www.toronto4kids.com/images/cache/cache_7/cache_c/cache_4/riverview-zoo-and-park-c31e74c7.jpeg,April 2013,"This popular and amazing 55.5 acre zoo, park, and splash pad is the largest and most diversified playground for kids in Peterborough. Best of all, admission is free."
http://www.toronto4kids.com/Article-Archive/index.php?cp=3&si=20&tagID=421,The Riverdale Farm,http://www.toronto4kids.com/April-2013/The-Riverdale-Farm/,Animals & Zoos,http://www.toronto4kids.com/images/cache/cache_a/cache_c/cache_7/riverdale-farm-intro-5b4fb7ca.jpeg,April 2013,"The Riverdale Farm is a quaint little farm, located in the heart of downtown Toronto. A perfect example of a turn of the century Ontario farm, kids can see many farm animals, including cows, horses, donkeys, sheep, and more."
http://www.toronto4kids.com/Article-Archive/index.php?cp=3&si=20&tagID=421,A Zoo Wintertime Adventure,http://www.toronto4kids.com/January-2013/A-Zoo-Wintertime-Adventure/,Animals & Zoos,http://www.toronto4kids.com/images/cache/cache_e/cache_9/cache_a/zoo-winter-008f8a9e.jpeg,January 2013,"While many think of January and February as the 'gloom of winter,' the Toronto Zoo proves there is life to the season! Don't let a little cold stop you. In many ways, the zoo can be more fun in the winter! "
http://www.toronto4kids.com/Article-Archive/index.php?cp=3&si=20&tagID=421,African Lion Safari,http://www.toronto4kids.com/June-2012/African-Lion-Safari/,Animals & Zoos,http://www.toronto4kids.com/images/cache/cache_2/cache_e/cache_9/AfricanLionSafari-ce6d49e2.jpeg,June 2012,"Create lasting memories this Summer, as you “GO WILD!!™"" at African Lion Safari! Go “On Safari” and get closer than you ever imagined to over 1,000 exotic birds and animals roaming freely in large Game Reserves. Here are 10 ways to drive your family ""WILD!"""
http://www.toronto4kids.com/Article-Archive/index.php?cp=3&si=20&tagID=421,New African Penguin Exhibit at Toronto Zoo,http://www.toronto4kids.com/May-2012/New-African-Penguin-Exhibit-at-Toronto-Zoo/,Animals & Zoos,http://www.toronto4kids.com/images/cache/cache_2/cache_b/cache_1/zoo-penguins-intro-4105c1b2.jpeg,May 2012,"There’s a new exhibit at the Toronto Zoo: the Endangered African Penguins. After an 18-year absence, they are back, introducing zoo visitors to 12 playful and entertaining new friends."
http://www.toronto4kids.com/Article-Archive/index.php?cp=3&si=20&tagID=421,Animal Adventures for the Family!,http://www.toronto4kids.com/August-2011/Animal-Adventures-for-the-Whole-Family/,Animals & Zoos,http://www.toronto4kids.com/images/cache/cache_0/cache_7/cache_3/animal-adventures-intro-12c91370.jpeg,August 2011,"Indulge in some one-on-one time with your kids and some furry, feathery, and swampy creatures. Nothing makes an outing complete unless there's an animal factor to it!"
