URL,Title,Phone,Street Address,Locality,Region,Country,Postal Code
http://www.apontador.com.br/local/sp/sao_paulo/policia/27NJM2L8/policiamento_comunitario_capital_37_bpm_m_em.html,Policiamento Comunitário - Capital - 37.Bpm-M Em,11 5821-6617,Estrada De Itapecerica-5650- Jardim Aurélio,São Paulo,SP,Brasil,CEP: 05858-000
http://www.apontador.com.br/local/sp/sao_paulo/consultoria/2G8UJQ6V/dfa_solution_servicos_de_escritorio_me_jd_macedonia.html,Dfa Solution Servicos de Escritorio  -Me - Jd Macedônia,11 5824-8224,Rua Póvoa de Varzim-54- 3 B-Jardim Macedônia,São Paulo,SP,Brasil,CEP: 05894-400
http://www.apontador.com.br/local/sp/sao_paulo/servicos_publicos/2XR3GA9R/policiamento_comunitario_capital_47_bpm_m_em_p_2_0.html,Policiamento Comunitário - Capital - 47.Bpm-M Em P-2 0,11 2232-4875,Avenida Pará-3132- Jardim Santa Fé,São Paulo,SP,Brasil,CEP: 02611-001
http://www.apontador.com.br/local/sp/sao_paulo/sindicatos_e_federacoes/3L9X2822/sindicato_uniao_dos_servidores_do_poder_judiciario.html,Sindicato União dos Servidores do Poder Judiciário,11 3107-0050,Rua Carmo Fernandes-44- An 3-Parque Residencial Cocaia,São Paulo,SP,Brasil,CEP: 04849-170
http://www.apontador.com.br/local/sp/sao_paulo/igrejas/R8QY94G4/igreja_evangelica_assembleia_de_deus_ministerio_fe_e_confianca_pr.html,Igreja Evangelica: Assembleia de Deus. Ministerio: Fe e Confianca - Pr,11 5934-1569,Travessa Bambu-Japonês-51- Parque Cocaia,São Paulo,SP,Brasil,
http://www.apontador.com.br/local/sp/sao_paulo/ventilacao_e_refrigeracao/XKMZ5V24/revifrio_comercio_de_refrigeracao_jardim_maringa.html,Revifrio Comércio de Refrigeração - Jardim Maringá,11 2741-8208,Avenida Itaquera-2995- Vila Nhocune,São Paulo,SP,Brasil,CEP: 03526-000
http://www.apontador.com.br/local/sp/sao_paulo/hospitais_particulares/C40277675D0D4C0D49/mello_laboratorio_medico_de_analises_at.html,Mello Laboratorio Medico de Analises - At,,Estrada De Itapecerica-5170- Conjunto Habitacional Instituto Adventista,São Paulo,SP,Brasil,CEP: 05858-000
http://www.apontador.com.br/local/sp/sao_paulo/religiao/C404645413605C6051/jean_carlos_l_da_silva_artigos_do_vestuario_epp.html,Jean Carlos L da Silva Artigos do Vestuario - Epp,11 5821-2134,Travessa Louro-Da-Beira-31--Conjunto Habitacional Instituto Adventista,São Paulo,SP,Brasil,CEP: 05868-160
http://www.apontador.com.br/local/sp/sao_paulo/graficas_e_copias/E6Q88JW2/piccadilly_lemos_comercio_de_materiais_para_escritorio_e_servicos_de.html,Piccadilly & Lemos Comercio de Materiais Para Escritorio e Servicos De,11 5082-2448,Rua Garcia de Toledo-13- Jardim São Bento Novo,São Paulo,SP,Brasil,CEP: 05882-440
http://www.apontador.com.br/local/sp/sao_paulo/templos/C405191A15295U2956/igreja_pentecostal_misterio_de_fogo_de_jesus.html,Igreja Pentecostal Misterio de Fogo de Jesus,,Rua Desembargador Carneiro Ribeiro-312- Artur Alvim,São Paulo,SP,Brasil,CEP: 03569-000
http://www.apontador.com.br/local/sp/sao_paulo/motor_para_veiculo/C401092944452D4527/retifica_de_motores_rogerio_bosak.html,Retifica de Motores Rogerio Bosak,,Avenida Esperantina-595- Jardim Nordeste,São Paulo,SP,Brasil,CEP: 03692-000
http://www.apontador.com.br/local/sp/sao_paulo/contabilidade/C408585946580N580E/a_g_b_o_r_c_o_n_f_i_escritorio_contabil_me_.html,A.G.B. O R C O N F I_Escritorio Contabil-Me.,,Avenida Ns. de Guadalupe-268- CASA -02-Jardim Helena,São Paulo,SP,Brasil,CEP: 08420-130
http://www.apontador.com.br/local/sp/sao_paulo/enderecos_empresariais/C401525E600C2E0C20/ornegon_costura_e_comercio_de_artigos_do_vestuario.html,Ornegon - Costura e Comercio de Artigos do Vestuario,,Travessa Bambu-Japonês-123- Parque Cocaia,São Paulo,SP,Brasil,CEP: 04849-530
http://www.apontador.com.br/local/sp/sao_paulo/enderecos_empresariais/C405335F49543S5431/desor_confeccao_de_artigos_de_vestuario_e_acessorios.html,Desor - Confeccao de Artigos de Vestuario e Acessorios,,Rua Ns. das Candeias-365- SALA 03-Vila Santa Teresinha,São Paulo,SP,Brasil,CEP: 08247-095
http://www.apontador.com.br/local/sp/sao_paulo/estetica/XVW97888/rogerio_s_cabeleireiros_cj_inst_adventista.html,RogerioS Cabeleireiros  -  - Cj Inst Adventista,11 5821-8651,Rua Mutirante Luís Gonzaga-127- Conjunto Habitacional Instituto Adventista,São Paulo,SP,Brasil,
http://www.apontador.com.br/local/sp/sao_paulo/escolas/WAQMW655/conservatorio_musical_edtilde_s_c_jd_monte_alegre.html,Conservatorio Musical Edtilde S/C  - Jd Monte Alegre,11 3972-0616,Rua Matias Arrudão-196- Jardim Monte Alegre,São Paulo,SP,Brasil,CEP: 02811-070
http://www.apontador.com.br/local/sp/sao_paulo/predios_publicos/C41400200E414S414A/ministerio_a_voz_que_clama_no_deserto.html,Ministerio A Voz Que Clama No Deserto,,Rua Do Campo-01- Colônia,São Paulo,SP,Brasil,CEP: 04218-000
http://www.apontador.com.br/local/sp/sao_paulo/escolas/J28J77KS/emei_elisiario_rodrigues_de_sousa_prof.html,Emei Elisiario Rodrigues de Sousa Prof,11 2282-4353 / (11 2964-0299,Rua Édson Danillo Dotto-520- Conjunto Habitacional Santa Etelvina Ii,São Paulo,SP,Brasil,CEP: 08485-280
http://www.apontador.com.br/local/sp/sao_paulo/dedetizadoras/C41420203A192U192B/equilibrio_imunizacao_comercio_e_servicos_ltda.html,Equilibrio Imunização Comercio e Serviços Ltda,11 3399-3226,Rua Santa Rita-685- Parque Residencial Cocaia,São Paulo,SP,Brasil,
http://www.apontador.com.br/local/sp/sao_paulo/enderecos_empresariais/C4183140602C4T2C42/emporio_body_store__shopping_patio_paulista.html,Empório Body Store - Shopping Pátio Paulista,11 3266-6484,Rua Treze de Maio-1947- Parque Residencial Cocaia,São Paulo,SP,Brasil,
http://www.apontador.com.br/local/sp/sao_paulo/transporte/C404147F20133T1330/az_d_ouro_transportes_rodoviario.html,Az DOuro Transportes Rodoviario,,Rua Guateque-245- Jardim Ipê,São Paulo,SP,Brasil,CEP: 05798-140
http://www.apontador.com.br/local/sp/sao_paulo/clinicas_odontologicas/C402202213343U343C/pronto_socorro_dentario_24_horas.html,Pronto-Socorro Dentário 24 Horas,11 5539-2196,Avenida Onze de Junho-1199- Parque Sônia,São Paulo,SP,Brasil,CEP: 04041-054
http://www.apontador.com.br/local/sp/sao_paulo/enderecos_empresariais/C413872059523Q5230/mario_sergio_silva_de_almeida_filho_31900610841.html,Mario Sergio Silva de Almeida Filho 31900610841,11 5827-5943,Rua Emílio Bessa-00414- Parque Fernanda,São Paulo,SP,Brasil,CEP: 05888-060
http://www.apontador.com.br/local/sp/sao_paulo/enderecos_empresariais/C4171480544F3O4F32/emporio_body_store_shopping_patio_paulista.html,Empório Body Store - Shopping Pátio Paulista,11 3266-6484,Rua Treze de Maio-1947- Parque Residencial Cocaia,São Paulo,SP,Brasil,
http://www.apontador.com.br/local/sp/sao_paulo/templos/8SL2J89L/igreja_evangelica_pentecostal_santuario_de_jesus_vl_california.html,Igreja Evangelica Pentecostal Santuario de Jesus - Vl Califórnia,11 2912-2139,Rua Viana do Castelo-452- Vila Califórnia,São Paulo,SP,Brasil,CEP: 03213-070
http://www.apontador.com.br/local/sp/sao_paulo/associacoes_e_sindicatos/A9DL3YR3/centro_comunitario_favela_vila_dalva_jardim_sandra.html,Centro Comunitário Favela Vila Dalva - Jardim Sandra,11 3712-0812,Passagem Passareira-60- Conjunto Habitacional Instituto Adventista,São Paulo,SP,Brasil,
http://www.apontador.com.br/local/sp/sao_paulo/revendedores_e_concessionarias/XC9KQNTC/rogerio_leite_da_silva_jd_helena.html,Rogerio Leite da Silva  - Jd Helena,11 2583-4209,Rua Cachoeira do Brumado-218- Jardim Helena,São Paulo,SP,Brasil,CEP: 08090-520
http://www.apontador.com.br/local/sp/sao_paulo/dentistica_restauradora/C40124394F501Q5013/rogerio_cardoso_diniz_21867900840.html,Rogerio Cardoso Diniz 21867900840,11 5528-3158,Rua Domingos Garcia Velho-31- CS 1-Jardim Edi,São Paulo,SP,Brasil,CEP: 04851-020
http://www.apontador.com.br/local/sp/sao_paulo/alimentos_e_bebidas/987J7UDB/yakult_s_a_industria_e_comercio_jd_centenario.html,Yakult S/A Indústria e Comércio - Jd Centenário,11 3985-7447,Rua Professor José Soares de Mello-85--Jardim Centenário,São Paulo,SP,Brasil,CEP: 02882-100
http://www.apontador.com.br/local/sp/sao_paulo/maquinas_e_ferramentas/VL47KTG7/polimaquinas.html,Polimaquinas,35 9136-0263 / (35 9181-8142,Rua Anum-Preto-3- Jardim Dom José,São Paulo,SP,Brasil,CEP: 05887-320
http://www.apontador.com.br/local/sp/sao_paulo/lojas_diversas/H5U2P72J/daniel_escadas.html,Daniel Escadas,11 3536-3727,Rua Cândido Fontoura-836- Jardim Boa Vista,São Paulo,SP,Brasil,CEP: 05583-070
http://www.apontador.com.br/local/sp/sao_paulo/enderecos_empresariais/PX662R9L/comite_politico_vereador_goulart.html,Comitê Político Vereador Goulart,11 5666-3334,Avenida Do Jangadeiro-206- Cidade Dutra,São Paulo,SP,Brasil,CEP: 04815-010
http://www.apontador.com.br/local/sp/sao_paulo/construcao_geral_/C406371864601Q6011/concressul.html,Concressul,11 5663-5868 / (11 5661-4596,Rua Eugênio de Andrade-103- Jardim Maringá,São Paulo,SP,Brasil,CEP: 04814-050
http://www.apontador.com.br/local/sp/sao_paulo/imoveis_residenciais/QEJ69P2T/residencial_mirante_do_parque.html,Residencial Mirante do Parque,,Rua Diogo de Braga-200- Jardim Primavera,São Paulo,SP,Brasil,
http://www.apontador.com.br/local/sp/sao_paulo/vidracarias/C40367520B3C5C3C55/auto_vidros_interlagos.html,Auto Vidros Interlagos,11 5667-2021,Avenida Senador Teotônio Vilela-2044- Rio Bonito,São Paulo,SP,Brasil,CEP: 04801-000
http://www.apontador.com.br/local/sp/sao_paulo/pecas_e_acessorios_para_veiculos/C408694402322C3227/moto_pecas_24_horas.html,Moto Peças 24 Horas,11 3999-6892,Avenida Cabo Adão Pereira-134- Pirituba-Jardim São José,São Paulo,SP,Brasil,CEP: 02936-010
http://www.apontador.com.br/local/sp/sao_paulo/vestuario/C40807493C363C3634/galalu_baby_a_e_carvalho.html,Galalu Baby- A.E. Carvalho,11 3564-5479,Avenida Águia de Haia-nº1295- Em frente aos Correios. -Jardim Coimbra,São Paulo,SP,Brasil,
http://www.apontador.com.br/local/sp/sao_paulo/buffets_e_recepcoes/7978UX32/buffet_augustus_grill.html,Buffet Augustus Grill,,R R-0- Cidade Dutra,São Paulo,SP,Brasil,CEP: 08285-260
http://www.apontador.com.br/local/sp/sao_paulo/churrascarias/C406093F16570T570C/street_grill.html,Street Grill,,Rua Tijuco Preto-285- Vila Azevedo,São Paulo,SP,Brasil,CEP: 03316-000
http://www.apontador.com.br/local/sp/sao_paulo/bancos/C405209947524S5249/banca_hills.html,Banca Hills,,Avenida Pres. João Goulart-2233- Jardim Maria Rita,São Paulo,SP,Brasil,CEP: 04821-010
http://www.apontador.com.br/local/sp/sao_paulo/comunicacao_visual/C401784F1A250N2507/mandril_comunicacoes.html,Mandril Comunicacoes,,Rua Faustino Rodrigues-260- Jardim Bonito,São Paulo,SP,Brasil,CEP: 04829-250
http://www.apontador.com.br/local/sp/sao_paulo/churrascarias/C408638E582D5E2D54/delgado_grill.html,Delgado Grill,,Rua Muaná-31- Jardim Maringá,São Paulo,SP,Brasil,CEP: 03525-090
http://www.apontador.com.br/local/sp/sao_paulo/enderecos_empresariais/C401349A0D2E3C2E39/gap_grill.html,Gap - Grill,,Rua Luís Seraphico Jr.-69- Vila Cruzeiro,São Paulo,SP,Brasil,CEP: 04729-080
http://www.apontador.com.br/local/sp/sao_paulo/churrascarias/C402080F16451N451B/master_grill.html,Master Grill,,R FRANCISCO SOUTO MAIOR-578- Jardim Lourdes,SAO PAULO,SP,Brasil,CEP: 08452-430
http://www.apontador.com.br/local/sp/sao_paulo/churrascarias/C406316F06552S552C/junior_s_grill.html,JuniorS Grill,,Rua Tibúrcio de Sousa-2510- Jardim Tua,São Paulo,SP,Brasil,CEP: 08140-000
http://www.apontador.com.br/local/sp/sao_paulo/churrascarias/C404274F40015O015F/dido_s_grill.html,DidoS Grill,,Rua Pedro Cacunda-325- 331-Jardim São Paulo,São Paulo,SP,Brasil,CEP: 02046-090
http://www.apontador.com.br/local/sp/sao_paulo/enderecos_empresariais/C407820F255F5E5F5D/drill_service.html,Drill-Service,,Rua Gonçalves Ledo-431- SALA 01-Ipiranga,São Paulo,SP,Brasil,CEP: 04216-030
http://www.apontador.com.br/local/sp/sao_paulo/galeterias/C401719946160N1602/galetos_gril.html,Galetos Gril,,Avenida Luís José Costa - Leandro-70- Conjunto Habitacional Santa Etelvina Ii,São Paulo,SP,Brasil,CEP: 08471-200
http://www.apontador.com.br/local/sp/sao_paulo/restaurantes/C402996947092O092C/grill_hall.html,Grill Hall,,Avenida Onze de Junho-1280- Parque Sônia,São Paulo,SP,Brasil,CEP: 04041-004
http://www.apontador.com.br/local/sp/sao_paulo/embalagens/C40767594D144U144F/aderil_embalagens.html,Aderil Embalagens,,Rua Augusto Rivalta-114- Jardim Germânia,São Paulo,SP,Brasil,CEP: 05781-150
http://www.apontador.com.br/local/sp/sao_paulo/enderecos_empresariais/C408365E522D0U2D07/multi_drill.html,Multi Drill,,Rua Clermont-116- NAO TEM COMPLEMENTO-Jardim Santo Antônio,São Paulo,SP,Brasil,CEP: 05723-350
http://www.apontador.com.br/local/sp/sao_paulo/churrascarias/C417626008643N6430/planeta_grill.html,Planeta Grill,,Rua João Fugulin-633- Jardim Germânia,São Paulo,SP,Brasil,CEP: 05849-340
http://www.apontador.com.br/local/sp/sao_paulo/educacao/C408264217440Z440E/curso_preparatorio_para_concurso_publico.html,Curso Preparatório Para Concurso Público,,Avenida Do Jangadeiro-149- Cidade Dutra,São Paulo,SP,Brasil,CEP: 04815-020
http://www.apontador.com.br/local/sp/sao_paulo/educacao_infantil/E9J4DC2X/creche_p_conv_sinhazinha_meirelles_centro_comunitario.html,Creche P Conv Sinhazinha Meirelles Centro Comunitario,11 3765-2730,Avenida José Joaquim Seabra-1245- Rio Pequeno,São Paulo,SP,Brasil,CEP: 05364-000
http://www.apontador.com.br/local/sp/sao_paulo/moveis/EM4P2UPR/escritorio_moveis_de_gramado_e_tudo_na_medida.html,Escritório Móveis de Gramado e Tudo Na Medida,11 5678-4367,Rua Antônio José Loureiro-25- AP: 435-Vila Bertioga,São Paulo,SP,Brasil,CEP: 03187-030
http://www.apontador.com.br/local/sp/sao_paulo/igrejas/C403977356193N1938/assembleia_de_deus_jd_lageado_ministerio_madureira_bras.html,Assembléia de Deus Jd. Lageado Ministério Madureira - Brás,,Avenida Do Imp.-6186- Jardim Casa Pintada,São Paulo,SP,Brasil,CEP: 08051-000
http://www.apontador.com.br/local/sp/sao_paulo/alimentos_e_bebidas/C405650906024Q0246/mercadinho_dom_rogerio_ltd.html,Mercadinho Dom Rogerio Ltd,11 3976-8800,Rua Coronel Bento Bicudo-1295- Piqueri,São Paulo,SP,Brasil,CEP: 02912-000
http://www.apontador.com.br/local/sp/sao_paulo/postos_de_combustivel/H6T7N6F6/centro_automotivo_universitario_r_isabel_schimidt.html,Centro Automotivo Universitario   R Isabel Schimidt,11 5522-9777,Rua Isabel Schimidt-250- Jardim São Luís,São Paulo,SP,Brasil,CEP: 04743-030
http://www.apontador.com.br/local/sp/sao_paulo/religiao/C4021912173D5D3D5B/igreja_evangelica_assembleia_deus_ministerio_cenaculo_oracao.html,Igreja Evangelica Assembleia Deus Ministerio Cenaculo Oração,11 3793-6313,Avenida Maria Cursi-1270- Cidade São Mateus,São Paulo,SP,Brasil,CEP: 03962-000
http://www.apontador.com.br/local/sp/sao_paulo/clinicas_odontologicas/C407847217225N2252/consultorio_odontologico_dra_vitoria_a_rigato.html,Consultório Odontologico - Dra Vitória A. Rigato,11 2910-8255,Avenida Sapopemba-3850- Chácara Mafalda,São Paulo,SP,Brasil,CEP: 08310-165
http://www.apontador.com.br/local/sp/sao_paulo/escolas/C407421214630C6306/conservatorio_musical_nossa_sra_sion.html,Conservatório Musical Nossa Sra Sion,11 5062-5330,Avenida Doutor Gentil de Moura-174- Vila Dom Pedro Primeiro,São Paulo,SP,Brasil,CEP: 04278-000
http://www.apontador.com.br/local/sp/sao_paulo/clinicas_e_hospitais_veterinarios/C40179042C0B3C0B39/oasis_pet_centro_medico_veterinario_unidade_i.html,Oasis Pet Centro Médico Veterinário - Unidade I,11 5523-8449 / (11 97071-7227,Rua Padre José de Anchieta-1013--Santo Amaro,São Paulo,SP,Brasil,CEP: 04742-001
http://www.apontador.com.br/local/sp/sao_paulo/caixas_eletronicos/C402864357580N5804/banco24horas_tecban_jd_educandario.html,Banco24horas - Tecban -Jd Educandario,,Rua José Porfírio de Sousa-2- Jardim Arpoador,São Paulo,SP,Brasil,CEP: 05563-090
http://www.apontador.com.br/local/sp/sao_paulo/flores/C40363491F362D362F/floricultura_do_velorio_do_hospital_tide_setubal.html,Floricultura do Velório do Hospital Tide Setúbal,11 3938-8742,Rua Doutor José Guilherme Eiras-123- Vila Doutor Eiras,São Paulo,SP,Brasil,CEP: 08010-220
http://www.apontador.com.br/local/sp/sao_paulo/igrejas/C6A7FK7J/igreja_assembleia_de_deus_ministerio_shalon_lahema.html,Igreja Assembleia de Deus Ministério Shalon Lahema,11 6708-9884,Rua Professor Aurélio Arrobas Martins-36- B-Jardim Lucélia,São Paulo,SP,Brasil,CEP: 04852-205
http://www.apontador.com.br/local/sp/sao_paulo/terceiro_setor/9474AR44/escritorio_da_cooper_associacao_dos_amigos_futebol_clube.html,Escritorio da Cooper Associação dos Amigos Futebol Clube,11 99159-0981,Rua Engenheiro Romeu Belluomini-345- Jardim Helena,São Paulo,SP,Brasil,CEP: 08420-270
http://www.apontador.com.br/local/sp/sao_paulo/cursos_e_aulas_particulares/882CRB5P/a_casa_do_fichario_new_designer_pastas_ficharios.html,"A Casa do Fichário, New Designer Pastas, Ficharios",,Rua Doutor José Áureo Bustamante-149- Santo Amaro,São Paulo,SP,Brasil,CEP: 04710-090
http://www.apontador.com.br/local/sp/sao_paulo/terceiro_setor/826886U2/butanta_amejaeb_assoc_morad_emp_jd_educandario.html,Butanta Amejaeb-Assoc.Morad.Emp.Jd.Educandario,11 98683-4421,Avenida Doutor Sílvio Margarido-6- Jardim Monte Alegre,São Paulo,SP,Brasil,CEP: 05545-130
http://www.apontador.com.br/local/sp/sao_paulo/educacao/C40395864D363Z3630/curso_preparatorio_para_oab_online.html,Curso Preparatório Para Oab Online,33 3241-3643,Rua Sete-0- Curso Online-Jardim Nordeste,São Paulo,SP,Brasil,
http://www.apontador.com.br/local/sp/sao_paulo/mecanicas_e_oficinas/C404178920530U5308/juscelino_n_do_carmo_pintura_automotiv.html,JUSCELINO N DO CARMO PINTURA AUTOMOTIV,11 5938-0521,Rua Acácio Fontoura-630- TR-Jardim Santa Rita,São Paulo,SP,Brasil,CEP: 04831-050
http://www.apontador.com.br/local/sp/sao_paulo/eletroeletronicos/X9J7V8UG/hilton_salgado_tashiro_ch_inglesa.html,Hilton Salgado Tashiro -  - Ch Inglesa,11 2276-4162,Rua Acarapé-336- Chácara Inglesa,São Paulo,SP,Brasil,CEP: 04139-090
http://www.apontador.com.br/local/sp/sao_paulo/medicos_e_consultorios/C402970906381C381C/top_esteril.html,Top Estéril,11 2219-1858,Rua Arcipreste Andrade-651- Ipiranga,São Paulo,SP,Brasil,CEP: 04268-020
http://www.apontador.com.br/local/sp/sao_paulo/bares_e_choperias/C4022228645F5U5F57/cervejaria_1_de_abril.html,Cervejaria 1° de Abril,11 2762-1242,Rua Pirajá-779- Vila Canero,São Paulo,SP,Brasil,CEP: 03190-170
http://www.apontador.com.br/local/sp/sao_paulo/informatica/C404331E642B0Z2B0E/baixe_a_versao_mais_recente_gratis_do_skype_em_portugues.html,Baixe a versão mais recente grátis do Skype em Português,,Rua S-0- Ap 04-Vila Progresso,São Paulo,SP,Brasil,
http://www.apontador.com.br/local/sp/sao_paulo/enderecos_empresariais/C402996819351C3517/tarsao_suplementos.html,Tarsão Suplementos,11 5662-3623,Rua Frutuoso Barbosa-- Jardim Republica,São Paulo,SP,Brasil,CEP: 04812-030
http://www.apontador.com.br/local/sp/sao_paulo/enderecos_empresariais/C40609394A423O4233/mamede_salgadinhos.html,Mamede Salgadinhos,,Rua Adão Ribeiro-15- Jardim Primavera,São Paulo,SP,Brasil,CEP: 02755-070
http://www.apontador.com.br/local/sp/sao_paulo/centros_e_postos_de_saude/C40289394C442S4427/portal_da_saude.html,Portal da Saude,,Rua Araripira-60- Jardim Vista Alegre,São Paulo,SP,Brasil,CEP: 02877-000
http://www.apontador.com.br/local/sp/sao_paulo/enderecos_empresariais/C407925F224B6C4B61/eterna_saudade.html,Eterna Saudade,,Rua Icanhema-172- SLJ 03-Cidade Dutra,São Paulo,SP,Brasil,CEP: 04810-120
http://www.apontador.com.br/local/sp/sao_paulo/alimentos/C402015F57282N2825/salgados_cacique.html,Salgados Cacique,,Rua Morro de Santa Teresa-509- Jardim São Nicolau,São Paulo,SP,Brasil,CEP: 03685-020
http://www.apontador.com.br/local/sp/sao_paulo/construcao/C417110014603D603F/salviatti_construcoes.html,Salviatti Construcoes,,Rua Vítor Losacco-101- Jardim Satélite,São Paulo,SP,Brasil,CEP: 04815-070
http://www.apontador.com.br/local/sp/sao_paulo/enderecos_empresariais/C405967F1B214O2145/td_saldanha.html,Td Saldanha,,Rua Ester de Barros de Oliveira-21- Jardim Coimbra,São Paulo,SP,Brasil,CEP: 04932-310
http://www.apontador.com.br/local/sp/sao_paulo/igrejas/DJ238685/igreja_evangelica_pentegostal_o_brasil_para_cristo_v_rica_vila_rica.html,Igreja Evangélica Pentegostal O Brasil Para Cristo V Rica - Vila Rica,11 2918-1554,Rua São Benedito do Rio Preto-375- Vila Rica,São Paulo,SP,Brasil,CEP: 03912-010
http://www.apontador.com.br/local/sp/sao_paulo/servicos_financeiros_e_administrativos/C403684223054S0540/aldeck_servicos_especializados.html,Aldeck Serviços Especializados,11 5661-4554,Rua José Francisco de Freitas-1225- Jardim Maria Rita,São Paulo,SP,Brasil,CEP: 04814-180
http://www.apontador.com.br/local/sp/sao_paulo/eletroeletronicos/43682C28/video_e_foto_aragao.html,Vídeo e Foto Aragão,11 5841-0659,Estrada Do Campo Limpo-4919--Parque Esmeralda,São Paulo,SP,Brasil,CEP: 05787-000
http://www.apontador.com.br/local/sp/sao_paulo/moveis/38MW7Q99/marilena_alexandrino_cid_dutra.html,Marilena Alexandrino - Cid Dutra,11 5668-9561,Rua Casqueiro-229--Cidade Dutra,São Paulo,SP,Brasil,CEP: 04810-090
http://www.apontador.com.br/local/sp/sao_paulo/eletroeletronicos/2FXHPS8A/boog_industria_e_comercio_de_eletronicos.html,Boog Indústria e Comércio de Eletrônicos,11 2614-5649,Rua Oliveira Melo-686--Vila São José,São Paulo,SP,Brasil,CEP: 04271-000
http://www.apontador.com.br/local/sp/sao_paulo/escolas/2J9Z2226/emei_sergio_cardoso.html,Emei Sergio Cardoso,11 5666-6106,Rua Djalma Pessolato-57- Jardim Satélite,São Paulo,SP,Brasil,CEP: 04815-120
http://www.apontador.com.br/local/sp/sao_paulo/educacao_infantil/466LF82L/eei_cantinho_encantado_da_crianca.html,Eei Cantinho Encantado da Criança,11 2561-3763,Avenida Rio Mirivaí-9--Parque Santa Amélia,São Paulo,SP,Brasil,CEP: 08122-440
http://www.apontador.com.br/local/sp/sao_paulo/pneus/4XS4F66R/langella_pneus_comer.html,Langella Pneus Comer,11 2965-8151,Avenida Vila Ema-600- Vila São José,São Paulo,SP,Brasil,CEP: 03156-000
http://www.apontador.com.br/local/sp/sao_paulo/materiais_de_construcao/88GSYEXY/br_aluminio.html,Br Aluminio,11 3858-4946,Avenida Deputado Emílio Carlos-2295- Jardim Primavera,São Paulo,SP,Brasil,CEP: 02721-200
http://www.apontador.com.br/local/sp/sao_paulo/graficas_e_copias/7VZ894M6/padilla_industrias_graficas_s_a_jardim_boa_vista.html,Padilla Indústrias Gráficas S/A - Jardim Boa Vista,11 3782-2521,Rua Cândido Fontoura-468- Jardim Boa Vista,São Paulo,SP,Brasil,CEP: 05583-070
http://www.apontador.com.br/local/sp/sao_paulo/restaurantes/923H73XH/sabor_arte_pizzaria_prq_esmeralda.html,Sabor & Arte Pizzaria   - Prq Esmeralda,11 5842-6909,Rua Professor Joaquim Onofre de Araújo-185- Parque Esmeralda,São Paulo,SP,Brasil,CEP: 05784-140
http://www.apontador.com.br/local/sp/sao_paulo/pizzarias/8Y6NXR35/restaurante_e_pizzaria_curva_do_s_interlagos.html,Restaurante e Pizzaria Curva do S - Interlagos,11 5666-5743,Avenida Do Jangadeiro-631- Cidade Dutra,São Paulo,SP,Brasil,CEP: 04815-020
http://www.apontador.com.br/local/sp/sao_paulo/servicos_em_construcao/C4013354164A5O4A52/af_divisorias.html,Af Divisórias,11 2236-1122,Avenida Deputado Emílio Carlos-2624--Vila Santa Maria,São Paulo,SP,Brasil,CEP: 02720-200
http://www.apontador.com.br/local/sp/sao_paulo/restaurantes/C4027489084D5T4D51/pizzaria_coma_bem.html,Pizzaria Coma Bem,11 5661-7843,Rua Brás da Rocha-269- Jardim Iporanga,São Paulo,SP,Brasil,CEP: 04828-090
http://www.apontador.com.br/local/sp/sao_paulo/postos_de_combustivel/C40638541C450S4503/route_66_super_oil_change.html,Route 66 Super Oil Change,11 2272-1362,Rua Da Imprensa-269- Vila São José,São Paulo,SP,Brasil,CEP: 04265-000
http://www.apontador.com.br/local/sp/sao_paulo/estetica/H7S78G62/sumire_trajes_a_rigor_epp_cid_dutra.html,Sumire Trajes A Rigor  - Epp - Cid Dutra,11 5668-7305,Avenida Senador Teotônio Vilela-1268- Vila Santa Maria,São Paulo,SP,Brasil,CEP: 04801-000
http://www.apontador.com.br/local/sp/sao_paulo/comida_variada/2562X85W/la_cazzarola_refeicoes_prontas.html,La Cazzarola Refeições Prontas,11 5668-7480,Avenida Professor Papini-159- Cidade Dutra,São Paulo,SP,Brasil,CEP: 04805-300
http://www.apontador.com.br/local/sp/sao_paulo/casa_e_decoracao/C40316992F454Q454B/loja_pimposa.html,Loja Pimposa,,Avenida Manuel Alves Soares-162- Jardim Malia Ii,São Paulo,SP,Brasil,CEP: 04821-270
http://www.apontador.com.br/local/sp/sao_paulo/auto_escolas/98P9ELAT/auto_escola_dutra.html,Auto Escola Dutra,11 5666-2066,Rua Dinazar Ferraz de Camargo-65- Cidade Dutra,São Paulo,SP,Brasil,CEP: 04810-000
http://www.apontador.com.br/local/sp/sao_paulo/escolas/87568847/escola_pinheiro_jardim_primavera.html,Escola Pinheiro - Jardim Primavera,11 5662-8482,Rua Francisco Barreto-242- Jardim Primavera,São Paulo,SP,Brasil,CEP: 04812-140
http://www.apontador.com.br/local/sp/sao_paulo/educacao_infantil/8W9YQD8T/centro_de_recreacao_infantil_querubim_s_c_jd_boa_vista.html,Centro de Recreação Infantil Querubim S/C  - Jd. Boa Vista,11 3781-7916,Rua Baltazar Alves-100- Jardim Boa Vista,São Paulo,SP,Brasil,CEP: 05584-020
http://www.apontador.com.br/local/sp/sao_paulo/igrejas/V6V56UW5/mitra_diocesana_de_santo_amaro_paroquia_santa_ana.html,Mitra Diocesana de Santo Amaro Paróquia Santa Ana,11 5666-6273,Rua Astolfo Vieira de Rezende-70- Jardim Satélite,São Paulo,SP,Brasil,CEP: 04816-040
http://www.apontador.com.br/local/sp/sao_paulo/escolas_particulares/XC3J57D8/instituto_de_educacao_sol_girassol.html,Instituto de Educação Sol Girassol,11 3997-7159,Rua Rio Verde-2153- Vila Palmeiras,São Paulo,SP,Brasil,
http://www.apontador.com.br/local/sp/sao_paulo/festas_e_eventos/C40848941C420T4206/qualificados_brasil_eventos.html,Qualificados Brasil Eventos,11 5844-3803,Rua Professor Joaquim Onofre de Araújo-1- sala 02-Parque Esmeralda,São Paulo,SP,Brasil,CEP: 05784-140
