URL,Title,Phone,Street Address,Locality,Region,Country,Postal Code
http://www.apontador.com.br/local/sp/sao_paulo/construcao_civil/T7SV7U33/tiberio_construcoes_e_incorporacoes.html,Tibério Construções e Incorporações,11 5594-5918,Rua Gonçalo da Cunha-130- Chácara Inglesa,São Paulo,SP,Brasil,CEP: 04140-040
http://www.apontador.com.br/local/sp/sao_paulo/alimentos/U758LWCB/tutanos_carnes_e_emporio.html,Tutanos Carnes e Empório,11 5511-1296,Rua João Fernandes Camisa Nova Jr.-811--Jardim São Luís,São Paulo,SP,Brasil,CEP: 05844-000
http://www.apontador.com.br/local/sp/sao_paulo/clinicas_e_centros_de_diagnostico/XDM9UHFP/laboratorio_nicolaier_santana.html,Laboratório Nicolaier - Santana,11 2973-5981,Avenida Nova Cantareira-683- Jardim São Paulo,São Paulo,SP,Brasil,CEP: 02331-001
http://www.apontador.com.br/local/sp/sao_paulo/enderecos_empresariais/C4021029393A3N3A3A/mario_loschiavo_filho.html,MARIO LOSCHIAVO FILHO,11 2219-1412,RCOCKRANE-LD-616- CJ 201 CJ 202-IPIRANGA,SAO PAULO,SP,Brasil,CEP: 04213-001
http://www.apontador.com.br/local/sp/sao_paulo/pet_shops/C401666356301Z301B/consultorio_veterinario_mascote.html,Consultório Veterinário Mascote,11 2063-2472,Rua Arcipreste Andrade-681--Ipiranga,São Paulo,SP,Brasil,CEP: 04268-020
http://www.apontador.com.br/local/sp/sao_paulo/medicos_e_consultorios/C40492675A2D1T2D15/consultorio_medico_jadi.html,Consultorio Medico Jadi,,Rua Bom Pst.-- Ipiranga,São Paulo,SP,Brasil,
http://www.apontador.com.br/local/sp/sao_paulo/enderecos_empresariais/C4052179494A0C4A07/emporio_trem_mineiro.html,Emporio Trem Mineiro,,Estrada Do Cipó-95- Sítio Represa,São Paulo,SP,Brasil,CEP: 04894-040
http://www.apontador.com.br/local/sp/sao_paulo/pet_shops/SA43S8J7/aloe_vet_veterinario.html,Aloe Vet Veterinário,11 3903-1591,Avenida Agenor Couto de Magalhães-1493--Jardim Regina,São Paulo,SP,Brasil,CEP: 05174-000
http://www.apontador.com.br/local/sp/sao_paulo/enderecos_empresariais/C40170493A484Q4840/marcos_francisco_gregorio.html,MARCOS FRANCISCO GREGORIO,11 2557-6521,ETRSATURNINO PEREIRA-244- SAO MATEUS,SAO PAULO,SP,Brasil,CEP: 08485-570
http://www.apontador.com.br/local/sp/sao_paulo/construcao/35W23H23/nazario_distribuidora_de_vidros.html,Nazário Distribuidora de Vidros,11 2979-0722,Rua Antônio Clemente-203- Jardim São Paulo,São Paulo,SP,Brasil,CEP: 02039-020
http://www.apontador.com.br/local/sp/sao_paulo/clinicas_e_diagnosticos/G92Q7PJS/laboratorio_filgueiras_s_c_pirituba.html,Laboratório Filgueiras S/C . - Pirituba,11 3977-9662 / (11 3977-8349,Avenida Cabo Adão Pereira-115- Vila Pereira Barreto,São Paulo,SP,Brasil,CEP: 02936-010
http://www.apontador.com.br/local/sp/sao_paulo/eletroeletronicos/RGX83X2G/tratecno_vl_oratorio.html,Tratecno  - Vl Oratório,11 2021-2870,Rua Sanches de Aguiar-212- A-Vila Celeste,São Paulo,SP,Brasil,CEP: 03192-140
http://www.apontador.com.br/local/sp/sao_paulo/alimentos_e_bebidas/GE3KABE7/hortifruti_lirio_do_vale.html,Hortifruti Lirio do Vale,11 2154-1254,Avenida Sapopemba-3174- Chácara Mafalda,São Paulo,SP,Brasil,CEP: 08310-165
http://www.apontador.com.br/local/sp/sao_paulo/industrias/V34UDJ6F/italbronze_vila_oratorio.html,Italbronze - Vila Oratório,11 2965-0015,Rua Campo Largo-657- Vila Oratório,São Paulo,SP,Brasil,CEP: 03186-010
http://www.apontador.com.br/local/sp/sao_paulo/correios/C408694948103C1036/territorio_web_intelligence.html,Territorio Web Intelligence,,Avenida Raimundo Pereira de Magalhães-1720- BL 26 APTO 12-Piqueri,São Paulo,SP,Brasil,CEP: 05145-000
http://www.apontador.com.br/local/sp/sao_paulo/artigos_e_equipamentos_para_festas_e_eventos/C4041639485C0U5C03/tenda_de_umbanda_lirio_de_aruanda.html,Tenda de Umbanda Lirio de Aruanda,,Avenida Sapopemba-4050- Chácara Mafalda,São Paulo,SP,Brasil,CEP: 08310-165
http://www.apontador.com.br/local/sp/sao_paulo/comida_variada/C4075599454C5S4C54/lachonete_e_restaurante_lirio_da_paz.html,Lachonete e Restaurante Lirio da Paz,,Avenida João Carlos da Silva Borges-1249- Vila Cruzeiro,São Paulo,SP,Brasil,CEP: 04726-002
http://www.apontador.com.br/local/sp/sao_paulo/igrejas/C4049409425E1E5E1C/assembleia_de_deus_ministerio_kairos.html,Assembleia de Deus Ministerio Kairos,,Avenida Cangaíba-5225- 5235-Vila Libanesa,São Paulo,SP,Brasil,CEP: 03711-011
http://www.apontador.com.br/local/sp/sao_paulo/enderecos_empresariais/C4070529440A2E0A25/oliveira_melo_vestuario.html,Oliveira Melo Vestuario,,Rua Doutor Campos Mello-12- Jardim Bandeirantes,São Paulo,SP,Brasil,CEP: 02994-030
http://www.apontador.com.br/local/sp/sao_paulo/predios_publicos/C403600964615E6159/ad_ministerio_de_vila_imperio.html,Ad Ministerio de Vila Imperio,,Rua Leopoldo Lugones-19- Jardim Miriam,São Paulo,SP,Brasil,CEP: 04416-180
http://www.apontador.com.br/local/sp/sao_paulo/enderecos_empresariais/C4083559604E1T4E16/rd_representacao_demetrio.html,Rd- Representacao Demetrio,,Rua Tucuri-142- CASA-Chácara Inglesa,São Paulo,SP,Brasil,CEP: 04135-030
http://www.apontador.com.br/local/sp/sao_paulo/mercearias/C40874894A322U3224/emporio_boni_pontes.html,Emporio Boni Pontes,,Rua Vinte E Oito de Setembro-409- Ipiranga,São Paulo,SP,Brasil,CEP: 04267-000
http://www.apontador.com.br/local/sp/sao_paulo/consultorio_medico/JVUAJL5B/consultorio_medico_polimed.html,Consultório Médico Polimed,,Rua Doutor Elísio de Castro-65- A-Vila Dom Pedro Primeiro,São Paulo,SP,Brasil,CEP: 04277-010
http://www.apontador.com.br/local/sp/sao_paulo/contabilidade/C404241946141S1418/jl_escritorio_contabil.html,Jl Escritorio Contabil,,Avenida Luís Pires de Minas-819- SALA 6 E 7-Jardim Imperador,São Paulo,SP,Brasil,CEP: 03933-070
http://www.apontador.com.br/local/sp/sao_paulo/pecas_e_acessorios_para_veiculos/C408223A1D145E1457/mulher_s_a_vestuario_e_acessorio.html,Mulher S/A Vestuario e Acessorio,,Rua Jorge Braga-135- Jardim Camargo,São Paulo,SP,Brasil,CEP: 08120-210
http://www.apontador.com.br/local/sp/sao_paulo/veterinarios_canis_e_petshops/C407411237153N153A/aloe_vet_veterinario.html,Aloe Vet Veterinário,11 2548-3795,Rua Coronel Amílcar Magalhães-32--Jardim Santa Mônica,São Paulo,SP,Brasil,CEP: 05171-240
http://www.apontador.com.br/local/sp/sao_paulo/enderecos_empresariais/C406467F471B4C1B48/rogerio_esteves.html,Rogerio Esteves,,Rua Da Constituinte-184- CONJUNTO 23-Ipiranga,São Paulo,SP,Brasil,CEP: 04204-030
http://www.apontador.com.br/local/sp/sao_paulo/administracao/C4036072231E4Q1E48/escritorio_contabil_astro.html,Escritório Contábil Astro,11 2671-1401,Rua Antônio André Rodrigues-145--Chácara Mafalda,São Paulo,SP,Brasil,CEP: 03372-030
http://www.apontador.com.br/local/sp/sao_paulo/pecas_e_acessorios_para_veiculos/C404041F402D3N2D39/caiman_som_e_acessorio.html,Caiman Som e Acessorio,,R MANOEL BUENO DA FONSECA-30- A-Jardim Sao Luis,SAO PAULO,SP,Brasil,CEP: 08121-000
http://www.apontador.com.br/local/sp/sao_paulo/hostel/C407590F524B1D4B1F/minimercado_quarto_centenario.html,Minimercado Quarto Centenario,,Rua Morada Nova de Minas-454- Jardim Imperador,São Paulo,SP,Brasil,CEP: 03933-020
http://www.apontador.com.br/local/sp/sao_paulo/moveis_e_decoracao/C404140F2D431T4312/streel_moveis_de_escritorio.html,Streel Moveis de Escritorio,,Rua Itumirim-110- LT 7 QD 14-Jardim Tietê,São Paulo,SP,Brasil,CEP: 03941-050
http://www.apontador.com.br/local/sp/sao_paulo/cosmeticos/C413105003531T531F/o_boticario_carrefour_tatuape.html,O Boticário - Carrefour Tatuapé,11 2941-4940,Avenida Salim Farah Maluf-s/n- Água Rasa,São Paulo,SP,Brasil,
http://www.apontador.com.br/local/sp/sao_paulo/mercearias/C401669F3D273C273F/emporio_tudo_de_bom.html,Emporio Tudo de Bom,,R TIBURCIO DE SOUZA-226- BOX 3-Itaim Paulista,SAO PAULO,SP,Brasil,CEP: 08140-000
http://www.apontador.com.br/local/sp/sao_paulo/enderecos_empresariais/C404061F58050O050C/seminario_joao_xxiii.html,Seminário João Xxiii,11 2063-1492,Rua Doutor Mário Vicente-1108- Vila Dom Pedro Primeiro,São Paulo,SP,Brasil,CEP: 04270-001
http://www.apontador.com.br/local/sp/sao_paulo/artes/C41282901E4F6Q4F63/ministerio_restauracao_do_avivamento.html,Ministerio Restauracao do Avivamento,,Rua Coração Paulista-55- Vila Jurema,São Paulo,SP,Brasil,CEP: 08132-430
http://www.apontador.com.br/local/sp/sao_paulo/escolas/C41371800D20E20/anna_guerra_escritorio_de_arte.html,Anna Guerra Escritorio de Arte,,Rua Doutor Carvalho Parreiras-09- Vila Invernada,São Paulo,SP,Brasil,CEP: 03351-140
http://www.apontador.com.br/local/sp/sao_paulo/cooperativas_de_credito/C417017058164E1642/credito_popular_solidario.html,Credito Popular Solidario,11 3977-8883,Rua Padre Justino Lombardi-00304- Vila Pereira Cerca,São Paulo,SP,Brasil,CEP: 02931-060
http://www.apontador.com.br/local/sp/sao_paulo/medicos_e_consultorios/C40284875E0F5T0F51/rmf_consultorio_medico.html,Rmf Consultorio Medico,,Rua José Nunes-42- Jardim Lídia,São Paulo,SP,Brasil,CEP: 05862-210
http://www.apontador.com.br/local/sp/sao_paulo/dentistas/C404568748131D1312/robinson_dario_tognarelli.html,Robinson Dario Tognarelli,,Rua José Otoni-102- São Miguel Paulista,São Paulo,SP,Brasil,CEP: 08010-290
http://www.apontador.com.br/local/sp/sao_paulo/medicos_e_consultorios/E6CAT69Q/barrio_cia_jardim_umuarama.html,Barrio & Cia  - Jardim Umuarama,11 5523-8013,Rua José Neves-463- Jardim Umuarama,São Paulo,SP,Brasil,CEP: 04650-141
http://www.apontador.com.br/local/sp/sao_paulo/hospitais_particulares/C40637675A3B2T3B24/laboratorio_vital_brasil.html,Laboratorio Vital Brasil,,Avenida Do Rio Bonito-- Vila Califórnia,São Paulo,SP,Brasil,
http://www.apontador.com.br/local/sp/sao_paulo/medicina_e_saude_geral_/W4YE82FZ/poterio_servicos_medicos.html,Poterio Servicos Medicos,11 2371-7437,Avenida Vereador José Diniz-1362- Santo Amaro,São Paulo,SP,Brasil,CEP: 04604-001
http://www.apontador.com.br/local/sp/sao_paulo/consultorio_medico/S55PH837/consultorio_medico_megamed.html,Consultório Médico Megamed,11 99859-8108,Avenida José Pinheiro Borges-s/n- GLEBA I METRO-Itaquera,São Paulo,SP,Brasil,CEP: 08220-385
http://www.apontador.com.br/local/sp/sao_paulo/contabilidade/X3HDYV84/jvr_sistemas_e_planejamento_tributario.html,Jvr Sistemas e Planejamento Tributario,11 2918-6691,Rua José Luís de Oliveira-56- Vila Santa Virgínia,São Paulo,SP,Brasil,CEP: 03284-140
http://www.apontador.com.br/local/sp/sao_paulo/cartorios_e_tabeliaes/C4023499491B5Q1B53/cartorio_de_santo_amaro.html,Cartorio de Santo Amaro,,Avenida Vereador José Diniz-469- Chácara Santo Antonio,São Paulo,SP,Brasil,CEP: 04603-000
http://www.apontador.com.br/local/sp/sao_paulo/escolas/C407085F16564C5645/banca_cohab_educandario.html,Banca Cohab Educandario,,Rua José Porfírio de Sousa-2- Jardim Arpoador,São Paulo,SP,Brasil,CEP: 05563-090
http://www.apontador.com.br/local/sp/sao_paulo/joias_e_bjuterias/C401614F1A371Q3712/ministerio_alianca_com_deus.html,Ministerio Alianca Com Deus,,Rua José Leão dos Santos-309- JARDIM SANTO ANTONIO-Jardim Santo Antônio,São Paulo,SP,Brasil,CEP: 08032-280
http://www.apontador.com.br/local/sp/sao_paulo/educacao/C407924F53174D1740/alessandro_tiberio_treinamentos.html,Alessandro Tiberio Treinamentos,,Rua Claudino José Branco-53- FUNDOS -SALA 01-Vila Califórnia,São Paulo,SP,Brasil,CEP: 04775-163
http://www.apontador.com.br/local/sp/sao_paulo/moveis_e_decoracao/C41354000E4E0T4E06/lima_escritorio_de_negocios.html,Lima Escritorio de Negocios,,Rua José Ataliba Ortiz-113- Parque São Domingos,São Paulo,SP,Brasil,CEP: 05131-000
http://www.apontador.com.br/local/sp/sao_paulo/mercearias/C405888F1D074T0743/mercearia_do_honorio.html,Mercearia do Honorio,,Rua José Leão dos Santos-65- Jardim Santo Antônio,São Paulo,SP,Brasil,CEP: 08032-280
http://www.apontador.com.br/local/sp/sao_paulo/escolas_particulares/C41836004D295O2950/cohab_educandario_creche.html,Cohab Educandario Creche,11 3784-0344,Rua José Porfírio de Sousa-sn- Educandário,São Paulo,SP,Brasil,
http://www.apontador.com.br/local/sp/sao_paulo/lojas_diversas/L7W5RJ24/antiquario_jane_vila_helena.html,Antiquário Jane   - Vila Helena,11 2584-2344,Rua José Lopes Afonso-320- Parque Paulistano,São Paulo,SP,Brasil,CEP: 08081-230
http://www.apontador.com.br/local/sp/sao_paulo/bares_e_choperias/284X7R87/bar_e_emporio_ze_braza.html,Bar e Emporio Ze Braza,11 2962-2144,Rua Pires Caleiro-499- Jardim Vera Cruz,São Paulo,SP,Brasil,CEP: 08330-050
http://www.apontador.com.br/local/sp/sao_paulo/mecanicas_e_oficinas/73M872U6/ato_eletrico_mario.html,Ato Elétrico Mario,11 2041-0570,Avenida Águia de Haia---Jardim Coimbra,São Paulo,SP,Brasil,CEP: 03889-100
http://www.apontador.com.br/local/sp/sao_paulo/clinicas_de_fisioterapia/NG593WM9/equilibrio_fisioterapia_cambuci.html,Equilibrio Fisioterapia  - Cambuci,11 3277-5936,Rua Independência-145- Cj 21-Jardim Vera Cruz,São Paulo,SP,Brasil,
http://www.apontador.com.br/local/sp/sao_paulo/contabilidade/6QB797CQ/escritorio_santos_e_felicio.html,Escritorio Santos e Felicio,11 3936-2156,Rua Rodrigues Alves-171- EN 165-Parque Residencial Cocaia,São Paulo,SP,Brasil,CEP: 04849-502
http://www.apontador.com.br/local/sp/sao_paulo/industria_e_comercio/ANMC41/comercial_serralheria_porfirio.html,Comercial Serralheria Porfirio,,Rua Falkenberg-685- Jardim Comercial,São Paulo,SP,Brasil,CEP: 05885-240
http://www.apontador.com.br/local/sp/sao_paulo/cultura/99K2V94Z/mario_sato_consolacao.html,Mário Sato - Consolação,11 3257-2037,Rua Fernando Albuquerque-31--Sitio do Piqueri,São Paulo,SP,Brasil,CEP: 02329-050
http://www.apontador.com.br/local/sp/sao_paulo/mercearias/C406612907581Z5810/emporio_barro_branco.html,Emporio Barro Branco,11 5526-8807,Est. Barro Branco-1802- Jardim Sao Pedro Zona Sul,São Paulo,SP,Brasil,CEP: 00485-320
http://www.apontador.com.br/local/sp/sao_paulo/hospitais_e_postos_de_saude/C40740075E2E2U2E2B/sae_laboratorio_medico_3.html,Sae Laboratorio Medico 3,,Rua Maciel Monteiro-839- Vila Nhocune,São Paulo,SP,Brasil,CEP: 03566-000
http://www.apontador.com.br/local/sp/sao_paulo/bares_e_choperias/JRHQKHXV/bar_e_emporio_da_bela_vista.html,Bar e Empório da Bela Vista,11 2258-8330,Rua Vinte E Oito de Janeiro-390- Vila Bela Vista,São Paulo,SP,Brasil,CEP: 02617-090
http://www.apontador.com.br/local/sp/sao_paulo/enderecos_empresariais/C4019342214E1N4E1E/silverio_tomaz_junior.html,Silverio Tomaz Júnior,11 5512-2065,Estrada Itapecerica-Santo Amaro-3250--Jardim Dom José,São Paulo,SP,Brasil,CEP: 05835-004
http://www.apontador.com.br/local/sp/sao_paulo/mercearias/C4065279080F3Z0F3D/emporio_boa_esperanca.html,Emporio Boa Esperanca,11 5928-3033,Rua Giovanni Gabrieli-176- Jardim Icaraí,São Paulo,SP,Brasil,CEP: 04844-200
http://www.apontador.com.br/local/sp/sao_paulo/agricultura_e_pecuaria/C406272223373Q373A/floricultura_lirio_do_campo.html,Floricultura Lírio do Campo,11 5933-8468,Rua Bela Vista-1--Sitio do Piqueri,São Paulo,SP,Brasil,CEP: 04849-567
http://www.apontador.com.br/local/sp/sao_paulo/revendedores_e_concessionarias/2MQXN6LP/pck_som_acessorio.html,Pck Som Acessorio,11 5817-8354,Avenida Agostinho Rubin-335- Jardim Germânia,São Paulo,SP,Brasil,CEP: 05848-000
http://www.apontador.com.br/local/sp/sao_paulo/alimentos/T8Q7W2ZW/aquario_paes_e_doces_itaquera.html,Aquário Paes e Doces  - Itaquera,11 2524-3990,Rua Cautaros-237- Conjunto Residencial Jose Bonifacio,São Paulo,SP,Brasil,CEP: 08215-650
http://www.apontador.com.br/local/sp/sao_paulo/alimentos_e_bebidas/C404125908073T073A/emporio_e_merc_pequenos.html,Emporio e Merc Pequenos,11 5526-7487,Rua Coronel João Cabanas-596- Jardim Itajaí,São Paulo,SP,Brasil,CEP: 04855-100
http://www.apontador.com.br/local/sp/sao_paulo/enderecos_empresariais/C40283194E2D1C2D15/contabillity_servicos_de_escritorio.html,Contabillity Servicos de Escritorio,,Rua Boipeva-18- Jardim Nordeste,São Paulo,SP,Brasil,CEP: 08220-030
http://www.apontador.com.br/local/sp/sao_paulo/mecanicas_e_oficinas/C402817352135Z135C/dario_s_borracharia_e_chaveiro.html,Dario S Borracharia e Chaveiro,11 2513-2636,Avenida Nordestina-3360--Jardim Santo Antônio,São Paulo,SP,Brasil,CEP: 08032-000
http://www.apontador.com.br/local/sp/sao_paulo/medicos_e_consultorios/X8895UEM/consultorio_medico_cpl.html,Consultório Médico Cpl,11 2231-7546,Avenida Parada Pinto-1288- Vila Bela Vista,São Paulo,SP,Brasil,CEP: 02611-002
http://www.apontador.com.br/local/sp/sao_paulo/enderecos_empresariais/C40762193A3D0U3D0D/manoel_tenorio_bastos.html,MANOEL TENORIO BASTOS,11 2521-6405,Rua Augusto Aridas-291- Conjunto Residencial Jose Bonifacio,São Paulo,SP,Brasil,CEP: 08255-690
http://www.apontador.com.br/local/sp/sao_paulo/igrejas/C4043109490C2O0C28/assembleia_de_deus_ministerio_da_graca.html,Assembleia de Deus Ministerio da Graca,,Avenida Sousa Bandeira-257- Vila Nhocune,São Paulo,SP,Brasil,CEP: 03559-000
http://www.apontador.com.br/local/sp/sao_paulo/escolas/C408430A01095Z095C/e_e_i_educandario_menino_jesus.html,E. E. I. Educandario Menino Jesus,,Rua Plínio Cavalcanti-52- Artur Alvim,São Paulo,SP,Brasil,CEP: 03569-020
http://www.apontador.com.br/local/sp/sao_paulo/enderecos_empresariais/C401124F020B4C0B42/pedro_cesario_me.html,Pedro Cesario - Me,,Avenida Mateus de Albuquerque-411- CS 2-Capão Redondo,São Paulo,SP,Brasil,CEP: 05859-230
http://www.apontador.com.br/local/sp/sao_paulo/enderecos_empresariais/C407518A04544D544D/ecorfrio_refrigeracao.html,Ecorfrio - Refrigeracao,,Rua Saturnino Lopes de Morais-10- Chácara Cocaia,São Paulo,SP,Brasil,CEP: 04856-378
http://www.apontador.com.br/local/sp/sao_paulo/medicina_e_saude_geral_/C4027282131A3D1A32/o_hervanario_pharmacia_universal.html,O Hervanário Pharmácia Universal,11 5812-6464,Estrada De Itapecerica-3777--Jardim Avenida,São Paulo,SP,Brasil,CEP: 05835-005
http://www.apontador.com.br/local/sp/sao_paulo/enderecos_empresariais/C402968F08033N033D/e_m_m_equipamentos_p_escritorio.html,E.M-M.Equipamentos P/ Escritorio,,Rua Henrique Jacobs-132- Vila Nhocune,São Paulo,SP,Brasil,CEP: 03566-010
http://www.apontador.com.br/local/sp/sao_paulo/ventilacao_e_refrigeracao/C408927F2E0F4Q0F4C/ar_frio_refrigeracao.html,Ar Frio Refrigeracao,,Rua Daniel Mongolo-26- Conjunto Residencial Jose Bonifacio,São Paulo,SP,Brasil,CEP: 08250-580
http://www.apontador.com.br/local/sp/sao_paulo/religiao/C402867E5B461Q461D/tric_s_artigos_do_vestuario.html,Tric S Artigos do Vestuario,,Rua Otusco-87- Jardim Ipê,São Paulo,SP,Brasil,CEP: 05797-430
http://www.apontador.com.br/local/sp/sao_paulo/medicos_cirurgioes/C40769121E393S393E/tenorio_goncalves_de_jesus.html,Tenorio Gonçalves de Jesus,11 2057-4496,Rua Laranja Natal-124- Jardim Santa Fé,São Paulo,SP,Brasil,CEP: 04863-470
http://www.apontador.com.br/local/sp/sao_paulo/escolas/C41376104D051Q0513/escola_estadual_saverio_fittipaldi.html,Escola Estadual Saverio Fittipaldi,11 5976-2086 / (11 5528-1837,Rua Rufino Zado-sn- Jardim Noronha,São Paulo,SP,Brasil,CEP: 04853-070
http://www.apontador.com.br/local/sp/sao_paulo/administracao/C408410237163C163C/rh_escritorio_de_eventos.html,Rh Escritório de Eventos,11 2157-2132,Rua Paineiras-53--Parelheiros,São Paulo,SP,Brasil,CEP: 04771-080
http://www.apontador.com.br/local/sp/sao_paulo/contabilidade/C401276F4B0B0C0B0B/mario_e_molina_contabilidade.html,Mario e Molina Contabilidade,,Rua General Jerônimo Furtado-622- Jardim Modelo,São Paulo,SP,Brasil,CEP: 02237-000
http://www.apontador.com.br/local/sp/sao_paulo/servicos_gerais/C41430600A3F3D3F32/nucleo_social_ekilibrio.html,Nucleo Social Ekilibrio,,Rua Nova Jerusalém-164- Vila Califórnia,São Paulo,SP,Brasil,CEP: 03410-000
http://www.apontador.com.br/local/sp/sao_paulo/lavanderias/C4152420340D4D0D40/ana_paula_tenorio_cavalcante.html,Ana Paula Tenorio Cavalcante,11 5814-6549,Rua Almirante Luís Penido Burnier-693- Jardim Sandra,São Paulo,SP,Brasil,CEP: 05860-000
http://www.apontador.com.br/local/sp/sao_paulo/clinicas_e_hospitais_veterinarios/C418184012434Z4340/vidas_consultorio_veterinario.html,Vidas Consultorio Veterinario,,Rua Pedro Escobar-635- SALA 06-Jardim Eliana,São Paulo,SP,Brasil,CEP: 04851-210
http://www.apontador.com.br/local/sp/sao_paulo/enderecos_empresariais/C41179901D1E2E1E2A/lcrismodas_comercio_de_vestuario.html,Lcrismodas Comercio de Vestuario,,Rua Gastão Raul de Forton Bousquet-1- b-Jardim Ipê,São Paulo,SP,Brasil,CEP: 05797-000
http://www.apontador.com.br/local/sp/sao_paulo/igrejas/C402236449391E3917/igreja_assembleia_de_deus_ministerio_santuario_da_resposta.html,Igreja Assembleia de Deus Ministerio Santuario da Resposta,,Rua Yoshio Matsumura-2001- Parelheiros,São Paulo,SP,Brasil,CEP: 04875-020
http://www.apontador.com.br/local/sp/sao_paulo/centros_e_postos_de_saude/C56L2V87/pmsp_secretaria_municipal_d_esaude_jardim_coimbra.html,Pmsp-Secretaria Municipal D Esaude - Jardim Coimbra,11 2280-6211,Rua Nicolo Tartaglia-45- Jardim Coimbra,São Paulo,SP,Brasil,CEP: 03693-050
http://www.apontador.com.br/local/sp/sao_paulo/correios/C402014906013Z0136/maria_do_rosario_n_brasil.html,Maria do Rosario N. Brasil,,Rua Evaldo Calabrez-1629- Vila Princesa Isabel,São Paulo,SP,Brasil,CEP: 08410-070
http://www.apontador.com.br/local/sp/sao_paulo/moveis/C4063299155E3D5E36/artriq_moveis_para_escritorio.html,Artriq - Móveis Para Escritório,11 2359-8466,Rua Silva Bueno-535- Ipiranga,São Paulo,SP,Brasil,CEP: 04208-050
http://www.apontador.com.br/local/sp/sao_paulo/bibliotecas/R64FTSSW/centro_educacional_comunitario_maria_cursi.html,Centro Educacional Comunitário Maria Cursi,11 2962-9733,Avenida Maria Cursi-1232- Cidade São Mateus,São Paulo,SP,Brasil,CEP: 03962-000
http://www.apontador.com.br/local/sp/sao_paulo/clinicas_odontologicas/C401425421055N0558/consultorio_grajau_odontologia_avancada.html,Consultório Grajaú Odontologia Avançada,,Avenida Dona Belmira Marin-739- Parque Brasil,São Paulo,SP,Brasil,
http://www.apontador.com.br/local/sp/sao_paulo/servicos_de_limpeza/C401683447292T2927/biosanitario_desinsetizacao.html,Biosanitario Desinsetização,11 5924-3941,Rua Pinha Natal-126- CASA 2-Jardim São Bernardo,São Paulo,SP,Brasil,CEP: 04863-360
http://www.apontador.com.br/local/sp/sao_paulo/funerarias_e_cemiterios/D82L5J2S/central_de_vendas_de_jazigos_cemiterio_do_carmo_.html,Central de Vendas de Jazigos (Cemitério do Carmo),,Rua Professor Hasegawa-727- Colônia,São Paulo,SP,Brasil,CEP: 08260-090
http://www.apontador.com.br/local/sp/sao_paulo/veterinarios_canis_e_petshops/C40721334D2EU2E/atendimento_veterinario_domiciliar.html,Atendimento Veterinario Domiciliar,11 97575-4331,Rua Tijuco Preto-900--Vila Gomes Cardim,São Paulo,SP,Brasil,CEP: 03316-000
http://www.apontador.com.br/local/sp/sao_paulo/confeccoes_e_vestuario/PB266E84/emporio_hanna_banana.html,Emporio Hanna Banana,,Rua Tomás Antônio Vilani-234- Vila Santa Maria,São Paulo,SP,Brasil,CEP: 02562-000
http://www.apontador.com.br/local/sp/sao_paulo/confeccoes/58FQG2BC/pontual_beneficiamento_de_vestuario.html,Pontual Beneficiamento de Vestuario,,Rua Silva Bueno-1010- Ipiranga,São Paulo,SP,Brasil,CEP: 04208-000
http://www.apontador.com.br/local/sp/sao_paulo/cemiterios/87VXN26P/cemiterio_jardim_santo_andre.html,Cemitério Jardim Santo André,11 2273-0933,Rua Pampulha-71- Vila Monumento,São Paulo,SP,Brasil,CEP: 01548-070
http://www.apontador.com.br/local/sp/sao_paulo/servicos_financeiros_e_administrativos/929EFX98/assessoria_em_planejamento_sucessorio.html,Assessoria Em Planejamento Sucessório,,Rua Lorde Cockrane-616- conjunto 309-Ipiranga,São Paulo,SP,Brasil,CEP: 04213-001
http://www.apontador.com.br/local/sp/sao_paulo/nutricionistas/C40419190D1D4O1D4F/pavonutri_consultorio_de_nutricao.html,Pavonutri - Consultorio de Nutrição,11 2062-2258,R.Lord Cockrane-616- cj 1004-Ipiranga,São Paulo,SP,Brasil,
http://www.apontador.com.br/local/sp/sao_paulo/negocios/ATMTM85K/gerencial_servico_temporario.html,Gerencial Servico Temporario,,Rua João Paulo-s/n- Piqueri,São Paulo,SP,Brasil,CEP: 02913-080
http://www.apontador.com.br/local/sp/sao_paulo/industria_e_comercio/94688824/dci_diario_do_com_e_ind.html,Dci Diário do Com e Ind,11 5061-2994,Rua Bom Pst.-798- Ipiranga,São Paulo,SP,Brasil,CEP: 04203-000
http://www.apontador.com.br/local/sp/sao_paulo/contabilidade/2858QLMA/escritorio_de_contabilidade_moderna.html,Escritorio de Contabilidade Moderna,11 2273-2428,Rua Silva Bueno-1633- SL 11-Ipiranga,São Paulo,SP,Brasil,CEP: 04208-052
http://www.apontador.com.br/local/sp/sao_paulo/animais/C408847444390T390B/laclivet_laboratorio_veterinario.html,Laclivet Laboratorio Veterinario,11 2935-8243,Rua Santo Irineu-699- Chácara Inglesa,São Paulo,SP,Brasil,CEP: 04127-120
http://www.apontador.com.br/local/sp/sao_paulo/moveis_e_decoracao/842LQ8L8/emporio_das_flores_decoracoes.html,Empório das Flores Decorações,,Rua Dos Sorocabanos-745- Ipiranga,São Paulo,SP,Brasil,CEP: 04202-001
http://www.apontador.com.br/local/sp/sao_paulo/psicologos/C401427923560Z5608/consultorio_de_psicologia.html,Consultório de Psicologia,11 99988-6854,Rua Pedro Madureira-0- Jardim São Paulo,São Paulo,SP,Brasil,CEP: 02044-140
http://www.apontador.com.br/local/sp/sao_paulo/construcao_civil/C404740914165D1650/escritorio_am_perfuracoes.html,Escritorio Am Perfurações,11 2561-9542,Rua Maria Felícia-80- Itaim,São Paulo,SP,Brasil,CEP: 08120-120
http://www.apontador.com.br/local/sp/sao_paulo/clinicas_e_centros_de_diagnostico/C406637862023Z0236/consultorio_de_psicologia.html,Consultório de Psicologia,11 2041-0787,Rua Doutor José do Amaral-0- 234 Sala 04-Jardim Lisboa,São Paulo,SP,Brasil,CEP: 03675-010
http://www.apontador.com.br/local/sp/sao_paulo/clinicas_e_centros_de_diagnostico/7MVQ7S9B/laboratorio_alvim_crisiuma.html,Laboratorio Alvim Crisiuma,55 1134-32320,Centro da Cidade-164- Jardim São Paulo- Zona Norte,São Paulo,SP,Brasil,CEP: 02042-010
http://www.apontador.com.br/local/sp/sao_paulo/salao_de_beleza/QM6B43MQ/j_paulinos_cabeleireiros_unissex.html,J Paulinos Cabeleireiros Unissex,11 5972-6603,Rua José Bocchiglieri-20--Jardim Floresta,São Paulo,SP,Brasil,CEP: 04836-000
