URL,Title,Phone,Street Address,Locality,Region,Country,Postal Code
http://www.apontador.com.br/local/sp/sao_paulo/servicos_em_veiculos/C4062607622A2O2A20/radares_fotograficos.html,Radares Fotográficos,,Avenida Senador Teotônio Vilela-1634- 40*-Cidade Dutra,São Paulo,SP,Brasil,CEP: 04801-000
http://www.apontador.com.br/local/sp/sao_paulo/templos/GEB58693/igreja_evangelica_grito_de_liberdade_ministerio_de_jesus_cid_sao_mat.html,Igreja Evangelica Grito de Liberdade Ministerio de Jesus - Cid São Mat,11 2017-1696,Rua Antônio Previato-1492- Cidade São Mateus,São Paulo,SP,Brasil,CEP: 03958-010
http://www.apontador.com.br/local/sp/sao_paulo/motel/EKQ3UCR8/motel_top_hill.html,Motel Top Hill,11 3974-3259,Raimundo Pereira de Magalhães-7000- Pirituba,São Paulo,SP,Brasil,
http://www.apontador.com.br/local/sp/sao_paulo/escolas/2XP44B7K/apm_da_esc_est_de_1_grau_prof_victorio_americo_fontana_jd_sao_gabrie.html,Apm da Esc Est de 1 Grau Prof Victorio Americo Fontana - Jd São Gabrie,11 2727-0181,Rua Nepomuceno-117- Jardim Imperador,São Paulo,SP,Brasil,CEP: 03940-090
http://www.apontador.com.br/local/sp/sao_paulo/mercearias/79K92GHH/mercadinho_renata_sao_paulo_me_jd_sta_edwiges.html,Mercadinho Renata Sao Paulo . - Me. - Jd Sta Edwiges,11 5897-2493,Avenida Inácio Dias da Silva-4- Jardim Santa Edwiges,São Paulo,SP,Brasil,CEP: 04913-180
http://www.apontador.com.br/local/sp/sao_paulo/som_e_video/95P36NZP/land_car_som_e_acessorios_sao_miguel_paulista.html,Land Car Som e Acessórios   - São Miguel Paulista,11 2297-8111 / (11 2956-4190,Avenida Pires do Rio-499- Parque Sônia,São Paulo,SP,Brasil,CEP: 08020-000
http://www.apontador.com.br/local/sp/sao_paulo/bancos/9Y587722/caixa_eletronico_banco_santander_011_0500_centro_universitario_sao.html,Caixa Eletrônico Banco Santander - 011 - 0500 Centro Universitario São,,Avenida Nazaré-1500- Ipiranga,São Paulo,SP,Brasil,CEP: 04262-200
http://www.apontador.com.br/local/sp/sao_paulo/escolas/L3MBVPR3/centro_universitario_sao_camilo_campus_cardeal_motta_vl_monumento.html,Centro Universitário São Camilo - Campus Cardeal Motta - Vl Monumento,,Praça Monumento-50- Vila Monumento,São Paulo,SP,Brasil,
http://www.apontador.com.br/local/sp/sao_paulo/funerarias_e_cemiterios/M4N866ZW/servico_funerario_do_municipio_de_sao_paulo_jardim_novo_parelheiros.html,Serviço Funerário do Município de São Paulo - Jardim Novo Parelheiros,11 5920-8275,Rua Amaro de Pontes-237- Parque Tamari,São Paulo,SP,Brasil,CEP: 04890-360
http://www.apontador.com.br/local/sp/sao_paulo/casa_e_decoracao/2H29TRKQ/moveflex_comercio_e_manutde_moveis_p_escritorio_jardim_sao_luis.html,Moveflex Comércio e Manutde Móveis P/ Escritório - Jardim São Luís,11 5851-1039,Rua Frederico Marcicano-431- Jardim São Luís,São Paulo,SP,Brasil,CEP: 05812-000
http://www.apontador.com.br/local/sp/sao_paulo/servicos_em_informatica/ZDAQ2884/gold_news_suprimentos_e_equiptos_p_escritorio_jd_sao_luis.html,Gold News Suprimentos e Equiptos P/Escritorio   - Jd São Luís,11 5851-3601,Rua Geraldo Fraga de Oliveira-115- Jardim São Luís,São Paulo,SP,Brasil,CEP: 05843-000
http://www.apontador.com.br/local/sp/sao_paulo/institutos_e_fundacoes/3QF84XQ7/instituto_missionario_servas_de_jave_salvador_jd_sao_pedro.html,Instituto Missionario Servas de Jave Salvador - Jd São Pedro,11 5528-7105,Etr Barro Branco-791- Grajau,São Paulo,SP,Brasil,
http://www.apontador.com.br/local/sp/sao_paulo/moveis/K66QS4N4/condominio_sao_januario_v_cj_pe_manoel_nobrega.html,Condominio Sao Januario V - Cj Pe Manoel Nóbrega,11 2748-8818,Avenida Padre Francisco de Toledo-595- Vila Nhocune,São Paulo,SP,Brasil,CEP: 03590-120
http://www.apontador.com.br/local/sp/sao_paulo/pizzarias/FKRDGLX4/pizzaria_margarita.html,Pizzaria Margarita,11 5666-2555,Rua Augusto Correia-272- Jardim Cruzeiro,São Paulo,SP,Brasil,CEP: 04803-160
http://www.apontador.com.br/local/sp/sao_paulo/pizzarias/C401426214071O071F/pizzaria_manja.html,Pizzaria Manja,11 5928-7091,Rua Gonçalo Soares da França-245--Jardim Floresta,São Paulo,SP,Brasil,CEP: 04836-030
http://www.apontador.com.br/local/sp/sao_paulo/beleza_e_estetica/QP3X8T6K/taty_studio.html,Taty Studio,11 5668-7185,Avenida Professor Papini-319- Cidade Dutra,São Paulo,SP,Brasil,CEP: 04805-300
http://www.apontador.com.br/local/sp/sao_paulo/medicos_e_consultorios/HNYB8D5T/dental_uno_me_jd_sao_nicolau.html,Dental Uno -Me. - Jd São Nicolau,11 5669-0228,Rua Miguel Fontanarosa-185- Jardim São Nicolau,São Paulo,SP,Brasil,CEP: 04802-120
http://www.apontador.com.br/local/sp/sao_paulo/estetica/RRJ7986J/art_vestida_modas_jd_sao_roque.html,Art Vestida Modas - Jd São Roque,11 5816-4064,Rua Zacarias Daca-25- Cs 2-Usina Piratininga,São Paulo,SP,Brasil,CEP: 04444-020
http://www.apontador.com.br/local/sp/sao_paulo/lojas_diversas/XR8GHS82/priscilla_flores_e_peixes_me_jd_sao_rafael.html,Priscilla Flores e Peixes  Me  - Jd São Rafael,11 5929-5225,Avenida Senador Teotônio Vilela-7260--Jardim São Rafael,São Paulo,SP,Brasil,CEP: 04864-002
http://www.apontador.com.br/local/sp/sao_paulo/graficas_e_copias/93A4222V/satelite_acabamentos_graficos_prq_sao_lourenco.html,Satelite Acabamentos Graficos  -  - Prq São Lourenço,11 2017-0496,Rua Forte do Rio Branco-781- Gp Modulo 10-Parque São Lourenço,São Paulo,SP,Brasil,CEP: 08340-140
http://www.apontador.com.br/local/sp/sao_paulo/servicos_em_construcao/72M986F3/emporio_jc_moveis.html,Empório Jc Móveis,,Rua Silva Bueno-447- Ipiranga,São Paulo,SP,Brasil,CEP: 04208-050
http://www.apontador.com.br/local/sp/sao_paulo/motel/XE5767SX/motel_top_hill_lapa.html,Motel Top Hill - Lapa,11 3974-3259,Avenida Raimundo Pereira de Magalhães-7000- Jardim Cidade Pirituba,São Paulo,SP,Brasil,CEP: 02940-005
http://www.apontador.com.br/local/sp/sao_paulo/pizzarias/4M88UC85/pizzaria_lenha_sul.html,Pizzaria Lenha Sul,11 5663-6366,Avenida Pres. João Goulart-2023- Jardim Guanhembu,São Paulo,SP,Brasil,CEP: 04821-010
http://www.apontador.com.br/local/sp/sao_paulo/pecas_e_acessorios_para_veiculos/C40146682F3C5D3C51/desmanche_interlagos.html,Desmanche Interlagos,11 5669-2866,Avenida Senador Teotônio Vilela-2364 -interlagos- Próximo a Interlagos-Rio Bonito,São Paulo,SP,Brasil,CEP: 04801-000
http://www.apontador.com.br/local/sp/sao_paulo/construcao_geral_/9A28CU6L/almak_industria_e_comercio_prq_sao_lourenco.html,Almak Indústria e Comércio  - Prq São Lourenço,11 2919-5699,Rua Forte do Rio Branco-161--Cidade Satélite Santa Barbara,São Paulo,SP,Brasil,CEP: 08340-140
http://www.apontador.com.br/local/sp/sao_paulo/pastelarias/222WLD7J/marcio_luiz_da_silva_pastelaria_jd_sao_nicolau.html,Marcio Luiz da Silva Pastelaria  - Jd São Nicolau,11 2041-2004,Rua Sonho Gaúcho-283- Jardim São Nicolau,São Paulo,SP,Brasil,CEP: 03685-000
http://www.apontador.com.br/local/sp/sao_paulo/sindicatos_e_federacoes/852FAXY6/sindicato_dos_comerciarios_de_sao_paulo_sto_amaro.html,Sindicato dos Comerciários de São Paulo - Sto Amaro,11 2162-1700,Rua Luís Barroso-Cel-102--Cidade Dutra,São Paulo,SP,Brasil,
http://www.apontador.com.br/local/sp/sao_paulo/agricultura_e_pecuaria/8K94ELE2/sao_francisco_comercio_de_plantas_vl_universitaria.html,São Francisco Comércio de Plantas - Vl Universitária,11 3731-4718,Rua Doutor José Pinto Azeredo-89- Vila Universitária,São Paulo,SP,Brasil,CEP: 05359-100
http://www.apontador.com.br/local/sp/sao_paulo/dentistas/C40482241D1B2N1B24/dentista_ja_sao_paulo_dr_edson_koji.html,Dentista Já | São Paulo | Dr. Edson Koji,11 3975-0927,Rua Bertópolis-84- Jardim São José,São Paulo,SP,Brasil,CEP: 02971-010
http://www.apontador.com.br/local/sp/sao_paulo/postos_de_combustivel/GG2E48XU/posto_ipiranga_auto_posto_parque_sao_rafael.html,Posto Ipiranga - Auto Posto Parque Sao Rafael,11 5054-5566,Avenida Adélia Chohfi-373- Jardim Vera Cruz,São Paulo,SP,Brasil,CEP: 08320-395
http://www.apontador.com.br/local/sp/sao_paulo/clinicas_e_centros_de_diagnostico/84C7JD2Y/dr_mario_joseph_junior_medico.html,Dr. Mario Joseph Junior - Médico,,Rua Grauçá-373- Vila Sonia,São Paulo,SP,Brasil,CEP: 05626-020
http://www.apontador.com.br/local/sp/sao_paulo/escolas/C5P82QTG/padre_francisco_joao_de_azevedo.html,Padre Francisco João de Azevedo,11 5666-8956,Avenida Alcindo Ferreira-2- Jardim Cruzeiro,São Paulo,SP,Brasil,CEP: 04803-170
http://www.apontador.com.br/local/sp/sao_paulo/pecas_e_acessorios_para_veiculos/RFS878B2/lugrafi_retifica_de_carburadores.html,Lugrafi Retifica de Carburadores,11 2721-3173,Avenida Rio das Pedras-3411- Cidade Centenário,São Paulo,SP,Brasil,CEP: 03930-310
http://www.apontador.com.br/local/sp/sao_paulo/revendedores_e_concessionarias/3XEGRCB6/almir_da_silveira_leite_jd_sao_rafael.html,Almir da Silveira Leite - Jd São Rafael,11 5979-8999,Avenida Senador Teotônio Vilela-7780--Jardim São Rafael,São Paulo,SP,Brasil,CEP: 04864-002
http://www.apontador.com.br/local/sp/sao_paulo/alimentos/448PX622/j_g_rcadinho_jd_sao_nicolau.html,J G Rcadinho  - Jd São Nicolau,11 2041-8929,Rua Sonho Gaúcho-347--Jardim São Nicolau,São Paulo,SP,Brasil,CEP: 03685-000
http://www.apontador.com.br/local/sp/sao_paulo/revendedores_e_concessionarias/J8G7M429/m_r_de_barros_pecas_jd_sao_rafael.html,M.R.De Barros Pecas -  - Jd São Rafael,11 5927-4610,Avenida Senador Teotônio Vilela-7177- Jardim São Rafael,São Paulo,SP,Brasil,CEP: 04864-001
http://www.apontador.com.br/local/sp/sao_paulo/pet_shops/ZTC6Q7JK/clinica_veterinaria_sao_lazaro_jd_maringa.html,Clinica Veterinaria Sao Lazaro  - Jd Maringá,11 2091-0837,Avenida Itaquera-655- Jardim Maringá,São Paulo,SP,Brasil,CEP: 03526-000
http://www.apontador.com.br/local/sp/sao_paulo/eletroeletronicos/R8M48JJR/b_new_way_jd_sao_rafael.html,B-New Way  -  - Jd São Rafael,11 5527-8730,Avenida Senador Teotônio Vilela-7298- 7300-Jardim São Rafael,São Paulo,SP,Brasil,CEP: 04864-002
http://www.apontador.com.br/local/sp/sao_paulo/educacao_infantil/VACJVM43/creche_p_conv_sao_judas_tadeu.html,Creche P Conv Sao Judas Tadeu,,Rua Suzana de Melo-364- Vila Progresso,São Paulo,SP,Brasil,CEP: 08041-280
http://www.apontador.com.br/local/sp/sao_paulo/medicina_e_saude_geral_/J35P2Z8W/casa_de_ervas_sao_benedito_prq_sta_amelia.html,Casa de Ervas Sao Benedito   - Prq Sta Amélia,11 2963-1711,Rua Inocêncio Preto Moreira-6- Parque Santa Amélia,São Paulo,SP,Brasil,CEP: 08122-460
http://www.apontador.com.br/local/sp/sao_paulo/associacoes_e_sindicatos/L4X4EVJ2/atasp_associacao_dos_trabalhadores_ambulantes_de_sao_paulo.html,Atasp Associacao dos Trabalhadores Ambulantes de Sao Paulo,11 3104-5690,Rua José Bonifácio Fo.-395- Jardim São Benedito,São Paulo,SP,Brasil,CEP: 04813-060
http://www.apontador.com.br/local/sp/sao_paulo/igrejas/335V48R8/terceira_igreja_presbiteriana_conservadora_de_sao_paulo.html,Terceira Igreja Presbiteriana Conservadora de São Paulo,11 2239-6907,Rua Guarabira-105- Jardim Primavera,São Paulo,SP,Brasil,CEP: 02762-060
http://www.apontador.com.br/local/sp/sao_paulo/empresas_de_energia/34G285L3/eletropaulo_eletricidade_de_sao_paulo_s_a_jardim_satelite.html,Eletropaulo Eletricidade de São Paulo S/A - Jardim Satélite,11 5667-6968,Rua Plínio Schmidt-46- Jardim Lallo,São Paulo,SP,Brasil,CEP: 04815-130
http://www.apontador.com.br/local/sp/sao_paulo/estetica/2V798HQ2/lucelio_nogueira_de_carvalho_jd_sao_nicolau.html,Lucelio Nogueira de Carvalho  - Jd São Nicolau,11 2280-0747,Rua Sonho Gaúcho-19- Lt 19 Qd 11-Jardim São Nicolau,São Paulo,SP,Brasil,CEP: 03685-000
http://www.apontador.com.br/local/sp/sao_paulo/estetica/4TWXJPCF/newarts_comercio_e_estamparia_jd_sao_nicolau.html,Newarts Comercio e Estamparia  - Jd São Nicolau,11 2967-5588,Rua Ribeirão do Pinhal-19- Jardim São Nicolau,São Paulo,SP,Brasil,CEP: 03685-160
http://www.apontador.com.br/local/sp/sao_paulo/construcao/ANMC13595/comercial_sao_rafael_materiais_para_construcao_me_.html,Comercial Sao Rafael Materiais Para Construcao  - Me.,11 5925-4578 / (11 5928-4118,Rua Pedro de Andrade Caminha-132- Jardim São Rafael,São Paulo,SP,Brasil,CEP: 04860-060
http://www.apontador.com.br/local/sp/sao_paulo/eletroeletronicos/LMNT2JE3/teletecnica_instaladora_telefonica_jd_sao_benedito.html,Teletecnica Instaladora Telefonica   - Jd São Benedito,11 4178-2893,Rua Benedito Vieira da Silva-28- Jardim São Benedito,São Paulo,SP,Brasil,CEP: 04813-130
http://www.apontador.com.br/local/sp/sao_paulo/moveis/L9Q3U848/debora_ferreira_do_nascimento_souza_jd_sao_rafael.html,Debora Ferreira do Nascimento Souza -  - Jd São Rafael,11 5938-6453,Rua Sebastian Casanova-25- Jardim Guanabara,São Paulo,SP,Brasil,CEP: 04860-230
http://www.apontador.com.br/local/sp/sao_paulo/entretenimento_e_lazer/3774562F/anhembi_turismo_e_eventos_da_cidade_de_sao_paulo_s_a.html,Anhembi Turismo e Eventos da Cidade de São Paulo S/A,11 5666-8830,Avenida Senador Teotônio Vilela-261- Cidade Dutra,São Paulo,SP,Brasil,CEP: 04801-010
http://www.apontador.com.br/local/sp/sao_paulo/corretores_de_seguros/7HJ7WAXD/jsa_administracao_e_corretora_de_seguros_jd_sao_benedito.html,Jsa Administração e Corretora de Seguros - Jd São Benedito,11 5661-0272,Rua Raimundo Amaro dos Santos-81--Jardim São Benedito,São Paulo,SP,Brasil,CEP: 04813-110
http://www.apontador.com.br/local/sp/sao_paulo/transporte/F3HWZQ3Q/sao_paulo_transportes_sptrans_jardim_paulista.html,São Paulo Transportes-Sptrans - Jardim Paulista,11 3849-1395,Avenida Sto - Amaro-2020- Cidade Dutra,São Paulo,SP,Brasil,
http://www.apontador.com.br/local/sp/sao_paulo/consultoria/NA2X4JP5/sergio_aparecido_tamura_sao_miguel_paulista.html,Sergio Aparecido Tamura  - São Miguel Paulista,11 2956-9389,Rua João Pedroso-10- A-Parque Esmeralda,São Paulo,SP,Brasil,CEP: 04828-080
http://www.apontador.com.br/local/sp/sao_paulo/alimentos/WQ6QPTSQ/clipper_distribuidora_de_ovos_me_jd_sao_benedito.html,Clipper Distribuidora de Ovos  Me. - Jd São Benedito,11 5631-8231,Rua Benedito Vieira da Silva-81- Jardim São Benedito,São Paulo,SP,Brasil,CEP: 04813-130
http://www.apontador.com.br/local/sp/sao_paulo/clinicas_de_cardiologia/XTBJ8HYN/instituto_de_cardiologia_de_sao_paulo_jardim_paulista.html,Instituto de Cardiologia de São Paulo - Jardim Paulista,11 3845-2200,Avenida Sto - Amaro-2468- Cidade Dutra,São Paulo,SP,Brasil,
http://www.apontador.com.br/local/sp/sao_paulo/materiais_de_construcao/C40221594C1F2O1F26/deposito_de_materiais_para_construcao_sao_luiz.html,Deposito de Materiais Para Construcao Sao Luiz,,Rua Antônio João de Medeiros-1173- Vila São José,São Paulo,SP,Brasil,CEP: 08140-060
http://www.apontador.com.br/local/sp/sao_paulo/moveis_e_decoracao/286K234A/tapecaria_novacuti_decoracoes_jd_sao_nicolau.html,Tapeçaria Novacuti Decorações - Jd. São Nicolau,11 5666-1870,Avenida Professor Papini-226- Cidade Dutra,São Paulo,SP,Brasil,CEP: 04805-300
http://www.apontador.com.br/local/sp/sao_paulo/associacoes_e_sindicatos/NUC98A2G/cooperativa_dos_trabalhadores_autonomos_em_transp_de_sao_pau.html,Cooperativa dos Trabalhadores Autonomos Em Transp de Sao Pau,11 5979-7655,Avenida Senador Teotônio Vilela-8200- Jardim Guanabara,São Paulo,SP,Brasil,CEP: 04858-002
http://www.apontador.com.br/local/sp/sao_paulo/pecas_e_acessorios_para_veiculos/4BBQQN85/pe_car_auto_pecas_jd_sao_nicolau.html,Pe Car Auto Pecas   - Jd São Nicolau,11 2043-3824,Rua Sonho Gaúcho-154- Jardim São Nicolau,São Paulo,SP,Brasil,CEP: 03685-000
http://www.apontador.com.br/local/sp/sao_paulo/teatro_e_cultura/JLB83V97/escolas_de_futebol_do_sao_paulo__sto_amaro.html,Escolas de Futebol do São Paulo - Sto Amaro,11 5687-6480,Avenida Sto - Amaro-7070- Cidade Dutra,São Paulo,SP,Brasil,
http://www.apontador.com.br/local/sp/sao_paulo/revendedores_e_concessionarias/QCGHJ8B5/band_auto_center_comercial_sao_matheus.html,Band Auto Center Comercial - São Matheus,11 2721-5447,Avenida Rio das Pedras-3252- Jardim São Cristóvão,São Paulo,SP,Brasil,CEP: 03930-300
http://www.apontador.com.br/local/sp/sao_paulo/bancos/DX2BK27Q/archival_agentes_autonomos_de_investimento_jd_sao_nicolau.html,Archival Agentes Autonomos de Investimento - Jd São Nicolau,11 3105-7317,Rua Morro de Santa Teresa-657- Jardim São Nicolau,São Paulo,SP,Brasil,CEP: 03685-020
http://www.apontador.com.br/local/sp/sao_paulo/religiao/B2UU8NSM/mitra_arquidiocesana_de_sao_paulo_vila_progresso.html,Mitra Arquidiocesana de São Paulo - Vila Progresso,11 3971-3717,Rua João Melo da Câmara-47- Vila Progresso,São Paulo,SP,Brasil,CEP: 02978-000
http://www.apontador.com.br/local/sp/sao_paulo/festas_e_eventos/6STG6W48/jefama_embalagens_personalizadas_jd_sao_judas_tadeu.html,Jefama Embalagens Personalizadas - Jd São Judas Tadeu,11 5667-6645,Rua Alberto Caeiro-114- Jardim Edilene,São Paulo,SP,Brasil,CEP: 04813-150
http://www.apontador.com.br/local/sp/sao_paulo/alimentos/65WPWYN6/comercio_de_gas_sao_nicolau_jd_sao_nicolau.html,Comercio de Gas Sao Nicolau  -  - Jd São Nicolau,11 2280-4860,Rua Valqueire-14- Jardim São Nicolau,São Paulo,SP,Brasil,CEP: 03685-100
http://www.apontador.com.br/local/sp/sao_paulo/flores/GP4A7KBY/prefeitura_do_municipio_de_sao_paulo_jardim_das_flores.html,Prefeitura do Município de São Paulo - Jardim das Flores,11 5514-3408,Rua Manuel Dias Leme-16- Jardim Santa Edwiges,São Paulo,SP,Brasil,CEP: 04913-170
http://www.apontador.com.br/local/sp/sao_paulo/servicos_em_construcao/335KL6J6/marcenaria_nossa_senhora_de_fatima_jd_sao_gilberto.html,Marcenaria Nossa Senhora de Fatima  - Jd São Gilberto,11 3735-7785,Avenida José Xavier de Araújo-152--Vila Alba,São Paulo,SP,Brasil,
http://www.apontador.com.br/local/sp/sao_paulo/revendedores_e_concessionarias/93H2VZ5E/marcos_da_silva_poli_cid_sao_francisco.html,Marcos da Silva Poli -  - Cid São Francisco,11 3719-5548,Rua José Davi de Oliveira-s/n- Vila Adalgisa,São Paulo,SP,Brasil,CEP: 05356-020
http://www.apontador.com.br/local/sp/sao_paulo/transporte/88W82AY3/sao_paulo_transportes_sptrans_parque_das_paineiras.html,São Paulo Transportes-Sptrans - Parque das Paineiras,11 2046-0268,Avenida Águia de Haia-s/n- Jardim Coimbra,São Paulo,SP,Brasil,
http://www.apontador.com.br/local/sp/sao_paulo/construcao_geral_/287W39W2/jc_gutierrez_gutierrez_jd_sao_cristovao.html,Jc Gutierrez & Gutierrez  - Jd São Cristóvão,11 2721-6785,Rua Serra Bonita-47- A-Jardim São José,São Paulo,SP,Brasil,CEP: 03930-100
http://www.apontador.com.br/local/sp/sao_paulo/servicos_sociais/ED82X2UU/servico_social_perseveranca_parque_sao_rafael.html,Serviço Social Perseverança - Parque São Rafael,11 2919-3439,Rua Redução de Caaguaçu-195- Jardim Vera Cruz,São Paulo,SP,Brasil,CEP: 08310-590
http://www.apontador.com.br/local/sp/sao_paulo/escritorio_de_engenharia/LK2J96EB/tallos_pinturas_e_acabamentos_jd_sao_judas_tadeu.html,Tallos Pinturas e Acabamentos - Jd São Judas Tadeu,11 5662-3099,Rua Álvaro Viana-82- Jardim São Judas Tadeu,São Paulo,SP,Brasil,CEP: 04813-160
http://www.apontador.com.br/local/sp/sao_paulo/enderecos_empresariais/TT9BRD68/prefeitura_municipal_de_sao_paulo_parque_res_cocaia.html,Prefeitura Municipal de São Paulo - Parque Res Cocaia,11 3284-4158,Rua Paraíso-387- Jardim Vera Cruz,São Paulo,SP,Brasil,
http://www.apontador.com.br/local/sp/sao_paulo/associacoes_e_sindicatos/HUN33F5H/associacao_budista_formosa_jd_sao_judas_tadeu.html,Associacao Budista Formosa - Jd São Judas Tadeu,11 3208-5117,Rua Antônio Burlini-2899- Jardim São Judas Tadeu,São Paulo,SP,Brasil,CEP: 04858-170
http://www.apontador.com.br/local/sp/sao_paulo/terapias_alternativas/JHTFJV7N/espaco_ahnnie_equilibrio_corpo_e_mente.html,Espaço Ahnnie -Equilíbrio Corpo e Mente,11 3441-1308 / (11 8452-1635,Rua Manuel José Machado-180- Campo Grande-Santo Amaro-SP-Vila São Pedro,São Paulo,SP,Brasil,CEP: 04676-100
http://www.apontador.com.br/local/sp/sao_paulo/imobiliarias/77GA855U/aptos_de_2_dormitorios_zona_norte_de_sao_paulo.html,Aptos de 2 Dormitórios Zona Norte de São Paulo,,Rua Agreste de Itabaiana-855- Jardim São Nicolau,São Paulo,SP,Brasil,CEP: 03683-000
http://www.apontador.com.br/local/sp/sao_paulo/agua_e_esgoto/TT5KHUM6/cia_de_saneamento_basico_do_estado_de_sao_paulo_sabesp.html,Cia de Saneamento Básico do Estado de São Paulo Sabesp,11 3965-9186,Rua José Soriano de Souza-297--Vila Santa Maria,São Paulo,SP,Brasil,CEP: 02555-050
http://www.apontador.com.br/local/sp/sao_paulo/borracha/8M9JZWCC/comercio_de_artefatos_de_cimento_sao_roque_prq_colonial.html,Comercio de Artefatos de Cimento Sao Roque   - Prq Colonial,11 5661-7647,Avenida Manuel Alves Soares-185- Jardim Malia Ii,São Paulo,SP,Brasil,CEP: 04821-270
http://www.apontador.com.br/local/sp/sao_paulo/bancos/C40478820D022D0220/real_pae_peugeot_sao_paulo_santo_amaro.html,Real - Pae Peugeot Sao Paulo - Santo Amaro,,Avenida Miguel Yunes-351- Usina Piratininga,São Paulo,SP,Brasil,CEP: 04444-000
http://www.apontador.com.br/local/sp/sao_paulo/materiais_de_construcao/C401609945332D332F/deposito_sao_joao_ferragens_e_materiais_para_construcao.html,Deposito Sao Joao Ferragens e Materiais Para Construcao,,Avenida Irmã Dulce-218- Jardim Malia Ii,São Paulo,SP,Brasil,CEP: 04821-455
http://www.apontador.com.br/local/sp/sao_paulo/medicina_e_saude_geral_/ZDB62ELQ/cedepp_centro_de_desenvolvimento_pessoal_e_profissional_vl_sao.html,Cedepp-Centro de Desenvolvimento Pessoal e Profissional  - Vl São,11 2061-8691,Rua Padre Serrão-196- Vila São José,São Paulo,SP,Brasil,CEP: 04265-050
http://www.apontador.com.br/local/sp/sao_paulo/servicos_em_informatica/K34RR86V/personall_graphics_servicos_graficos_jd_sao_gilberto.html,Personall Graphics Servicos Graficos  - Jd São Gilberto,11 2124-9118,Avenida José Xavier de Araújo-45- Vila Alba,São Paulo,SP,Brasil,
http://www.apontador.com.br/local/sp/sao_paulo/transporte_geral_/X3457XLC/joao_bosco_de_lira_transportes_jd_sao_gilberto.html,Joao Bosco de Lira Transportes -  - Jd São Gilberto,11 3735-2976,Avenida José Xavier de Araújo-97- Vila Alba,São Paulo,SP,Brasil,
http://www.apontador.com.br/local/sp/sao_paulo/templos/2644897A/igreja_evangelica_holines_central_coreana_de_sao_paulo.html,Igreja Evangélica Holines Central Coreana de São Paulo,11 3251-5304,Rua Paraíso-749--Jardim Vera Cruz,São Paulo,SP,Brasil,CEP: 04103-001
http://www.apontador.com.br/local/sp/sao_paulo/consultoria/EU59CDQP/mario_josef_pericias_judiciais_jd_leonor.html,Mario Josef - Perícias Judiciais - Jd Leonor,11 3742-4839,Rua Doutor José Maria Whitaker-555- Vila Inah,São Paulo,SP,Brasil,CEP: 05622-001
http://www.apontador.com.br/local/sp/sao_paulo/pet_shops/E836VRA8/monicao_e_pat_pet.html,Monicão e Pat Pet,11 5666-9299,Avenida Professor Papini-259--Cidade Dutra,São Paulo,SP,Brasil,CEP: 04805-300
http://www.apontador.com.br/local/sp/sao_paulo/pizzarias/GG2G28UL/pizzaria_leopoldo.html,Pizzaria Leopoldo,11 2280-2466,Avenida Águia de Haia-1285- Jardim Coimbra,São Paulo,SP,Brasil,CEP: 03694-000
http://www.apontador.com.br/local/sp/sao_paulo/moto_boys/C40365421A4E2C4E24/jm_express_entregas_rapidas_para_sao_paulo_interior_e_litoral_.html,Jm Express Entregas Rápidas Para   São Paulo  Interior  e  Litoral.,11 5523-4016,Avenida Feliciano Correia-404- Jardim Satélite,São Paulo,SP,Brasil,CEP: 04815-240
http://www.apontador.com.br/local/sp/sao_paulo/moveis_e_decoracao/G968GRNW/dry_shower_lavagem_a_seco.html,Dry Shower Lavagem A Seco,11 96510-7535,Rua Virgínia Maria da Conceição-290- Parque Esmeralda,São Paulo,SP,Brasil,CEP: 04828-000
http://www.apontador.com.br/local/sp/sao_paulo/policia/4292G68Q/delegacia_64_distrito_cidade_ae_carvalho_jd_sao_nicolau.html,Delegacia - 64º Distrito - Cidade Ae Carvalho - Jd São Nicolau,11 2280-3444,Rua Sonho Gaúcho-638--Jardim São Nicolau,São Paulo,SP,Brasil,CEP: 03685-000
http://www.apontador.com.br/local/sp/sao_paulo/igrejas/C40354520B251T2510/igreja_evangelica_assembleia_de_deus_ministerio_visao_mundial_sede.html,Igreja Evangélica Assembléia de Deus Ministério Visão Mundial - Sede,11 3977-0949,Avenida Tomás Rabelo E Silva-21- Novo Numero 207-Jardim Monte Alegre,São Paulo,SP,Brasil,CEP: 02811-000
http://www.apontador.com.br/local/sp/sao_paulo/enderecos_empresariais/C406488F25640D640A/anki_maria_josefa_langermans.html,ANKI MARIA JOSEFA LANGERMANS,11 5531-7118,Rua Padre José Garzotti-507- SL 7-Cidade Dutra,São Paulo,SP,Brasil,CEP: 04806-000
http://www.apontador.com.br/local/sp/sao_paulo/confeccoes/K27JEA27/irmaos_pretti_magazi.html,Irmaos Pretti Magazi,11 2012-0204,Avenida Mateo Bei-2231- Cidade São Mateus,São Paulo,SP,Brasil,CEP: 03949-012
http://www.apontador.com.br/local/sp/sao_paulo/cosmeticos/C407864A073E1C3E15/pretty_hair_cosmetics.html,Pretty Hair Cosmetics,,Rua Coronel Bento Bicudo-1354- SALA 02-Piqueri,São Paulo,SP,Brasil,CEP: 02912-000
http://www.apontador.com.br/local/sp/sao_paulo/escolas/AD8W98ZH/callia_maestro.html,Callia Maestro,11 5661-2699,Rua Job Vaz do Amaral Jr.-139- Jardim Lallo,São Paulo,SP,Brasil,
http://www.apontador.com.br/local/sp/sao_paulo/desentupidoras/C40500434E500S5004/wa_dedetizadora_e_desentupidora.html,Wa Dedetizadora e Desentupidora,11 5669-2207,Rua Justino Nigro-431--Jardim Régis,São Paulo,SP,Brasil,CEP: 04815-030
http://www.apontador.com.br/local/sp/sao_paulo/escolas/YUV85426/professor_oswaldo_walder.html,Professor Oswaldo Walder,11 3782-4809,Rua Sara Newton-265- Jardim Boa Vista,São Paulo,SP,Brasil,CEP: 05583-030
http://www.apontador.com.br/local/sp/sao_paulo/alimentos_e_bebidas/C4060604565A6Q5A63/banco_bradesco_agencia_supermercado_sonda_mooca_urb_sao_paulo.html,"Banco Bradesco - Agência Supermercado Sonda Mooca, Urb São Paulo",11 2061-4268,Rua João Padilha-127- Jardim Vera Cruz,São Paulo,SP,Brasil,
http://www.apontador.com.br/local/sp/sao_paulo/correios/C402641905552O5527/correios_centros_de_distribuicao_domiciliaria_cdd_grajau.html,Correios - Centros de Distribuição  Domiciliária - Cdd Grajau,11 5972-6139,Rua Hans Christian Andersen-43- Jardim São Rafael,São Paulo,SP,Brasil,CEP: 04860-110
