URL,Title,Address,Classes,Camps,Schools,Childcare,Places,Birthdays,Class Schedule link,Camp Schedule Link,Hours,Registration,Age Range,Cost,Phone,Website,Mail ID,Facebook Link,Description,Love Rating,Image URL
http://hulafrog.com/chandler-az/chandler-center-for-the-arts-chandler-e6/,Chandler Center For The Arts,"250 N. Arizona AvenueChandler, AZ 85225","Acting, Arts, Dance, Music","Dance, Music, Performing",,,Theaters,,http://chandlercenter.org/connecting/camp/workshop.html,http://chandlercenter.org/connecting/camp-kidz-main.html,"MON-FRI: 10:00 AM-5:00 PM, SAT: 12:00 PM-5:00 PM",,,,(480) 782-2674,http://chandlercenter.org,judi.johnson@chandleraz.gov,,Research shows that the benefit of arts experiences has a tremendous impact on the developmental growth of young people. Youth exposed to the arts are more successful in the classroom and have increased developmental life skills. The Chandler Center for the Arts provides youth with an array of programmatic opportunities for them to experience the magic of the arts through the Connecting Kidz programs.,2,http://hulafrog.com/hulastock/subcat/Default-Image-Recreation-Centers.jpg
http://hulafrog.com/chandler-az/chandler-gilbert-family-ymca--29/,Chandler/Gilbert Family YMCA,"1655 West Frye Road, AZ 85224","Acting, Arts, Cooking, Dance, Gymnastics, Learning, Languages, Martial, Nature, Music, Sports, Swim, Other","Academic, All, Arts, Cooking, Dance, Music, Sports, Swim",,,"Indoor, Other",Party Places,http://www.valleyymca.org/selectionETLAH.cfm,http://www.valleyymca.org/selectionCamp.cfm,Mon. - Sun.: 12:00 AM - 12:00 AM,,,,480-899-9622,http://www.valleyymca.org/chandlergilbert,rtrulove@vosymca.org,https://www.facebook.com/ChandlerGilbertYMCA,"1655 West Frye Road,Chandler, AZ 85224Phone: (480) 899-9622  Jessie Sands, Executive Director Hours:Mon-Thu 5:00AM to 10:00PM Friday 5:-00AM to 9:30PM Saturday 7:00AM to 6:00PM Sunday 11:00AM to 4:00PM",2,http://hulafrog.com/hulastock/subcat/Default-Image-Places-Other.jpg
http://hulafrog.com/chandler-az/classic-image-dance-chandler-54/,Classic Image Dance,"335 N. Austin DriveChandler, AZ 85226",Dance,Dance,,,,Party Places,http://classicimagedance.com/our-classes/,,Monday: 4:30 PM - 9:30 PM;Tuesday: 4:30 AM - 9:30 PM;Wednesday: 4:30 PM - 9:30 PM;Thursday: 4:30 PM - 9:30 PM;Friday: 4:30 PM - 7:00 PM;Saturday: 9:30 AM - 11:30 AM;Sunday: 12:00 AM - 12:00 AM,,,,480-839-4159,http://www.classicimagedance.com,info@classicimagedance.com,https://www.facebook.com/pages/Classic-Image-Dance/144125802336776,"We provide quality and professional dance instruction to all types of dancers in a positive and friendly atmosphere. Whether our dancers are training to be professionals or just dancing for their personal enjoyment, the benefits they will receive are endless.",2,http://hulafrog.com/hulastock/subcat/Default-Image-Places-Other.jpg
http://hulafrog.com/chandler-az/copperstar-repertory-co--chandler-a1/,Copperstar Repertory Co.,"3002 N Arizona AvenueChandler, AZ 85225","Acting, Dance, Music","Dance, Performing",,,Theaters,,http://www.copperstarrep.org/pdfs/2013_studio_schedule.pdf,http://copperstarrep.org/education/camps.shtml,,,,,480-699-1655,http://www.copperstarrep.org,mjokawa@yahoo.com,https://www.facebook.com/CopperstarRep,"Copperstar Repertory Co. is a nonprofit arts organization whose mission is to entertain, educate and enrich community members of all ages by offering high quality productions, providing professional instruction in performing arts, and creating performance opportunities for Arizona?s youth and adults.",2,http://hulafrog.com/hulastock/subcat/Default-Image-Places-Theaters-and-Concert-Halls.jpg
http://hulafrog.com/chandler-az/desert-star-dance-gilbert-b9/,Desert Star Dance,"1430 W. Warner Rd. Suite 116.Gilbert, AZ 85295",Dance,Dance,,,,,,,,,,,(480) 813-7827,http://www.desertstardance.com,Desertstardance@cox.net,,"Desert Star Dance has been operating since 2003 in Gilbert AZ. Our goal is to create a balance of fun and discipline while learning the art of dance. 

You will feel welcome from the moment you walk in. Your child will learn from our staff of knowledgable and well trained professionals. They are dedicated to helping children learn through dance. 

Dance is for everyone! It improves coordination and flexibility, teaches a child to follow directions, work within a group, and enhances social skills. Most of all, it's fun!",2,http://hulafrog.com/hulastock/subcat/Default-Image-Camps-Dance.jpg
http://hulafrog.com/chandler-az/expressions-dance-studio-gilbert-04/,Expressions Dance Studio,"4844 South Val Vista DriveGilbert, AZ 85298",Dance,Dance,,,,,,,,,,,480-299-7378,http://www.expressionsdancestudio.blogspot.com/,ExpressionsDanceAZ@gmail.com,,"Expressions Dance Studio is a place where students of all ages can come and learn the fundamentals of many forms of dance in an encouraging environment regardless of past dance experience. We welcome beginning to advanced dance students! Expressions Dance Studio is also a place where parents can be assured we will maintain high standards when it comes to costuming and movements. We believe little girls should dress and move like little girls! The same goes for little boys! Every child enrolled will learn fundamentals of ballet technique, as well as tap, jazz, hip hop, tumbling, pom (cheer), and creative dance. The good news is that you won't have to enroll in several classes, just enroll in your grade level and you will pay one low price for all styles! We are conveniently located at the Totspot Preschool in the Vista Del Oro shopping center at Val Vista and Queen Creek Road. ",2,http://hulafrog.com/hulastock/subcat/Default-Image-Camps-Dance.jpg
http://hulafrog.com/chandler-az/heat-wave-dance-academy--77/,Heat Wave Dance Academy,,Dance,Dance,,,,,,,,,,,(480) 855-4328,http://heatwavedanceacademy.com/news.htm,info@heatwavedanceacademy.com,,Heat Wave dance studio was created by two moms who wanted to provide quality perfoming arts training while instilling confidence in children.,2,http://hulafrog.com/hulastock/subcat/Default-Image-Camps-Dance.jpg
http://hulafrog.com/chandler-az/jeanne-s-school-of-dance-chandler-chandler-88/,Jeanne's School of Dance Chandler,"610 N. Alma School RoadChandler, AZ 85224","Acting, Dance, Gymnastics","Dance, Gymnastics, Performing",,,,Party Places,,,,,,,480-963-6674,http://www.jeannesdancechandler.com,studio@jeannesdancechandler.com,https://www.facebook.com/pages/Jeannes-School-of-Dance-Chandler/400782036703966,"At Jeanne's School of Dance - Chandler, you're part of our family.  We get to know all our dancers and studio families so when you're here . . . you're home!  We look at each dancer as one of our own.  We will work with them and be their biggest cheerleader as they aim to achieve their dreams!  Our teachers are not only highly trained in their own styles of dance and theater, they are also masters at building confidence in our students and giving them the mental and emotional tools they need to conquer anything they want!",2,http://hulafrogportal.com/sugar/dev/uploads/thumbnail_14117746671313094377.png
http://hulafrog.com/chandler-az/ocotillo-dance-center-chandler-52/,Ocotillo Dance Center,"2625 West Queen Creek RoadChandler, AZ 85248",Dance,Dance,,,,,http://www.ocotillodancecenter.com/schedule.pdf,,,,,,(480) 899-8400,http://www.ocotillodancecenter.com/,allison@ocotillodancecenter.com,,"We know there are many options for you when it comes to deciding what dance studio to attend, either for you or your child. Many studios offer flashy d?cor, over the top competitive options and very expensive pricing.

At Ocotillo Dance Center, we do things a little differently?

        In 2009, we opened our doors as ?Studios of Ocotillo.? Two years later we have a new name, but the same philosophy. Ocotillo Dance Center was created with the family in mind. It?s a place where students come to learn the ART and the JOY of dance. It gives students a chance to learn in an environment that fosters great technique and passion that you won?t find anywhere else.  Ocotillo Dance Center strives to find new, fun, innovative and exciting ways to bring dance to the Chandler and Phoenix communities. If you?ve been looking for a studio that fosters creativity, passion and something a little different, we hope you?ll take a minute to check out our beautiful spaces in the Downtown Ocotillo Center, and maybe try a class or two! Remember, the first one is always on us.",2,http://hulafrog.com/hulastock/subcat/Default-Image-Camps-Dance.jpg
http://hulafrog.com/chandler-az/paragon-dance-center-tempe-1c/,Paragon Dance Center,"931 E Elliot RdTempe, AZ 85284",Dance,Dance,,,,,,,,,,,480-777-8877,http://www.paragondance.net/,Mike@ParagonDance.Net,,"Nurturing learning environment 

Talented & well-trained staff 

Small class sizes 

The program is designed for students ages 4 - 18, and will include Ballet, Jazz, Tap, Modern, Lyrical and Hip Hop. Registration forms are available to the left. Please call for more information. 





",2,http://hulafrog.com/hulastock/subcat/Default-Image-Camps-Dance.jpg
http://hulafrog.com/chandler-az/sas-dance-gilbert-56/,SAS Dance,"854 E Williams Field RoadGilbert, AZ 85295",Dance,Dance,,,,,,,,,,,480-782-8333,http://www.sasdance.com/,sasdance@gmail.com,,,2,http://hulafrog.com/hulastock/subcat/Default-Image-Camps-Dance.jpg
http://hulafrog.com/chandler-az/studio-3-perfoming-arts-gilbert-b8/,Studio 3 Perfoming Arts,"511 W Guadalupe RoadGilbert, AZ 85233","Acting, Dance, Gymnastics, Music, Other","Dance, Gymnastics, Music, Performing, Other",,,,,http://www.studio3arts.com/academy/classes/,http://www.studio3arts.com/breakout-the-intensive-spring-break-2012/,,,,,(480) 545-1492,http://www.studio3arts.com/,info@studio3arts.com,,"At Studio 3 Performing Arts, we are dedicated to providing a well-rounded education through diverse course offerings, quality programs, and a true sense of community.
Above all, Studio 3 is a place for families. We encourage programs and schedules that allow siblings to take classes at the same time, create bonding experiences for our students, and encourage parents to get involved, giving everyone a strong sense of community. Together, we are the Studio 3 Family!


",2,http://hulafrog.com/hulastock/subcat/Default-Image-Camps-Dance.jpg
http://hulafrog.com/chandler-az/the-dance-loft-chandler-e3/,The Dance Loft,"2410 S Gilbert RdChandler, AZ 85286",Dance,Dance,,,,,http://thedanceloftaz.com/index.php?id=16324,,See website!!!,,,,(480) 963-9911,http://thedanceloftaz.com/,TheDanceLoft@cox.net,,"The Dance Loft is dedicated to providing dance instruction in a positive learning environment that will encourage creativity and self -esteem. The studio and staff are devoted to inspire, encourage, and support every student as they learn about dance. Our vision at The Dance Loft is for every dancer to appreciate and be as passionate, as we are, about DANCE!",2,http://hulafrog.com/hulastock/subcat/Default-Image-Camps-Dance.jpg
http://hulafrog.com/chandler-az/wagner-dance-studio-gilbert-0b/,Wagner Dance Studio,"645 North Gilbert RoadGilbert, AZ 85234",Dance,Dance,,,,,http://www.wagnerdancearts.com/classes/classes.htm,,"MON-THURS: 3:30 PM-7:00 PM, SAT: 8:30 AM-1:00 PM",,,,(480) 892-7179,http://www.wagnerdancearts.com/index.html,info@wagnerdancearts.com,,"Wagner Dance and Music has been teaching in the Gilbert area since 1989 and we are constantly improving our classes, instructors and facilities to ensure that we are always providing our students and parents with the best experience possible.",2,http://hulafrog.com/hulastock/subcat/Default-Image-Camps-Dance.jpg
http://hulafrog.com/chandler-az/gold-medal-gymnastics-chandler-37/,Gold Medal Gymnastics,"455 E. Warner RoadChandler, AZ 85225","Dance, Gymnastics","Dance, Gymnastics",,,,Party Places,http://www.goldmedalgym.com/chandler,http://www.goldmedalgym.com/chandler/camps,,,,,(480) 857-7335,http://www.goldmedalgym.com/chandler,Chandler@goldmedalgym.com,https://www.facebook.com/GoldMedalGymnastics,"Gold Medal Gymnastics provides children of all ages and abilities a safe and healthy work-out environment. From tots to team, Gold Medal Gymnastics offers flexible class schedules all in the comforts of state-of-the-art facilities.",1,http://hulafrog.com/hulastock/subcat/Default-Image-Places-Other.jpg
http://hulafrog.com/chandler-az/ldvinci-art-studio-chandler-65/,LDVinci Art Studio,"3355 West Chandler BoulevardChandler, AZ 85226","Arts, Dance, Music","Arts, Dance, Music",,,Drop,Party Places,http://ldvinci.net/about.php,,"MON-FRI: 9:15 AM-8:00 PM, SAT 9:15 AM-5:00 PM",,,,(480) 726-7382,http://www.ldvinci.net/index.php,info@ldvinci.com,,"Our creative space is an original art studio offering painting, dance and music lessons for kids and adults in one inspiring location. The mission of our studio is to provide students with a high quality painting, dance and music education. LDVinci's open studio craft time is a unique opportunity for parents to participate with their child in an artistic environment.",1,http://hulafrog.com/hulastock/subcat/Default-Image-Places-Other.jpg
http://hulafrog.com/chandler-az/usa-youth-fitness-center-gilbert-d1/,USA Youth Fitness Center,"1530 South Gilbert RoadGilbert, AZ 85296","Dance, Gymnastics, Other","Dance, Gymnastics, Other",,,,,http://www.usagymaz.com/j16/classes-offered,http://www.usagymaz.com/j16/camps,,,,,(480) 926-1480,http://www.usagymaz.com/j16/,kelly@usagymaz.com,,"Through the skills taught in our facility, children will develop a positive self-image through guidance and motivation from our coaches. We are committed to providing a fun and rewarding atmosphere at all times. The skills we teach are used to build healthy minds and bodies. Our objective is not limited to just teaching gymnastics, dance, tumbling and cheer skills, but to pass along life skills such as coordination, teamwork, leadership, strength, and determination.",1,http://hulafrog.com/hulastock/subcat/Default-Image-Camps-Dance.jpg
http://hulafrog.com/chandler-az/creativity-and-movement-mesa-8ff/,Creativity and Movement,"5050 East University DriveMesa, AZ 85204","Arts, Dance, Sports","Arts, Dance, Performing, Sports",,,,Home,,,"M-F 9:00 AM - 8:00 PM, Sat-Sun: 9:00 AM - 8:00 PM",,,,480-703-4872,http://www.creativityandmovement.com,wellofcreations@gmail.com,,"Without exception, Creativity and Movement offers fun programs that can be tweaked to meet the needs of your school or organization.  We offer art program, kids yoga, drum and music circles and hula hooping classes SPECIFICALLY GEARED to your age groups.  We specialize in working with groups ages 4-10.   Ideally we structure our programs for groups of 4-15 children to give each child a more intimate experience.  We bring all equipment and supplies to you.  Experience the difference that having a joy filled and creatively passionate teacher makes in igniting the hearts of your children",0,http://hulafrogportal.com/sugar/dev/uploads/thumbnail_1426168109564718813.jpg
http://hulafrog.com/chandler-az/ultimate-play-date-scottsdale-c1/,Ultimate Play Date,Outside on the Mall at Scottsdale'  s Civic Center LibraryScottsdale 85255,,,,,,,,,,No,"Babies, Preschoolers, Elementary",,480.312.7050,http://www.scottsdalelibrary.org/ultimateplaydate,,, We will be at this years ULTIMATE PLAY DATE! Come and play some FREE Sportball games with us. ,4,http://hulafrogportal.com/sugar/dev/uploads/thumbnail_1428008011765967922.png
http://hulafrog.com/chandler-az/connect5family-center-of-chandler--c7/,Connect5Family Center of Chandler,"222 East Warner Road, AZ 85255","Arts, Dance, Learning, Music, Sports, Other","All, Arts, Dance, Music, Sports, Other",,,,Party Places,,,Mon. - Sat.: 9:00 AM - 7:00 PM;Sunday: 12:00 PM - 5:00 PM,,,,480-699-2122,http://www.Connect5FC.com,chandler@connect5fc.com,https://www.facebook.com/Connect5FamilyCentersOfChandler,"Welcome to the neighborhood!  Actually, there're five neighborhoods for you to explore.  Develop the mind and body by stepping through the gates and onto the mats as you begin your journey in Villari's Martial Arts.  Children can run jump, play and learn in Discovery Park.  Families can enjoy a delicious meal in Kicks Cafe.  Register for a Mind and Motion workshop and explore music, dance, fitness, stress management, arts and crafts, and more.  Plan a Spotlight Celebrations for your special event, or celebrate with friends by choosing one of our Adventure Birthday Packages.

We serve as a true center; a hub that brings together family, friends, students, educators, and community.  It's all about connection.  It's about families learning and playing together and friends celebrating each other's special moments.  It's about reinforcing educator's efforts to provide 21st century learning opportunities for students by providing tools and programs that help them succeed at home and in school. You'll also see us out in the community supporting local events, groups, and   charities.     
",9,http://hulafrog.com/hulastock/subcat/Default-Image-Places-Other.jpg
http://hulafrog.com/chandler-az/let-s-play-music-with-kendra-flake-mesa-apache-junction-ca/,Let's Play Music with Kendra Flake,"10649 E. Bramble Ave.Mesa, Apache Junction, AZ 85208",Music,,,,,,,,"Classes are scheduled at various times Monday - Friday, 9:00 - 6:00. Please see my schedules page.",,,,480-577-7104,http://www.letsplaymusicsite.com,misskendrasmusic@gmail.com,,"Group music lessons for children that emphasize total musicianship through piano playing, singing, classical music, note reading, and ear training. The Mom and Me classes provide excellent music training designed for 2-4 year-olds and their parents. The school-age curriculum is a 3-year program designed for children entering the program at age 4-5. By the time your child graduates from the program at age 7-8, they will have many skills to help them soar in any music lessons of choice. They will be playing the piano with two hands, singing in harmony, and will have the skills to write her/his own music!",2,http://hulafrog.com/hulastock/subcat/Default-Image-Classes-Music.jpg
http://hulafrog.com/chandler-az/jeanne-s-school-of-dance-chandler-chandler-88/,Jeanne's School of Dance Chandler,"610 N. Alma School RoadChandler, AZ 85224","Acting, Dance, Gymnastics","Dance, Gymnastics, Performing",,,,Party Places,,,,,,,480-963-6674,http://www.jeannesdancechandler.com,studio@jeannesdancechandler.com,https://www.facebook.com/pages/Jeannes-School-of-Dance-Chandler/400782036703966,"At Jeanne's School of Dance - Chandler, you're part of our family.  We get to know all our dancers and studio families so when you're here . . . you're home!  We look at each dancer as one of our own.  We will work with them and be their biggest cheerleader as they aim to achieve their dreams!  Our teachers are not only highly trained in their own styles of dance and theater, they are also masters at building confidence in our students and giving them the mental and emotional tools they need to conquer anything they want!",2,http://hulafrogportal.com/sugar/dev/uploads/thumbnail_14117746671313094377.png
http://hulafrog.com/chandler-az/studio-3-perfoming-arts-gilbert-b8/,Studio 3 Perfoming Arts,"511 W Guadalupe RoadGilbert, AZ 85233","Acting, Dance, Gymnastics, Music, Other","Dance, Gymnastics, Music, Performing, Other",,,,,http://www.studio3arts.com/academy/classes/,http://www.studio3arts.com/breakout-the-intensive-spring-break-2012/,,,,,(480) 545-1492,http://www.studio3arts.com/,info@studio3arts.com,,"At Studio 3 Performing Arts, we are dedicated to providing a well-rounded education through diverse course offerings, quality programs, and a true sense of community.
Above all, Studio 3 is a place for families. We encourage programs and schedules that allow siblings to take classes at the same time, create bonding experiences for our students, and encourage parents to get involved, giving everyone a strong sense of community. Together, we are the Studio 3 Family!


",2,http://hulafrog.com/hulastock/subcat/Default-Image-Camps-Dance.jpg
http://hulafrog.com/chandler-az/gold-medal-gymnastics-chandler-37/,Gold Medal Gymnastics,"455 E. Warner RoadChandler, AZ 85225","Dance, Gymnastics","Dance, Gymnastics",,,,Party Places,http://www.goldmedalgym.com/chandler,http://www.goldmedalgym.com/chandler/camps,,,,,(480) 857-7335,http://www.goldmedalgym.com/chandler,Chandler@goldmedalgym.com,https://www.facebook.com/GoldMedalGymnastics,"Gold Medal Gymnastics provides children of all ages and abilities a safe and healthy work-out environment. From tots to team, Gold Medal Gymnastics offers flexible class schedules all in the comforts of state-of-the-art facilities.",1,http://hulafrog.com/hulastock/subcat/Default-Image-Places-Other.jpg
http://hulafrog.com/chandler-az/usa-youth-fitness-center-gilbert-d1/,USA Youth Fitness Center,"1530 South Gilbert RoadGilbert, AZ 85296","Dance, Gymnastics, Other","Dance, Gymnastics, Other",,,,,http://www.usagymaz.com/j16/classes-offered,http://www.usagymaz.com/j16/camps,,,,,(480) 926-1480,http://www.usagymaz.com/j16/,kelly@usagymaz.com,,"Through the skills taught in our facility, children will develop a positive self-image through guidance and motivation from our coaches. We are committed to providing a fun and rewarding atmosphere at all times. The skills we teach are used to build healthy minds and bodies. Our objective is not limited to just teaching gymnastics, dance, tumbling and cheer skills, but to pass along life skills such as coordination, teamwork, leadership, strength, and determination.",1,http://hulafrog.com/hulastock/subcat/Default-Image-Camps-Dance.jpg
http://hulafrog.com/chandler-az/arizona-dynamics-chandler-8f/,Arizona Dynamics,"2450 E Germann RoadChandler, AZ 85286","Gymnastics, Sports",Gymnastics,,,,,https://www.iclassprov2.com/icpv2/pp/azdynamics/CLASSES,http://www.azdynamics.com/camp.htm,,,,,(480) 633-8414,http://www.azdynamics.com/index.htm,jess@azdynamics.com,,"Arizona Dynamics Gymnastics & Cheer Center was created with the idea that all children should have the opportunity to participate in a program that teaches a wide variety of physical skills, but also a program that teaches life skills as well.",0,http://hulafrog.com/hulastock/subcat/Default-Image-Camps-Gymnastics.jpg
http://hulafrog.com/chandler-az/arizona-olympian-gymnastics-chandler-fe/,Arizona Olympian Gymnastics,"22608 S. Gilbert RoadChandler, AZ 85248",Gymnastics,Gymnastics,,,,,http://www.azolympiangymnastics.com/programs.htm,,,,,,(480) 802-8559,http://www.azolympiangymnastics.com/,Azogymnastics@aol.com,,"The staff at Arizona Olympian Gymnastics believe that a quality sports program can enrich a child's life, and plays a tremendous part in promoting a healthy, active adulthood. Our mission is to provide a quality gymnastics experience through positive motivation and re-enforcement in a safe, friendly environment.",0,http://hulafrog.com/hulastock/subcat/Default-Image-Camps-Gymnastics.jpg
http://hulafrog.com/chandler-az/gold-medal-gymnastics-chandler-dd/,Gold Medal Gymnastics,"455 E. Warner Rd. Ste. BChandler, AZ 85255",Gymnastics,Gymnastics,,,,,,,,,,,480-857-7335,http://www.goldmedalgym.com,chandler@goldmedalgym.com,,"Gold Medal Gymnastics was founded by 1996 Olympic Gold Medalist, Amanda Borden-Cochran.  At Gold Medal Gymnastics, we pride ourselves on providing quality gymnastics instruction to kids of all ages and abilities. Our mission is to provide a safe, positive place where young gymnasts are encouraged to pursue goals, be self motivated, and develop communication skills while building memories, relationships, and self confidence.",0,http://hulafrog.com/hulastock/subcat/Default-Image-Camps-Gymnastics.jpg
http://hulafrog.com/chandler-az/ultimate-play-date-scottsdale-c1/,Ultimate Play Date,Outside on the Mall at Scottsdale'  s Civic Center LibraryScottsdale 85255,,,,,,,,,,No,"Babies, Preschoolers, Elementary",,480.312.7050,http://www.scottsdalelibrary.org/ultimateplaydate,,, We will be at this years ULTIMATE PLAY DATE! Come and play some FREE Sportball games with us. ,4,http://hulafrogportal.com/sugar/dev/uploads/thumbnail_1428008011765967922.png
http://hulafrog.com/chandler-az/connect5family-center-of-chandler--c7/,Connect5Family Center of Chandler,"222 East Warner Road, AZ 85255","Arts, Dance, Learning, Music, Sports, Other","All, Arts, Dance, Music, Sports, Other",,,,Party Places,,,Mon. - Sat.: 9:00 AM - 7:00 PM;Sunday: 12:00 PM - 5:00 PM,,,,480-699-2122,http://www.Connect5FC.com,chandler@connect5fc.com,https://www.facebook.com/Connect5FamilyCentersOfChandler,"Welcome to the neighborhood!  Actually, there're five neighborhoods for you to explore.  Develop the mind and body by stepping through the gates and onto the mats as you begin your journey in Villari's Martial Arts.  Children can run jump, play and learn in Discovery Park.  Families can enjoy a delicious meal in Kicks Cafe.  Register for a Mind and Motion workshop and explore music, dance, fitness, stress management, arts and crafts, and more.  Plan a Spotlight Celebrations for your special event, or celebrate with friends by choosing one of our Adventure Birthday Packages.

We serve as a true center; a hub that brings together family, friends, students, educators, and community.  It's all about connection.  It's about families learning and playing together and friends celebrating each other's special moments.  It's about reinforcing educator's efforts to provide 21st century learning opportunities for students by providing tools and programs that help them succeed at home and in school. You'll also see us out in the community supporting local events, groups, and   charities.     
",9,http://hulafrog.com/hulastock/subcat/Default-Image-Places-Other.jpg
