URL,Title,Address,Classes,Camps,Schools,Childcare,Places,Birthdays,Class Schedule link,Camp Schedule Link,Hours,Registration,Age Range,Cost,Phone,Website,Mail ID,Facebook Link,Description,Love Rating,Image URL
http://hulafrog.com/chandler-az/connect5family-center-of-chandler--c7/,Connect5Family Center of Chandler,"222 East Warner Road, AZ 85255","Arts, Dance, Learning, Music, Sports, Other","All, Arts, Dance, Music, Sports, Other",,,,Party Places,,,Mon. - Sat.: 9:00 AM - 7:00 PM;Sunday: 12:00 PM - 5:00 PM,,,,480-699-2122,http://www.Connect5FC.com,chandler@connect5fc.com,https://www.facebook.com/Connect5FamilyCentersOfChandler,"Welcome to the neighborhood!  Actually, there're five neighborhoods for you to explore.  Develop the mind and body by stepping through the gates and onto the mats as you begin your journey in Villari's Martial Arts.  Children can run jump, play and learn in Discovery Park.  Families can enjoy a delicious meal in Kicks Cafe.  Register for a Mind and Motion workshop and explore music, dance, fitness, stress management, arts and crafts, and more.  Plan a Spotlight Celebrations for your special event, or celebrate with friends by choosing one of our Adventure Birthday Packages.

We serve as a true center; a hub that brings together family, friends, students, educators, and community.  It's all about connection.  It's about families learning and playing together and friends celebrating each other's special moments.  It's about reinforcing educator's efforts to provide 21st century learning opportunities for students by providing tools and programs that help them succeed at home and in school. You'll also see us out in the community supporting local events, groups, and   charities.     
",9,http://hulafrog.com/hulastock/subcat/Default-Image-Places-Other.jpg
http://hulafrog.com/chandler-az/let-s-play-music-with-kendra-flake-mesa-apache-junction-ca/,Let's Play Music with Kendra Flake,"10649 E. Bramble Ave.Mesa, Apache Junction, AZ 85208",Music,,,,,,,,"Classes are scheduled at various times Monday - Friday, 9:00 - 6:00. Please see my schedules page.",,,,480-577-7104,http://www.letsplaymusicsite.com,misskendrasmusic@gmail.com,,"Group music lessons for children that emphasize total musicianship through piano playing, singing, classical music, note reading, and ear training. The Mom and Me classes provide excellent music training designed for 2-4 year-olds and their parents. The school-age curriculum is a 3-year program designed for children entering the program at age 4-5. By the time your child graduates from the program at age 7-8, they will have many skills to help them soar in any music lessons of choice. They will be playing the piano with two hands, singing in harmony, and will have the skills to write her/his own music!",2,http://hulafrog.com/hulastock/subcat/Default-Image-Classes-Music.jpg
http://hulafrog.com/chandler-az/connect5family-center-of-chandler--c7/,Connect5Family Center of Chandler,"222 East Warner Road, AZ 85255","Arts, Dance, Learning, Music, Sports, Other","All, Arts, Dance, Music, Sports, Other",,,,Party Places,,,Mon. - Sat.: 9:00 AM - 7:00 PM;Sunday: 12:00 PM - 5:00 PM,,,,480-699-2122,http://www.Connect5FC.com,chandler@connect5fc.com,https://www.facebook.com/Connect5FamilyCentersOfChandler,"Welcome to the neighborhood!  Actually, there're five neighborhoods for you to explore.  Develop the mind and body by stepping through the gates and onto the mats as you begin your journey in Villari's Martial Arts.  Children can run jump, play and learn in Discovery Park.  Families can enjoy a delicious meal in Kicks Cafe.  Register for a Mind and Motion workshop and explore music, dance, fitness, stress management, arts and crafts, and more.  Plan a Spotlight Celebrations for your special event, or celebrate with friends by choosing one of our Adventure Birthday Packages.

We serve as a true center; a hub that brings together family, friends, students, educators, and community.  It's all about connection.  It's about families learning and playing together and friends celebrating each other's special moments.  It's about reinforcing educator's efforts to provide 21st century learning opportunities for students by providing tools and programs that help them succeed at home and in school. You'll also see us out in the community supporting local events, groups, and   charities.     
",9,http://hulafrog.com/hulastock/subcat/Default-Image-Places-Other.jpg
http://hulafrog.com/chandler-az/the-learning-place-preschool-queen-creek-372/,The Learning Place Preschool,"22721 S. Ellsworth RdQueen Creek, AZ 85142",Learning,"Academic, All, Arts",Preschools,O T H E R,,,,,M-F 8:00 AM - 3:30 PM,,,,480-332-6541,http://www.TheLearningPlacePreschool.net,Sarah@TheLearningPlacePreschool.net,https://www.facebook.com/TheLearningPlacePreschoolQC,"The Learning Place Preschool offers classes in the morning and afternoon 2, 3 or 5 days a week for kids from 2-5 years of age.  With an excellent curriculum, professional staff, and extraordinary facilities we know you will love The Learning Place Preschool.  We use The Creative Curriculum for Preschool and ZooPhonics to give your child a rich, developmentally appropriate program to give your child a love of learning and prepare them for success in kindergarten and beyond.",3,http://hulafrogportal.com/sugar/dev/uploads/thumbnail_14152381511126353176.jpg
http://hulafrog.com/chandler-az/chandler-gilbert-family-ymca--29/,Chandler/Gilbert Family YMCA,"1655 West Frye Road, AZ 85224","Acting, Arts, Cooking, Dance, Gymnastics, Learning, Languages, Martial, Nature, Music, Sports, Swim, Other","Academic, All, Arts, Cooking, Dance, Music, Sports, Swim",,,"Indoor, Other",Party Places,http://www.valleyymca.org/selectionETLAH.cfm,http://www.valleyymca.org/selectionCamp.cfm,Mon. - Sun.: 12:00 AM - 12:00 AM,,,,480-899-9622,http://www.valleyymca.org/chandlergilbert,rtrulove@vosymca.org,https://www.facebook.com/ChandlerGilbertYMCA,"1655 West Frye Road,Chandler, AZ 85224Phone: (480) 899-9622  Jessie Sands, Executive Director Hours:Mon-Thu 5:00AM to 10:00PM Friday 5:-00AM to 9:30PM Saturday 7:00AM to 6:00PM Sunday 11:00AM to 4:00PM",2,http://hulafrog.com/hulastock/subcat/Default-Image-Places-Other.jpg
http://hulafrog.com/chandler-az/gymboree-play-music-chandler-5c/,Gymboree Play & Music,"2160 W. Chandler BlvdChandler, AZ 85224","Arts, Learning, Music","Arts, Music, Sports",,,Indoor,Party Places,,,"MON-FRI:6:00AM-9:00PM,SAT:7:00AM-3:00PM,SUN:8:00AM-4:00PM",,,,480-963-1756,http://www.gymboreeclasses.com/index.jsp,regina_mirizio@gymboree.com,,"Gymboree Play & Music has been fostering creativity and confidence in children ages 0-5 for over 30 years. Today there are over 550 locations in 30 countries, making us the global leader in early childhood development programs. Designed by experts, our age-appropriate activities help develop the cognitive, physical and social skills of children as they play. Our programs are also recognized for their unique approach to parent involvement?which encourages participation in and understanding of each child?s development.



",1,http://hulafrog.com/hulastock/subcat/Default-Image-Places-Other.jpg
http://hulafrog.com/chandler-az/ldvinci-art-studio-chandler-65/,LDVinci Art Studio,"3355 West Chandler BoulevardChandler, AZ 85226","Arts, Dance, Music","Arts, Dance, Music",,,Drop,Party Places,http://ldvinci.net/about.php,,"MON-FRI: 9:15 AM-8:00 PM, SAT 9:15 AM-5:00 PM",,,,(480) 726-7382,http://www.ldvinci.net/index.php,info@ldvinci.com,,"Our creative space is an original art studio offering painting, dance and music lessons for kids and adults in one inspiring location. The mission of our studio is to provide students with a high quality painting, dance and music education. LDVinci's open studio craft time is a unique opportunity for parents to participate with their child in an artistic environment.",1,http://hulafrog.com/hulastock/subcat/Default-Image-Places-Other.jpg
http://hulafrog.com/chandler-az/arizona-taekwondo-chandler-fd/,Arizona Taekwondo,"2100 S. Gilbert Rd. #17Chandler, AZ 85286",Martial,"Academic, All, Arts, Martial",,,,,,,,,,,(480) 442-3150,http://,Aztkd.chandler@gmail.com,,"Arizona Taekwondo offers 2014 summer camps that provide children with good quality of arts & crafts, basic Taekwondo & stretching skills, literacy lessons, and leveled math lessons. In addition, a variety of physical activities such as jump-roping and hula-hooping will be provided.  Instead of video games, we will focus on enhancing students' social and physical skills. ",0,http://hulafrog.com/hulastock/subcat/Default-Image-Camps-Academic.jpg
http://hulafrog.com/chandler-az/as-you-wish-pottery-chandler-chandler-62/,As You Wish Pottery- Chandler,"2970 E Germann Rd #4Chandler, AZ 85286",Arts,Arts,,,,,,,"MON-THU 10:00 AM-9:00 PM,FRI-SAT: 10:00 AM-10:00 PM, SUN:11:00 AM-6:00 PM",,,,480-899-1231,http://www.asyouwishpottery.com/,susie@asyouwishpottery.com,,"As You Wish As You Wish is a great place to flex your creative muscle and have some fun.  We provide paints, brushes, expert assistance and anything else you need to let your inner artist out!  You can stop in anytime!  We also happily accept reservations.  Just contact your local studio.  Reservations are suggested on weekends, holidays, and days when school is out.",0,http://hulafrog.com/hulastock/subcat/Default-Image-Camps-Arts-and-Crafts.jpg
http://hulafrog.com/chandler-az/bricks-4-kidz--a7/,Bricks 4 Kidz,,Arts,Arts,,,Other,,,,,,,,(480) 717-7573,http://www.bricks4kidz.com/arizona-phoenix-eastvalley/,kkretsch@bricks4kidz.com,,,0,http://hulafrog.com/hulastock/subcat/Default-Image-Places-Other.jpg
http://hulafrog.com/chandler-az/club-cusd--fb/,Club CUSD,,"Arts, Other","All, Arts, Other",,,,,,,,,,,(480) 224-3900,http://www.mychandlerschools.org/page/1033,enrichment-program@chandler.k12.az.us,,"Community Education is harnessing the talents of CUSD staff and outside vendors in a joint effort to offer the community discovery opportunities ranging in topics from Health and Wellness to Arts and Crafts...and everything in between! Classes will take place after school hours, as well as during intersessions and summer breaks.",0,http://hulafrog.com/hulastock/subcat/Default-Image-Camps-All-Around.jpg
http://hulafrog.com/chandler-az/community-education-cusd-chandler-63/,Community Education CUSD,"1525 West Frye RoadChandler, AZ 85224","Arts, Other","All, Arts, Other",,,,,,,MON-FRI: 8:00 AM-5:00 PM,,,,480-224-3900,http://www.mychandlerschools.org/page/1033,community-education@chandler.k12.az.us,,"Community Education is harnessing the talents of CUSD staff and outside vendors in a joint effort to offer the community discovery opportunities ranging in topics from Health and Wellness to Arts and Crafts...and everything in between! Classes will take place after school hours, as well as during intersessions and summer breaks.",0,http://hulafrog.com/hulastock/subcat/Default-Image-Camps-All-Around.jpg
http://hulafrog.com/chandler-az/creativity-and-movement-mesa-8ff/,Creativity and Movement,"5050 East University DriveMesa, AZ 85204","Arts, Dance, Sports","Arts, Dance, Performing, Sports",,,,Home,,,"M-F 9:00 AM - 8:00 PM, Sat-Sun: 9:00 AM - 8:00 PM",,,,480-703-4872,http://www.creativityandmovement.com,wellofcreations@gmail.com,,"Without exception, Creativity and Movement offers fun programs that can be tweaked to meet the needs of your school or organization.  We offer art program, kids yoga, drum and music circles and hula hooping classes SPECIFICALLY GEARED to your age groups.  We specialize in working with groups ages 4-10.   Ideally we structure our programs for groups of 4-15 children to give each child a more intimate experience.  We bring all equipment and supplies to you.  Experience the difference that having a joy filled and creatively passionate teacher makes in igniting the hearts of your children",0,http://hulafrogportal.com/sugar/dev/uploads/thumbnail_1426168109564718813.jpg
http://hulafrog.com/chandler-az/josey-s-art-school-chandler-c4/,Josey's Art School,"2954 North Oregon StreetChandler, AZ 85225",Arts,Arts,,,,,,,,,,,480-359-0180,http://www.joseysartschool.com,wellofcreations@gmail.com,,"Each child will create 2 9x12 paintings in mixed media format.  We will use acrylic paint, watercolors, glue, collage paper and stencils to design one of a kind creations straight from the child's imagination.  I give step by step instructions but the children are also allowed to create as their hearts desire.  



This program was developed by me and taps into pattern making, color mixing, layering and individuality.



What size party will this work for?

I would recommend the party attendance range between 4 to 8 girls



Who are the parties geared toward?

I specialize in teaching 6 to 9 year old girls with the themes I have developed but I am open to discussing other themes for older/younger children.",0,http://hulafrog.com/hulastock/subcat/Default-Image-Camps-Arts-and-Crafts.jpg
http://hulafrog.com/chandler-az/mesa-arts-center-mesa-61/,Mesa Arts Center,"One East Main StreetMesa, AZ 85201",Arts,Arts,,,,,,,,,,,480-644.6500,http://www.mesaartscenter.com/index.php,artscenterinfo@mesaartscenter.com,,"Everyone will find something of interest at our facility and within our arts programming. The MAC is centrally located in the heart of downtown Mesa, at the southeast corner of Center and Main streets. We offer plentiful, nearby parking on our own surface lot, on adjacent streets, and on several public parking lots within an easy two-block walk.",0,http://hulafrog.com/hulastock/subcat/Default-Image-Camps-Arts-and-Crafts.jpg
http://hulafrog.com/chandler-az/nesting-place-preschool-gilbert-2f/,Nesting Place Preschool,"202 s. Gilbert RdGilbert, AZ 85296",,"Arts, Cooking, Nature, Religious",Preschools,Daycare,,,,,M-F 7:00AM- 5:30PM,,,,602-430-2394,http://www.nestingplacepreschool.com,simplysimoneaz@gmail.com,https://www.facebook.com/nestingplacepreschool,"Nesting Place is inspired by the creative playful nature of children. Guided by the Reggio Approach to Early Childhood Education, we offer a unique learning environment. At Nesting Place children have time to explore interests, pursue questions, create theories and extend knowledge. ",0,http://hulafrogportal.com/sugar/dev/uploads/thumbnail_14092681161130492655.jpg
http://hulafrog.com/chandler-az/ultimate-play-date-scottsdale-c1/,Ultimate Play Date,Outside on the Mall at Scottsdale'  s Civic Center LibraryScottsdale 85255,,,,,,,,,,No,"Babies, Preschoolers, Elementary",,480.312.7050,http://www.scottsdalelibrary.org/ultimateplaydate,,, We will be at this years ULTIMATE PLAY DATE! Come and play some FREE Sportball games with us. ,4,http://hulafrogportal.com/sugar/dev/uploads/thumbnail_1428008011765967922.png
http://hulafrog.com/chandler-az/connect5family-center-of-chandler--c7/,Connect5Family Center of Chandler,"222 East Warner Road, AZ 85255","Arts, Dance, Learning, Music, Sports, Other","All, Arts, Dance, Music, Sports, Other",,,,Party Places,,,Mon. - Sat.: 9:00 AM - 7:00 PM;Sunday: 12:00 PM - 5:00 PM,,,,480-699-2122,http://www.Connect5FC.com,chandler@connect5fc.com,https://www.facebook.com/Connect5FamilyCentersOfChandler,"Welcome to the neighborhood!  Actually, there're five neighborhoods for you to explore.  Develop the mind and body by stepping through the gates and onto the mats as you begin your journey in Villari's Martial Arts.  Children can run jump, play and learn in Discovery Park.  Families can enjoy a delicious meal in Kicks Cafe.  Register for a Mind and Motion workshop and explore music, dance, fitness, stress management, arts and crafts, and more.  Plan a Spotlight Celebrations for your special event, or celebrate with friends by choosing one of our Adventure Birthday Packages.

We serve as a true center; a hub that brings together family, friends, students, educators, and community.  It's all about connection.  It's about families learning and playing together and friends celebrating each other's special moments.  It's about reinforcing educator's efforts to provide 21st century learning opportunities for students by providing tools and programs that help them succeed at home and in school. You'll also see us out in the community supporting local events, groups, and   charities.     
",9,http://hulafrog.com/hulastock/subcat/Default-Image-Places-Other.jpg
http://hulafrog.com/chandler-az/let-s-play-music-with-kendra-flake-mesa-apache-junction-ca/,Let's Play Music with Kendra Flake,"10649 E. Bramble Ave.Mesa, Apache Junction, AZ 85208",Music,,,,,,,,"Classes are scheduled at various times Monday - Friday, 9:00 - 6:00. Please see my schedules page.",,,,480-577-7104,http://www.letsplaymusicsite.com,misskendrasmusic@gmail.com,,"Group music lessons for children that emphasize total musicianship through piano playing, singing, classical music, note reading, and ear training. The Mom and Me classes provide excellent music training designed for 2-4 year-olds and their parents. The school-age curriculum is a 3-year program designed for children entering the program at age 4-5. By the time your child graduates from the program at age 7-8, they will have many skills to help them soar in any music lessons of choice. They will be playing the piano with two hands, singing in harmony, and will have the skills to write her/his own music!",2,http://hulafrog.com/hulastock/subcat/Default-Image-Classes-Music.jpg
http://hulafrog.com/chandler-az/chandler-gilbert-family-ymca--29/,Chandler/Gilbert Family YMCA,"1655 West Frye Road, AZ 85224","Acting, Arts, Cooking, Dance, Gymnastics, Learning, Languages, Martial, Nature, Music, Sports, Swim, Other","Academic, All, Arts, Cooking, Dance, Music, Sports, Swim",,,"Indoor, Other",Party Places,http://www.valleyymca.org/selectionETLAH.cfm,http://www.valleyymca.org/selectionCamp.cfm,Mon. - Sun.: 12:00 AM - 12:00 AM,,,,480-899-9622,http://www.valleyymca.org/chandlergilbert,rtrulove@vosymca.org,https://www.facebook.com/ChandlerGilbertYMCA,"1655 West Frye Road,Chandler, AZ 85224Phone: (480) 899-9622  Jessie Sands, Executive Director Hours:Mon-Thu 5:00AM to 10:00PM Friday 5:-00AM to 9:30PM Saturday 7:00AM to 6:00PM Sunday 11:00AM to 4:00PM",2,http://hulafrog.com/hulastock/subcat/Default-Image-Places-Other.jpg
http://hulafrog.com/chandler-az/nesting-place-preschool-gilbert-2f/,Nesting Place Preschool,"202 s. Gilbert RdGilbert, AZ 85296",,"Arts, Cooking, Nature, Religious",Preschools,Daycare,,,,,M-F 7:00AM- 5:30PM,,,,602-430-2394,http://www.nestingplacepreschool.com,simplysimoneaz@gmail.com,https://www.facebook.com/nestingplacepreschool,"Nesting Place is inspired by the creative playful nature of children. Guided by the Reggio Approach to Early Childhood Education, we offer a unique learning environment. At Nesting Place children have time to explore interests, pursue questions, create theories and extend knowledge. ",0,http://hulafrogportal.com/sugar/dev/uploads/thumbnail_14092681161130492655.jpg
http://hulafrog.com/chandler-az/ultimate-play-date-scottsdale-c1/,Ultimate Play Date,Outside on the Mall at Scottsdale'  s Civic Center LibraryScottsdale 85255,,,,,,,,,,No,"Babies, Preschoolers, Elementary",,480.312.7050,http://www.scottsdalelibrary.org/ultimateplaydate,,, We will be at this years ULTIMATE PLAY DATE! Come and play some FREE Sportball games with us. ,4,http://hulafrogportal.com/sugar/dev/uploads/thumbnail_1428008011765967922.png
http://hulafrog.com/chandler-az/connect5family-center-of-chandler--c7/,Connect5Family Center of Chandler,"222 East Warner Road, AZ 85255","Arts, Dance, Learning, Music, Sports, Other","All, Arts, Dance, Music, Sports, Other",,,,Party Places,,,Mon. - Sat.: 9:00 AM - 7:00 PM;Sunday: 12:00 PM - 5:00 PM,,,,480-699-2122,http://www.Connect5FC.com,chandler@connect5fc.com,https://www.facebook.com/Connect5FamilyCentersOfChandler,"Welcome to the neighborhood!  Actually, there're five neighborhoods for you to explore.  Develop the mind and body by stepping through the gates and onto the mats as you begin your journey in Villari's Martial Arts.  Children can run jump, play and learn in Discovery Park.  Families can enjoy a delicious meal in Kicks Cafe.  Register for a Mind and Motion workshop and explore music, dance, fitness, stress management, arts and crafts, and more.  Plan a Spotlight Celebrations for your special event, or celebrate with friends by choosing one of our Adventure Birthday Packages.

We serve as a true center; a hub that brings together family, friends, students, educators, and community.  It's all about connection.  It's about families learning and playing together and friends celebrating each other's special moments.  It's about reinforcing educator's efforts to provide 21st century learning opportunities for students by providing tools and programs that help them succeed at home and in school. You'll also see us out in the community supporting local events, groups, and   charities.     
",9,http://hulafrog.com/hulastock/subcat/Default-Image-Places-Other.jpg
http://hulafrog.com/chandler-az/let-s-play-music-with-kendra-flake-mesa-apache-junction-ca/,Let's Play Music with Kendra Flake,"10649 E. Bramble Ave.Mesa, Apache Junction, AZ 85208",Music,,,,,,,,"Classes are scheduled at various times Monday - Friday, 9:00 - 6:00. Please see my schedules page.",,,,480-577-7104,http://www.letsplaymusicsite.com,misskendrasmusic@gmail.com,,"Group music lessons for children that emphasize total musicianship through piano playing, singing, classical music, note reading, and ear training. The Mom and Me classes provide excellent music training designed for 2-4 year-olds and their parents. The school-age curriculum is a 3-year program designed for children entering the program at age 4-5. By the time your child graduates from the program at age 7-8, they will have many skills to help them soar in any music lessons of choice. They will be playing the piano with two hands, singing in harmony, and will have the skills to write her/his own music!",2,http://hulafrog.com/hulastock/subcat/Default-Image-Classes-Music.jpg
http://hulafrog.com/chandler-az/connect5family-center-of-chandler--c7/,Connect5Family Center of Chandler,"222 East Warner Road, AZ 85255","Arts, Dance, Learning, Music, Sports, Other","All, Arts, Dance, Music, Sports, Other",,,,Party Places,,,Mon. - Sat.: 9:00 AM - 7:00 PM;Sunday: 12:00 PM - 5:00 PM,,,,480-699-2122,http://www.Connect5FC.com,chandler@connect5fc.com,https://www.facebook.com/Connect5FamilyCentersOfChandler,"Welcome to the neighborhood!  Actually, there're five neighborhoods for you to explore.  Develop the mind and body by stepping through the gates and onto the mats as you begin your journey in Villari's Martial Arts.  Children can run jump, play and learn in Discovery Park.  Families can enjoy a delicious meal in Kicks Cafe.  Register for a Mind and Motion workshop and explore music, dance, fitness, stress management, arts and crafts, and more.  Plan a Spotlight Celebrations for your special event, or celebrate with friends by choosing one of our Adventure Birthday Packages.

We serve as a true center; a hub that brings together family, friends, students, educators, and community.  It's all about connection.  It's about families learning and playing together and friends celebrating each other's special moments.  It's about reinforcing educator's efforts to provide 21st century learning opportunities for students by providing tools and programs that help them succeed at home and in school. You'll also see us out in the community supporting local events, groups, and   charities.     
",9,http://hulafrog.com/hulastock/subcat/Default-Image-Places-Other.jpg
http://hulafrog.com/chandler-az/baker-school-of-music-san-tan-gilbert-f0/,Baker School of Music - San Tan,"2270 E Williamsfield Rd, Ste 104Gilbert, AZ 85295","Acting, Dance, Music, Other","Dance, Music, Performing",,,,,,http://bakerschoolofmusic.com,,,,,480-313-6763,http://bakerschoolofmusic.com/,ClydeBakerJr@aol.com,,"The Baker School of Music/Dance/Drama provides an enriching experience in the Performing Arts: Music, Dance, Drama for children ages 3 and up.",5,http://hulafrog.com/hulastock/subcat/Default-Image-Camps-Dance.jpg
http://hulafrog.com/chandler-az/dance-connection-2-chandler-77/,Dance Connection 2,"2250 E Germann RoadChandler, AZ 85286",Dance,Dance,,,,,http://www.danceconnection2.com/#!classes,,"MON: 3:30 PM-8:00 PM, TUES-WED: 9:00 AM-1:00 PM, 3:30 PM-8:00 PM, THURS: 3:30 PM-8:00 PM, FRI: 3:30 PM-6:00 PM, SAT: 9:00 AM-1:00PM",,,,(480) 558-2055,http://www.danceconnection2.com/,gilbertdancer@yahoo.com,,"Dance Connection 2 is a family owned and operated dance studio which focuses on recreational classes, dance company for more advanced dancers, and kindergarten preparation through their P.A.K.K. program.",3,http://hulafrog.com/hulastock/subcat/Default-Image-Camps-Dance.jpg
